name,link,cost for 2,cuisines,ratings,reviews,address
"ambika bhaji pav Restaurant, Bapunagar",https://www.zomato.com/ahmedabad/ambika-bhaji-pav-bapunagar,150,Street Food,NEW,," Shop 4, Opposite Bapu Nagar BST Bus Stop, Bapunagar, Ahmedabad"
"nasto Restaurant, Airport Gandhinagar Highway",https://www.zomato.com/ahmedabad/nasto-airport-gandhinagar-highway-gandhinagar,400,"Fast Food, Street Food, Chinese",NEW,," Shop 16, Radhe Square Building, Kudasan, Reliance Crossroads, Airport Gandhinagar Highway, Gandhinagar"
"maggi wala Restaurant, Satellite",https://www.zomato.com/ahmedabad/maggi-wala-satellite,300,"North Indian, Street Food, Beverages",-,," Chitrakut Apartment, Satellite, Ahmedabad"
"fit food proteins Restaurant, Nikol",https://www.zomato.com/ahmedabad/fit-food-proteins-nikol,250,North Indian,-,," B-104, Gajanand Home, Near Victoria Residency, Pashawanath Township, Krishna Nagar, Nikol, Ahmedabad"
"drashti live puff Restaurant, Nikol",https://www.zomato.com/ahmedabad/drashti-live-puff-nikol,300,Fast Food,NEW,," Shop 5, Angan Residency, Near Dipak School, Opposite Divya Jivan Flat, Nikol, Ahmedabad"
"chilly china Restaurant, Sarkhej",https://www.zomato.com/ahmedabad/chilly-china-sarkhej,350,"Chinese, Fast Food, Beverages",-,," Survey 71, Plot 9-10, Aabad Arcade, Opposite Al Asbab Park, Makarba, Sarkhej, Ahmedabad"
"south dosa Restaurant, Naroda",https://www.zomato.com/ahmedabad/south-dosa-naroda,300,South Indian,-,," 1, Avani Icon, Haridarshan Cross Road, Naroda, Ahmedabad"
"karnavati dabeli center Restaurant, Nava Vadaj",https://www.zomato.com/ahmedabad/karnavati-dabeli-center-nava-vadaj,200,"Fast Food, Street Food",-,," Shop 13, Ashirwad Complex, Opposite Shalby Hospital, Haridarsan Cross Road, Nava Vadaj, Ahmedabad"
"shree danu krupa tiffin service Restaurant, Ghatlodia",https://www.zomato.com/ahmedabad/shree-danu-krupa-tiffin-service-ghatlodia,200,Gujarati,NEW,," C/106, Preet Homes, Janta Nagar Road, Ghatlodia, Ahmedabad"
"khana parcel Restaurant, Paldi",https://www.zomato.com/ahmedabad/khana-parcel-paldi,400,"Chinese, North Indian",-,," G 10, Sahajananad Plaza, Paldi, Ahmedabad"
"meals bowl Restaurant, Thaltej",https://www.zomato.com/ahmedabad/meals-bowl-thaltej,500,Healthy Food,-,," 9th Harmony Icon, 100 Feet, Hebatpur Road, Near Baghban Party Plot, Cross Road, Thaltej, Ahmedabad"
"jay kalyan pauva corner Restaurant, Satellite",https://www.zomato.com/ahmedabad/jay-kalyan-pauva-corner-1-satellite,150,"Street Food, South Indian",NEW,," Shop 4, Opposite Star Bazar, Iscon Park, Satellite, Ahmedabad"
"bherunath maggi pasta Restaurant, Navrangpura",https://www.zomato.com/ahmedabad/bherunath-maggi-pasta-navrangpura,300,"Fast Food, Italian",-,," Opposite H.l College, Navrangpura, Ahmedabad"
"gokul paratha Restaurant, Ellis Bridge",https://www.zomato.com/ahmedabad/gokul-paratha-ellis-bridge,350,"Chinese, Gujarati, North Indian",-,," Kalgi House, Kalgi Cross Road, Near Chirag Motors, Ellis Bridge, Ahmedabad"
"radhe fast food Restaurant, Satellite",https://www.zomato.com/ahmedabad/radhe-fast-food-satellite,200,Fast Food,-,," 01, Ground Floor, Devpriya Complex, Near Shivalik Bunglows, Satellite, Ahmedabad"
"choc o den Restaurant, Navrangpura",https://www.zomato.com/ahmedabad/choc-o-den-navrangpura,400,"Bakery, Desserts",3.7,44," G 5, Shivam Complex, Behind HL Commerce College, Navrangpura, Ahmedabad"
"sweet like Restaurant, Paldi",https://www.zomato.com/ahmedabad/sweet-like-that-paldi,400,"Desserts, Bakery",3.3,14," 27, Roop Bunglow, Sanjeev Baug Society, New Sharda Mandir Road, Paldi, Ahmedabad"
"chaska Restaurant, Vastrapur",https://www.zomato.com/ahmedabad/chaska-vastrapur,400,Fast Food,3.2,49," 15, Saman Complex, Near Karnavati Pagarkha, Mansi Circle, Vastrapur, Ahmedabad"
"karnavati dabeli vadapav Restaurant, Airport Gandhinagar Highway",https://www.zomato.com/ahmedabad/karnavati-dabeli-and-vadapav-1-airport-gandhinagar-highway-gandhinagar,300,"Gujarati, Fast Food, Street Food",3.5,34," Shop 9, Shrifal Heights, Opposite Radhe Crystal, Kudasan, Urja Nagar, Airport Gandhinagar Highway, Gandhinagar"
"sayona punjabi chineese Restaurant, Ghatlodia",https://www.zomato.com/ahmedabad/sayona-punjabi-chineese-ghatlodia,400,"North Indian, Chinese",3.6,63," 35/2, Ranna Park Society, Ranna Park Road, Ghatlodia, Ahmedabad"
"maruti tiffin service Restaurant, Navrangpura",https://www.zomato.com/ahmedabad/maruti-tiffin-service-navrangpura,200,"North Indian, Street Food",NEW,," 5, Nilkanth Park Banglow, Opposite Hi-Tech Apartment, HDFC Bank Road, Navrangpura, Ahmedabad"
"sanman hotel Restaurant, Ashram Road",https://www.zomato.com/ahmedabad/sanman-hotel-ashram-road,450,"North Indian, South Indian",3.8,53," Opposite Old High Court Road, Ashram Road, Ahmedabad"
"kamal sweets Restaurant, Relief Road",https://www.zomato.com/ahmedabad/kamal-sweets-1-relief-road,100,"Mithai, Street Food",3.7,59," Shop 4, Development Bank Building, Opposite Revdi Bazar Post Office, Relief Road, Ahmedabad"
"churronation Restaurant, Bodakdev",https://www.zomato.com/churronation-food-truck,400,"Desserts, Fast Food",3.6,32," Opposite Saket 3, Sindhu Bhawan Road, Bodakdev, Ahmedabad"
"navjivan restaurant Restaurant, Bapunagar",https://www.zomato.com/ahmedabad/navjivan-restaurant-bapunagar,600,"North Indian, Chinese",3.3,68," Balram Chambers, Thakkarnagar Char Rasta, Nikol Road, Bapunagar, Ahmedabad"
"bhagwati thotha Restaurant, Thaltej",https://www.zomato.com/ahmedabad/bhagwati-thotha-thaltej,300,Gujarati,NEW,," Survey 402, Shilaj C. Sardar Patel Ring Road, Thaltej, Ahmedabad"
"frankie station Restaurant, Infocity",https://www.zomato.com/ahmedabad/frankie-station-infocity-gandhinagar,250,"Fast Food, Burger, Chinese",3.4,61," Shop 29, Super Mall 1, Infocity, Gandhinagar"
"kullads Restaurant, Bopal",https://www.zomato.com/ahmedabad/kullads-bopal,350,"Fast Food, Beverages",3.5,43," C 44, SOBO Center, Gala Gymkhana Road, South, Bopal, Ahmedabad"
"marigold restaurant Restaurant, Odhav",https://www.zomato.com/ahmedabad/marigold-restaurant-odhav,450,"North Indian, Chinese",3.6,54," Vishala Landmark, Opposite Dhaval Shopping Centre, SP Ring Road, Odhav, Ahmedabad"
"chai ka bukhar Restaurant, Gurukul",https://www.zomato.com/ahmedabad/chai-ka-bukhar-gurukul,200,"Tea, Beverages, Street Food",3.9,41," Unit F 12, 1st Floor, Balaji Centre, Opposite Gurukul Temple, Gurukul, Ahmedabad"
"yumazing foods Restaurant, Gurukul",https://www.zomato.com/ahmedabad/yumazing-foods-gurukul,350,"North Indian, Fast Food",3.2,56," Shop 16 Raju Complex Opposite Vishva Bharti School, Gurukul, Ahmedabad"
"casa della pizza Restaurant, Nava Vadaj",https://www.zomato.com/ahmedabad/casa-della-pizza-1-nava-vadaj,300,Italian,4,73," 17/4, Tulsi Shyam Flats, Bhimjipura Cross Roads, Nava Vadaj, Ahmedabad"
"jugaadi adda Restaurant, Satellite",https://www.zomato.com/ahmedabad/jugaadi-adda-satellite,200,Fast Food,NEW,," Sudarshan Complex, Judges Bunglow Road, Suryapooja Block B, Satellite, Ahmedabad"
"madhurya Restaurant, Vejalpur",https://www.zomato.com/ahmedabad/madhurya-vejalpur,800,"Rajasthani, Gujarati",3.6,58," Near Jivraj Tolnaka, Ambaji Temple, Malav Talav, Vejalpur, Ahmedabad"
"pathikashram atithya restaurant Restaurant, Sector 11, Gandhinagar",https://www.zomato.com/ahmedabad/pathikashram-atithya-restaurant-sector-11-gandhinagar,500,Gujarati,3.3,42," Near S T Depot, GH 3 Circle, GH Road, Sector 11, Gandhinagar"
"mansuri halwa Restaurant, Bhadra",https://www.zomato.com/ahmedabad/mansuri-halwa-bhadra,200,Mishti,4,73," 1161/3, Opposite BSNL Office, Bhadra, Ahmedabad"
"jagdish chaat pakodi centre Restaurant, Navrangpura",https://www.zomato.com/ahmedabad/jagdish-chaat-pakodi-centre-navrangpura,200,Street Food,3.9,54," Opposite Memnagar Fire Station, Navrangpura, Ahmedabad"
"egg box Restaurant, Bodakdev",https://www.zomato.com/ahmedabad/egg-box-bodakdev,500,"Fast Food, North Indian",2.8,47," Near Kalibari Mandir, Rajpath Club, Bodakdev, Ahmedabad"
"european shakes cafe orient club Restaurant, Ellis Bridge",https://www.zomato.com/ahmedabad/the-european-shakes-and-cafe-orient-club-ellis-bridge,550,"Chinese, North Indian, Fast Food",3.5,56," Plot 578/2, The Orient Club, Kavi Nanalal Marg, Near Gujarat College Railway Crossing, Ellis Bridge, Ahmedabad"
"gir rajwadi restaurant Restaurant, Adalaj",https://www.zomato.com/ahmedabad/gir-rajwadi-restaurant-2-adalaj,500,"North Indian, Gujarati",3.5,42," Beside Bharat Petrol Pump, Adalaj, Ahmedabad"
"cake2homescom Restaurant, Paldi",https://www.zomato.com/ahmedabad/cake2homes-com-paldi,350,"Bakery, Desserts",3.8,65," Damubhai Colony, Paldi, Ahmedabad"
"nisar hotel Restaurant, Sarkhej",https://www.zomato.com/ahmedabad/nisar-hotel-sarkhej,250,North Indian,3.6,47," Shop 13, Sonal Char Rasta, Juhapura, Near Haji Bawa Dargah, Sarkhej, Ahmedabad"
"yumla Restaurant, Mani Nagar",https://www.zomato.com/ahmedabad/yumla-mani-nagar,400,Fast Food,3.9,55," Shop 15, Harikrupa Shopping Center, Bhalakiya Bus Stand, Mani Nagar, Ahmedabad"
"foodera Restaurant, Vastrapur",https://www.zomato.com/ahmedabad/foodera-vastrapur,300,"North Indian, Chinese, Italian, Mexican, Fast Food",3.7,49," 153, 14/1, Vastrapur Gam, Opposite Shree Kamnath Mahadev Mandir, Vastrapur, Ahmedabad"
"chocobell Restaurant, Navrangpura",https://www.zomato.com/ahmedabad/chocobell-navrangpura,300,Desserts,3.7,44," Soni Hostel, HL Road, Navrangpura, Ahmedabad"
"vices spices food Restaurant, Vasna",https://www.zomato.com/ahmedabad/vices-and-spices-food-vasna,350,North Indian,3.5,30," C-12, 1st Floor, Sambhavtirth Flat, Behind Telephone Exchange, Vasna, Ahmedabad"
"puff king Restaurant, Nikol",https://www.zomato.com/ahmedabad/puff-king-nikol,150,Fast Food,NEW,," 18, Ground Floor, Platinum Plaza, Shukan Bunglows, Opposite Kunj Mall, New India Colony Road, Nikol, Ahmedabad"
"gul bakers Restaurant, Satellite",https://www.zomato.com/ahmedabad/gul-bakers-satellite,350,"Bakery, Desserts",3.4,19," Level 1, Inside Osia Hypermart, Dev Arc Mall, Near Iscon Circle, SG Highway, Satellite, Ahmedabad"
"pandya ice world Restaurant, Sector 16, Gandhinagar",https://www.zomato.com/ahmedabad/pandya-ice-world-sector-16-gandhinagar,250,"Desserts, Beverages",3.4,37," 381/3, Opposite DCB Bank, Sector 16, Gandhinagar"
"udta punjab Restaurant, Vastrapur",https://www.zomato.com/ahmedabad/udta-punjab-vastrapur,300,Fast Food,3.2,48," A-12, Shubhlaxmi Flat, L.J College Road, Near Anik Apartment, Vastrapur Gam Vastrapur"
"raj chole puri Restaurant, Gurukul",https://www.zomato.com/ahmedabad/raj-chole-puri-gurukul,200,"Biryani, Street Food, Gujarati, North Indian",3.6,38," 15, Raju Complex, Gurukul Road, Gurukul, Ahmedabad"
"mba wala Restaurant, Chandkheda",https://www.zomato.com/ahmedabad/mba-wala-chandkheda,300,"Fast Food, North Indian",3.6,34," B/02, Samruddhi Residency, Ashok Vihar, Chandkheda, Ahmedabad"
"hot spot Restaurant, Vastrapur",https://www.zomato.com/ahmedabad/the-hot-spot-vastrapur,450,"Chinese, Italian, North Indian, Mexican",3.4,32," Cantene-6, Amdavad Haat, Aurbindo Soc.Road, Near Vastrapur Lake, Vastrapur, Ahmedabad"
"brick ovens Restaurant, Bopal",https://www.zomato.com/ahmedabad/brick-ovens-bopal,200,"Bakery, Desserts",3.2,17," A/9, 63, Green Field, Applewood Township, Bopal, Ahmedabad"
"deli @ square hotel novotel Restaurant, Satellite",https://www.zomato.com/ahmedabad/deli-@-the-square-hotel-novotel-satellite,100,"Desserts, Bakery",3.5,33," Novotel Ahmedabad, Iskcon Cross Road, S.G. Highway, Satellite, Ahmedabad"
"balaji poha house Restaurant, Satellite",https://www.zomato.com/ahmedabad/balaji-poha-house-1-satellite,100,Street Food,3.4,37," S.G. Highway, Near Prahalad Nagar Garden, Opposite Nexa Showroom, Satellite, Ahmedabad"
"costa rica cafe Restaurant, Nikol",https://www.zomato.com/ahmedabad/the-costa-rica-cafe-nikol,"1,100","Cafe, Italian, Fast Food",3.8,32," 1st Floor, Vishala Suprime, S.P. Ring Road, Opposite Torrent Power Station, Nikol, Ahmedabad"
"cake walk Restaurant, Thaltej",https://www.zomato.com/ahmedabad/cake-walk-thaltej,500,"Cafe, Desserts",2.2,22," Ground Floor, Acropolis Mall, S G Highway, Thaltej, Ahmedabad"
"upper deck Restaurant, Infocity",https://www.zomato.com/ahmedabad/upper-deck-infocity-gandhinagar,700,"Cafe, Italian, Mexican, North Indian",3.4,28," 6th Floor, Pramukh Tangent, Sargasan, Infocity, Gandhinagar"
"south land Restaurant, Prahlad Nagar",https://www.zomato.com/ahmedabad/south-land-prahlad-nagar,200,"South Indian, Chinese, Street Food, Sandwich",3.7,43," Opposite Prahladnagar Garden, Prahlad Nagar, Ahmedabad"
"smokyzz grill barbeque Restaurant, Prahlad Nagar",https://www.zomato.com/ahmedabad/smokyzz-grill-barbeque-prahlad-nagar,"2,000","North Indian, BBQ",3.5,20," Hotel Ramada, Corporate Road, Opposite Prahlad Nagar Garden, Prahlad Nagar, Ahmedabad"
"lassi corner Restaurant, Chandkheda",https://www.zomato.com/ahmedabad/lassi-corner-chandkheda,250,"Beverages, Ice Cream",3.4,28," Sahyog Plaza, Kalol Road, Motera, Opposite Vishwakarma Goverment Engineering College, Chandkheda, Ahmedabad"
"1 panjabi fastfood Restaurant, Sector 16, Gandhinagar",https://www.zomato.com/ahmedabad/a-1-panjabi-fastfood-sector-16-gandhinagar,450,"North Indian, Chinese, Gujarati, Street Food",3.3,23," GH -5, Chopati, Sector 16, Gandhinagar"
"delicious food Restaurant, Sector 16, Gandhinagar",https://www.zomato.com/ahmedabad/delicious-food-sector-16-gandhinagar,200,"Street Food, South Indian",3.5,25," Near 10 B, Sector 16, Gandhinagar"
"ffc Restaurant, Gota",https://www.zomato.com/ahmedabad/ffc-gota,300,"North Indian, Chinese, Fast Food",3.5,17," Opposite New Auda Garden, S G Highway, Gota, Ahmedabad"
"gangdhar restaurant Restaurant, Odhav",https://www.zomato.com/ahmedabad/gangdhar-restaurant-odhav,250,Street Food,3.5,21," Shop 1, Tajendranagar Society, Near Hanuman Temple, Viratnagar Road, Odhav, Ahmedabad"
"egg factory Restaurant, Navrangpura",https://www.zomato.com/ahmedabad/the-egg-factory-navrangpura,400,Fast Food,2.6,25," 22, 2nd Floor, Sarovar Complex, Jain Derasar Gali, Cross Road, Navrangpura, Ahmedabad"
"chef aarti tejwani Restaurant, Mani Nagar",https://www.zomato.com/ahmedabad/chef-aarti-tejwani-mani-nagar,250,Bakery,3.7,19," Mani Nagar, Ahmedabad"
"gravitic juice Restaurant, Infocity",https://www.zomato.com/ahmedabad/gravitic-juice-infocity-gandhinagar,250,"Juices, Salad",3.3,21," G 204, Ratnaraj Residency, Sargasan, Behind Siddharaj Zori, Infocity, Gandhinagar"
"anand pizza snacks Restaurant, Prahlad Nagar",https://www.zomato.com/ahmedabad/anand-pizza-snacks-prahlad-nagar,250,"Pizza, Fast Food, Street Food, Ice Cream, Beverages",3.3,16," Opposite Dairy Den, Anand Nagar Cross Road, Prahlad Nagar, Ahmedabad"
"shreeji dairy Restaurant, Ghatlodia",https://www.zomato.com/ahmedabad/shreeji-dairy-ghatlodia,200,Mithai,3.5,33," G-5, Aastha Complex, Near Allahabad Bank, Prabhat Chowk, Ghatlodia, Ahmedabad"
"shree paras bakery Restaurant, Vastral",https://www.zomato.com/ahmedabad/shree-paras-bakery-vastral,250,Bakery,3.2,9," Shop 32, Shashwat Mahadev 1, Opposite Dharti Status, RTO Road, Vastral, Ahmedabad"
"kathiyavadi Restaurant, Airport Gandhinagar Highway",https://www.zomato.com/ahmedabad/kathiyavadi-airport-gandhinagar-highway-gandhinagar,300,"Gujarati, North Indian",2.7,21," Shop No. 5,6, Shree Rang Hights, Bhaijipura Patiya, P.D.P.U Road, Kudasan, Gandhinagar, Ahmedabad."
"charcoal bites Restaurant, Bodakdev",https://www.zomato.com/ahmedabad/the-charcoal-bites-bodakdev,400,"Sandwich, Fast Food, Italian",3.1,6," Shop 10, SBR Social, Beside ARA, Sindhu Bhavan Marg, PRL Colony, Bodakdev, Ahmedabad"
"r andhra cafe Restaurant, Sector 6, Gandhinagar",https://www.zomato.com/ahmedabad/r-andhra-cafe-sector-6-gandhinagar,200,South Indian,3.4,20," Shop 2, Shopping Complex, Near Vishal Super Market, Sector 6, Gandhinagar"
"morning time Restaurant, Prahlad Nagar",https://www.zomato.com/ahmedabad/the-morning-time-prahlad-nagar,150,Fast Food,2.6,30," Prahlad Nagar, Ahmedabad"
"mithai more Restaurant, Bopal",https://www.zomato.com/ahmedabad/mithai-more-bopal,200,"Mithai, Gujarati, South Indian, Fast Food",3.6,30," Shop 1 & 2, Gala Magnus, Near SOBO Centre, South Bopal, Bopal, Ahmedabad"
"badshah dairy products Restaurant, Paldi",https://www.zomato.com/ahmedabad/badshah-dairy-products-paldi,300,Mithai,2.8,38," Mahalaxmi Cross Road, Paldi, Ahmedabad"
"tasty food Restaurant, Chandlodia",https://www.zomato.com/ahmedabad/the-tasty-food-chandlodia,350,"South Indian, Street Food",3.5,38," Shop 5 & 6, Shriji Residency, Silver Star Road, Chandlodia, Ahmedabad"
"lutf e daawat Restaurant, Gurukul",https://www.zomato.com/ahmedabad/lutf-e-daawat-gurukul,600,"North Indian, Mughlai",3.4,32," 14, 1st Floor, Sterling Shopping Center, Near Asia School, Drive in Road, Gurukul, Ahmedabad"
"madras food corner Restaurant, Mani Nagar",https://www.zomato.com/ahmedabad/madras-food-corner-mani-nagar,250,South Indian,3.5,36," 5B, Vishal Complex, Near Sai Baba Mandir, Daxini Society, Mani Nagar, Ahmedabad"
"sonas kitchen Restaurant, Gurukul",https://www.zomato.com/ahmedabad/sonas-kitchen-gurukul,300,"Gujarati, North Indian",3.7,27," B-602, Purvi Towers, Near Subhash Chowk, Gurukul Road, Gurukul, Ahmedabad"
"petpooja Restaurant, Prahlad Nagar",https://www.zomato.com/ahmedabad/petpooja-prahlad-nagar,250,North Indian,3,34," 22, Ground Floor, Anand Nagar Shopping Complex, Near Shell Petrol Pump, Prahlad Nagar, Ahmedabad"
"sagar sandwich Restaurant, Ashram Road",https://www.zomato.com/ahmedabad/sagar-sandwich-ashram-road,200,Fast Food,3.6,36," Near Vallabhh Sadan Temple, Delite Circle, Ashram Road, Ahmedabad"
"shree jay janta ice cream Restaurant, Satellite",https://www.zomato.com/ahmedabad/shree-jay-janta-ice-cream-1-satellite,200,"Ice Cream, Desserts, Beverages",3.4,28," 5 & 6, Pujan Apartment, Opposite Seema Party Plot, Anand Nagar Road, Satellite, Ahmedabad"
"foodiesta Restaurant, Gurukul",https://www.zomato.com/ahmedabad/foodiesta-gurukul,750,"North Indian, Fast Food, South Indian",3.4,34," 1st Floor, JB Tower, Opposite Doordarshan Kendra, Drive In Road, Gurukul, Ahmedabad"
"avadh restaurant Restaurant, Vejalpur",https://www.zomato.com/ahmedabad/avadh-restaurant-vejalpur,600,"North Indian, Chinese, Fast Food",3.6,33," Hotel Avadh Inn, Avadh Arcade, Near Shell Petrol Pump, APMC 132 Feet Ring Road, Jivraj Park, Vejalpur, Ahmedabad"
"chor bazaar bistro Restaurant, Bodakdev",https://www.zomato.com/ahmedabad/chor-bazaar-bistro-bodakdev,"1,000","North Indian, Modern Indian",3.2,20," Ground Floor, Elanza Vertex, Behind Armieda, Sindhu Bhavan Road, Bodakdev, Ahmedabad"
"dudhia dairy Restaurant, Isanpur",https://www.zomato.com/ahmedabad/dudhia-dairy-isanpur,100,Mithai,3.4,41," C-1/2/3, Aakansha Apartment, Near Jaymala Bus Stand, Isanpur, Ahmedabad"
"radhe rajwadi Restaurant, Adalaj",https://www.zomato.com/ahmedabad/radhe-rajwadi-adalaj,500,"North Indian, Rajasthani, Fast Food, Street Food",3.4,31," Vaishnodevi Circle, SG Highway, Adalaj, Ahmedabad"
"chulha choki Restaurant, Gota",https://www.zomato.com/ahmedabad/chulha-choki-gota,250,North Indian,NEW,," Near Vaishnodevi Circle, S.G Highway, Gota, Ahmedabad"
"patel topping ice cream Restaurant, Ghatlodia",https://www.zomato.com/ahmedabad/patel-topping-ice-cream-ghatlodia,100,Ice Cream,NEW,," Near Panchdev Mahadev Mandir, KK Nagar Road, Ghatlodia, Ahmedabad"
"yummy twist cakes Restaurant, Isanpur",https://www.zomato.com/ahmedabad/yummy-twist-cakes-isanpur,250,Bakery,-,," Near Kankuba School, Isanpur, Ahmedabad"
"shreeji snacks Restaurant, Nikol",https://www.zomato.com/ahmedabad/shreeji-snacks-1-nikol,200,Fast Food,-,," Platinum Plaza, Opposite Kunj Mall, Nikol Road, Nikol, Ahmedabad"
"green forest restaurant Restaurant, Vastral",https://www.zomato.com/ahmedabad/green-forest-restaurant-vastral,400,"North Indian, Fast Food",-,," 41, Green Forest Bungalow, Opposite Satsang Villa, Odhav- Vastral Vastral, Ahmedabad"
"biryani kitchen Restaurant, Bapunagar",https://www.zomato.com/ahmedabad/biryani-kitchen-bapunagar,400,Biryani,-,," SF/ 213, Shyam Shikhar Complex, Road Tax Ground, Bapunagar, Ahmedabad"
"tea coffee etc Restaurant, Bapunagar",https://www.zomato.com/ahmedabad/tea-coffee-etc-bapunagar,200,Beverages,-,," 213, 2nd Floor, Shyam Shikhar Complex, R. Tax Ground, Bapunagar, Ahmedabad"
"biryani hazir ho Restaurant, Satellite",https://www.zomato.com/ahmedabad/biryani-hazir-ho-satellite,600,"Biryani, Mughlai, North Indian",NEW,," Shop 2, Jaydeep Apartment, Jivraj Park, Near Times Of India, Satellite, Ahmedabad"
"alkon restaurant Restaurant, Ashram Road",https://www.zomato.com/ahmedabad/alkon-restaurant-ashram-road,300,"Fast Food, Street Food",-,," 1, Metro Commercial Center, Behind ICICI Bank Income Tax, Old High C.T Road, Ashram Road, Ahmedabad"
"rajwadi dalbati churma Restaurant, Gota",https://www.zomato.com/ahmedabad/rajwadi-dalbati-churma-gota,250,Rajasthani,-,," F3, Near Jay Meldi Maa, Sarodi, Gota, Ahmedabad"
"big bites Restaurant, Gota",https://www.zomato.com/ahmedabad/big-bites-gota,300,"Street Food, Fast Food, North Indian",NEW,," S.G. Highway, Near Vaishnodevi Temple, Gota, Ahmedabad"
"
raj shree tee fast food Restaurant, Vejalpur",https://www.zomato.com/ahmedabad/raj-shree-tee-and-fast-food-vejalpur,250,"Fast Food, Street Food",-,," 11, Dev Aurum, Anand Nagar Road, Vejalpur, Ahmedabad"
"casa blanca boutique resort Restaurant, Bopal",https://www.zomato.com/ahmedabad/casa-blanca-a-boutique-resort-bopal,500,"North Indian, Chinese, Beverages",NEW,," 47/1, Palodia, Ta-Kalol, Bopal, Ahmedabad"
"chacha party cafe Restaurant, Bopal",https://www.zomato.com/ahmedabad/chacha-party-cafe-bopal,250,Fast Food,-,," Ahmedabad Food Junction, YMCA X Road To SP Ring Road, Karnavati Club Road, Mumatpura, Bopal, Ahmedabad"
"food good Restaurant, Thaltej",https://www.zomato.com/ahmedabad/food-for-good-thaltej,350,Fast Food,-,," Stall 5, Opposite Gotila Auda Garden, Thaltej, Ahmedabad"
"urban turban Restaurant, Isanpur",https://www.zomato.com/ahmedabad/urban-turban-isanpur,300,North Indian,3.2,16," Near Sardar Washing Centre, Isanpur Cross Roads, Isanpur, Ahmedabad"
"samosa zone Restaurant, Mani Nagar",https://www.zomato.com/ahmedabad/samosa-zone-mani-nagar,100,Street Food,3.3,14," Gangadhar Shopping Center, Gopal Chowk, Opposite Sardar Patel School, Mani Nagar, Ahmedabad"
"send we cheese Restaurant, Infocity",https://www.zomato.com/ahmedabad/send-we-cheese-infocity-gandhinagar,250,"Sandwich, Fast Food",3.2,13," 8, Urban Otalo Food Park, Nera Mocha, Infocity, Gandhinagar"
"sarvottam banquet restaurant Restaurant, Adalaj",https://www.zomato.com/ahmedabad/sarvottam-banquet-restaurant-adalaj,550,"Chinese, North Indian, Gujarati, Fast Food",3.3,11," Opposite Shagun 108, Divine Circle, SP Ring Road, Zundal, Adalaj, Ahmedabad"
"shree atalji dining hall Restaurant, Vastral",https://www.zomato.com/ahmedabad/shree-atalji-dining-hall-vastral,200,"North Indian, Gujarati",3.3,13," Block A-G/F-6, Pushp Busniess Campus, Opposite Shiv Shakti Society, Vastral Ring Road, Vastral, Ahmedabad"
"desi parantha Restaurant, Gota",https://www.zomato.com/ahmedabad/desi-parantha-gota,300,North Indian,3.1,6," C/1-16, 1st Floor, Shukan Platinum, Opposite Vande Matram, New S.G.Road, Gota, Ahmedabad"
"khana khazana Restaurant, Infocity",https://www.zomato.com/ahmedabad/khana-khazana-infocity-gandhinagar,350,"North Indian, Chinese",3.2,12," B/12, Pramukh Arcade 1, Near Relaince Circle, Infocity, Gandhinagar"
"hitesh sweets Restaurant, Vasna",https://www.zomato.com/ahmedabad/hitesh-sweets-vasna,300,Desserts,3.3,18," Opposite Vasna Bus Stop, Vasna, Ahmedabad"
"radhe dairy parlour Restaurant, Shahibagh",https://www.zomato.com/ahmedabad/radhe-dairy-parlour-shahibagh,250,"Fast Food, Beverages",3.3,11," Mahadev Complex, Opposite Civil Hospital Gate No 2, Shahibagh, Ahmedabad"
"green desert Restaurant, Adalaj",https://www.zomato.com/ahmedabad/the-green-desert-adalaj,400,"North Indian, Gujarati, Chinese",3.3,8," Khodiyal Over Bridge, Khoraj, S G Highway, Adalaj, Ahmedabad"
"chat chaat Restaurant, Bodakdev",https://www.zomato.com/ahmedabad/chat-on-chaat-bodakdev,250,Street Food,3,6," SBR Social, Beside Sattva Vikas School, Sindhu Bhavan Road, Bodakdev, Ahmedabad"
"lassi shop Restaurant, Ashram Road",https://www.zomato.com/ahmedabad/lassi-shop-ashram-road,200,Beverages,3.4,11," Shop 2, Ground Floor, Today Square Building, Opposite Shree Vidyanagar English Medium School, Usmanpura, Ashram Road, Ahmedabad"
"fruit factory hub Restaurant, Naranpura",https://www.zomato.com/ahmedabad/fruit-factory-hub-naranpura,300,Beverages,3.1,8," 2/7, Vijay Nagar Road, Rupal Park, Ankur Cross Road, Naranpura, Ahmedabad"
"bombay bhaji pav Restaurant, Airport Gandhinagar Highway",https://www.zomato.com/ahmedabad/bombay-bhaji-pav-airport-gandhinagar-highway-gandhinagar,200,Fast Food,2.8,5," 110, 1st Floor, Swagat Rainforest 2, Near KTM Showroom, Kudasan, Airport Gandhinagar Highway, Gandhinagar"
"mysore house Restaurant, Nikol",https://www.zomato.com/ahmedabad/mysore-house-2-nikol,350,"South Indian, Street Food",2.8,9," Survey 273/3, FP-66, TP- 103, Opposite Chitrakut Society, Nikol, Ahmedabad"
"maharaj Restaurant, Naranpura",https://www.zomato.com/ahmedabad/maharaj-naranpura,100,Street Food,3.9,145," 1 & 2, Kunjan, Kumkum Society, Stadium Road, Near Sardar Patel Statue, Naranpura, Ahmedabad"
"shree manmohan kharek centre Restaurant, Navrangpura",https://www.zomato.com/ahmedabad/shree-manmohan-kharek-centre-navrangpura,250,Fast Food,4.2,98," 6, Kimsim Complex, Near Ganesh Plaza, Navrangpura Bus Stand Road, CG Road, Navrangpura, Ahmedabad"
"apnaa addaa Restaurant, Navrangpura",https://www.zomato.com/ahmedabad/apnaa-addaa-navrangpura,450,"Fast Food, Beverages",3.5,78," Ground Floor, Malti Apartments, Vijay Cross Road, Navrangpura, Ahmedabad"
