name,link,cost for 2,cuisines,ratings,reviews,address
"rhythm Restaurant, Lal Darwaja",https://www.zomato.com/ahmedabad/rhythm-lal-darwaja,600,"North Indian, South Indian",3.5,19," Hotel Royal Highness, Near Rupali Cinema, Lal Darwaja, Ahmedabad"
"om sandwich Restaurant, Gurukul",https://www.zomato.com/ahmedabad/om-sandwich-gurukul,300,Fast Food,3.4,20," Ground Floor, Indraprastha Tower, Gurukul, Ahmedabad"
"eatery four points by sheraton Restaurant, Ellis Bridge",https://www.zomato.com/ahmedabad/the-eatery-four-points-by-sheraton-ellis-bridge,"2,500","Asian, American, North Indian, Gujarati",4,381," Four Points By Sheraton, Opposite Gujarat College, Ellis Bridge, Ahmedabad"
"aagrah Restaurant, Chandkheda",https://www.zomato.com/ahmedabad/aagrah-chandkheda,800,Gujarati,4.1,412," 3rd Floor, Shree Balaji Agora Mall, Between Tapovan & Bhaat Circles, Chandkheda, Ahmedabad"
"iscon gathiya Restaurant, Satellite",https://www.zomato.com/ahmedabad/iscon-gathiya-satellite,100,"Gujarati, Street Food",4,465," Opposite Karnavati Club, S G Highway, Satellite, Ahmedabad"
"dhaba Restaurant, Prahlad Nagar",https://www.zomato.com/ahmedabad/the-dhaba-prahlad-nagar,600,"North Indian, Biryani, Fast Food, Desserts, Beverages",4,451," 2, Ground Floor, Circle P, S G Highway, Prahlad Nagar, Ahmedabad"
"bayleaf courtyard by marriott Restaurant, Satellite",https://www.zomato.com/ahmedabad/bayleaf-courtyard-by-marriott-satellite,"2,200",North Indian,4.4,435," Courtyard By Marriott, Ramdevnagar Cross Road, Satellite, Ahmedabad"
"jalpaan restaurant Restaurant, Prahlad Nagar",https://www.zomato.com/ahmedabad/jalpaan-restaurant-prahlad-nagar,800,North Indian,4,340," 6, Ground Floor, Dev Aurum, Near Anandnagar Cross Roads, Prahlad Nagar, Ahmedabad"
"saffron Restaurant, Navrangpura",https://www.zomato.com/ahmedabad/saffron-navrangpura,800,"North Indian, Biryani, Beverages",3.7,367," Ground Floor, Samudra Complex, Off C G Road, Navrangpura, Ahmedabad"
"china hut Restaurant, Paldi",https://www.zomato.com/ahmedabad/china-hut-paldi,400,"Chinese, North Indian",3.5,531," G 10, Sahajanand Plaza, Paldi Bhatta, Paldi, Ahmedabad"
"mumbai food court Restaurant, Bodakdev",https://www.zomato.com/ahmedabad/mumbai-food-court-bodakdev,250,"Street Food, Maharashtrian",3.9,490," 5, Sankalp, Opposite Corporate House, Pakvan Cross Road, Bodakdev, Ahmedabad"
"buddys pizza Restaurant, Gurukul",https://www.zomato.com/ahmedabad/buddys-pizza-gurukul,500,"Pizza, Fast Food",3.8,388," 105-106, Kairos, Sushil Nagar Co-Operate Society Limited, Gurukul, Ahmedabad"
"khush maza Restaurant, Navrangpura",https://www.zomato.com/ahmedabad/khush-maza-navrangpura,600,"Chinese, Sandwich, Kebab, North Indian",4.1,360," 203, 2nd Floor, Link Complex, Vijay Char Rasta, Navrangpura, Ahmedabad"
"royal restaurant banquet Restaurant, Odhav",https://www.zomato.com/ahmedabad/royal-restaurant-banquet-1-odhav,400,"North Indian, Chinese",4.3,430," Karnavati Estate, Odhav to Vastral Ring Road, Odhav, Ahmedabad"
"absolut punjab Restaurant, Satellite",https://www.zomato.com/ahmedabad/absolut-punjab-satellite,"1,000","North Indian, Chinese, Mughlai, Beverages",3.9,404," Sarthik Complex, Near Gulmohar Park Mall, Satellite, Ahmedabad"
"upsouth Restaurant, Vastrapur",https://www.zomato.com/ahmedabad/upsouth-vastrapur,500,"South Indian, Beverages",4.1,407," Shilp Square, Drive In Road, Opposite Himalayan Mall, Nilmani Society, Vastrapur, Ahmedabad"
"deeana Restaurant, Bodakdev",https://www.zomato.com/ahmedabad/deeana-bodakdev,800,"North Indian, Asian, Italian, Chinese, Beverages",3.7,415," B/4, Shivalik Business Center, Off S G Highway, Behind Rajpath Club, Bodakdev, Ahmedabad"
"k3 food corner Restaurant, Astodia",https://www.zomato.com/ahmedabad/k3-food-corner-astodia,150,Street Food,-,," 10 Acre Mall, Raipur BIg Bazaar, Astodia, Ahmedabad"
"krishna fast food Restaurant, Vastrapur",https://www.zomato.com/ahmedabad/krishna-fast-food-1-vastrapur,200,Fast Food,-,," Opposite Palladium, Near Dev Prime Station Road, Makarba, Vastrapur, Ahmedabad"
"shivas shakti sandwich pizza shop Restaurant, Satellite",https://www.zomato.com/ahmedabad/shivas-shakti-the-sandwich-pizza-shop-satellite,300,"Sandwich, Pizza, Fast Food",-,," Ahmedabad Food Truck Park, Opposite Karnavati Club, S.G. Highway, Ramdevnagar, Satellite, Ahmedabad"
"rajesh dairy sweet Restaurant, Naroda",https://www.zomato.com/ahmedabad/rajesh-dairy-sweet-naroda,200,Mithai,-,," Shop 155, Main Bazar, Kuber Nagar, Naroda, Ahmedabad"
"krishna fast food Restaurant, Chandkheda",https://www.zomato.com/ahmedabad/krishna-fast-food-chandkheda,200,Fast Food,-,," G7, Alpha Complex, Near Satyamev Hospital, Chandkheda, Ahmedabad"
"swad dabeli Restaurant, Nikol",https://www.zomato.com/ahmedabad/swad-dabeli-nikol,150,Fast Food,-,," Bahuchar Chowk, Near Khodiyar Mandir, Nikol, Ahmedabad"
"shree ram bhaji pav Restaurant, Mani Nagar",https://www.zomato.com/ahmedabad/shree-ram-bhaji-pav-mani-nagar,150,Fast Food,-,," Haripura Road, Khokhra, Mehmadabad, Mani Nagar, Ahmedabad"
"rajavir farsan house Restaurant, Naroda",https://www.zomato.com/ahmedabad/rajavir-farsan-house-naroda,250,Street Food,-,," Rajavir Circle, Kuber Nagar, Naroda, Ahmedabad"
"shree Restaurant, Vastrapur",https://www.zomato.com/ahmedabad/shree-vastrapur,100,Beverages,-,," G4, Near ICICI Bank, Vastrapur, Ahmedabad"
"quality pizza sandwich Restaurant, Mani Nagar",https://www.zomato.com/ahmedabad/quality-pizza-sandwich-mani-nagar,200,Fast Food,-,," Prankunj Society, Pushpkunj, Mani Nagar, Ahmedabad"
"shreeji restaurant Restaurant, Kankaria",https://www.zomato.com/ahmedabad/shreeji-restaurant-kankaria,250,"North Indian, Chinese",-,," Sheetal Plazza, Opposite Rollwala Petrolpump, Swaminarayan Colony, Kankaria, Ahmedabad"
"tangy treat food services Restaurant, Thaltej",https://www.zomato.com/ahmedabad/tangy-treat-food-services-thaltej,350,"Gujarati, North Indian",-,," 1, Ground Floor, Orabella Complex, Opposite Orchid Mall, Thaltej, Ahmedabad"
"mocktail soda Restaurant, Ellis Bridge",https://www.zomato.com/ahmedabad/mocktail-soda-ellis-bridge,200,Beverages,-,," Lokmanya Tilak Baug, Victoria Garden, Ellis Bridge, Ahmedabad"
"kailash frankie Restaurant, Navrangpura",https://www.zomato.com/ahmedabad/kailash-frankie-navrangpura,250,"Rolls, Fast Food",-,," Opposite HL College, Navrangpura, Ahmedabad"
"cafe amul Restaurant, Shahibagh",https://www.zomato.com/ahmedabad/cafe-amul-shahibagh,250,Fast Food,-,," Shop 1, Under Subhash Bridge, River Front Road, Shahibagh, Ahmedabad"
"jay jalaram khaman house Restaurant, Satellite",https://www.zomato.com/ahmedabad/jay-jalaram-khaman-house-satellite,100,Street Food,3.3,16," 26, Lower Level,  Arjun Tower, Shivranjini Cross Road, Satellite, Ahmedabad"
"fruitshala Restaurant, Bopal",https://www.zomato.com/ahmedabad/fruitshala-bopal,400,"Fast Food, Beverages",3.2,12," Decathlon, Near Shantipura Cross Roads, South P Ring Road, Bopal, Ahmedabad"
"friends food center Restaurant, Bopal",https://www.zomato.com/ahmedabad/the-friends-food-center-bopal,250,"Fast Food, Gujarati, Rajasthani",3.4,21," AG 9, Amrapali Shopping Mall, Ambli Cross Road, Bopal, Ahmedabad"
"new krishna bakery Restaurant, Naroda",https://www.zomato.com/ahmedabad/new-krishna-bakery-naroda,150,"Bakery, Desserts",3.3,15," Shop 61, Kubernagar, Naroda, Ahmedabad"
"southern fork Restaurant, Chandkheda",https://www.zomato.com/ahmedabad/southern-fork-chandkheda,450,North Indian,2.9,11," F-2/231/8, Dev Business Hub, Near Vitthal Complex, Visat Gandhi Nagar Highway, Chandkheda, Ahmedabad"
"burger hut Restaurant, Bodakdev",https://www.zomato.com/ahmedabad/burger-hut-bodakdev,500,"Burger, Fast Food, Beverages",3.2,11," 07, Ul Mohini Tower, Near Shraddha Petrol Pump, Bodakdev, Ahmedabad"
"jay shree bholenath center Restaurant, Memnagar",https://www.zomato.com/ahmedabad/jay-shree-bholenath-center-memnagar,250,"North Indian, Gujarati",3.2,9," Shop 7, Block E-F, Yash Aryan, Near Vivekanand Chowk, Memnagar, Ahmedabad"
"food palace Restaurant, Nikol",https://www.zomato.com/ahmedabad/the-food-palace-nikol,200,"Chinese, North Indian",3.3,12," 6, Safal Plaza, Near Janseva Kendra, Nikol-Naroda, Nikol, Ahmedabad"
"mh 18 Restaurant, Mani Nagar",https://www.zomato.com/ahmedabad/mh-18-mani-nagar,250,Maharashtrian,NEW,," 2, Satsang Society, Near Old Railway Crossing, Mani Nagar, Ahmedabad"
"mehta cream centre Restaurant, Vejalpur",https://www.zomato.com/ahmedabad/mehta-cream-centre-vejalpur,100,Mithai,3.3,15," 8, Kadambari Society, Near Ashapuri Temple, Jivraj Park, Vejalpur, Ahmedabad"
"sphere lounge Restaurant, Bodakdev",https://www.zomato.com/ahmedabad/sphere-lounge-bodakdev,600,"Cafe, Fast Food",3.4,12," Shop 1, Dev Preet Apartment, Near NFD Circle, Bodakdev, Ahmedabad"
"rk maggi pasta coffee bar Restaurant, Satellite",https://www.zomato.com/ahmedabad/r-k-maggi-pasta-coffee-bar-satellite,300,"Fast Food, Rolls, Beverages",3.5,15," A/64, Near City Gold Cinema, Vibhag 1, Shyamlal Cross Road, Satellite, Ahmedabad"
"dhan laxmi Restaurant, Sector 16, Gandhinagar",https://www.zomato.com/ahmedabad/dhan-laxmi-sector-16-gandhinagar,400,"Chinese, North Indian",3.1,9," Stall 70, Food Court, Near G-5, Sector 16, Gandhinagar"
"tasty bites restaurant Restaurant, Sarkhej",https://www.zomato.com/ahmedabad/tasty-bites-restaurant-sarkhej,400,Fast Food,3.4,17," Aehsan Park, Opposite Gandhi Residency, Sonal Cross Road, Sarkhej, Ahmedabad"
"rise Restaurant, Infocity",https://www.zomato.com/ahmedabad/rise-1-infocity-gandhinagar,800,"Continental, Fast Food, North Indian",3.4,11," Block 38, Zone 3, Tapas Marg, Gift City, Infocity, Gandhinagar"
"nightout cafe Restaurant, Navrangpura",https://www.zomato.com/ahmedabad/nightout-cafe-navrangpura,400,Cafe,3.5,38," LB-7, Punyabhumi Complex, Near Darpan Six Crossroad, Navrangpura, Ahmedabad"
"mulberrys cafe restro Restaurant, Bodakdev",https://www.zomato.com/ahmedabad/mulberrys-cafe-restro-bodakdev,500,"North Indian, Beverages, Fast Food",3.2,24," Kush 11 Road, PRL Colony, Bodakdev, Ahmedabad"
"shree jaymal fatta restaurant Restaurant, Satellite",https://www.zomato.com/ahmedabad/shree-jaymal-fatta-restaurant-satellite,400,"North Indian, Chinese",3.5,37," 1, Aditya Plaza, Jodhpur Gam Road, Satellite, Ahmedabad"
"rajasthan bhavna restaurant Restaurant, Gota",https://www.zomato.com/ahmedabad/rajasthan-bhavna-the-restaurant-1-gota,400,"North Indian, Rajasthani, Gujarati, Chinese",3.4,25," Near Nirma University, S.G Highway, Charodi, Gota, Ahmedabad"
"jay shree bhavani fast food Restaurant, Thaltej",https://www.zomato.com/ahmedabad/jay-shree-bhavani-fast-food-thaltej,400,"Chinese, South Indian, North Indian, Street Food",3.3,38," 16, Sahjanand Complex, Opposite Bhaikaka Nagar Bus Stop, Thaltej, Ahmedabad"
"shree mewad vadapav dabeli Restaurant, Shahibagh",https://www.zomato.com/ahmedabad/shree-mewad-vadapav-dabeli-shahibagh,300,"Sandwich, Fast Food",3.3,36," Bhagwati Complex, Opposite Police Commissioner Office, Shahibagh, Ahmedabad"
"vijay idli vada center Restaurant, Amraiwadi",https://www.zomato.com/ahmedabad/vijay-idli-vada-center-amraiwadi,150,South Indian,3.6,32," ABC Complex, Rabari Colony, Near ICICI Bank, Amraiwadi, Ahmedabad"
"shyam rath Restaurant, Amraiwadi",https://www.zomato.com/ahmedabad/shyam-rath-amraiwadi,400,"North Indian, Chinese",2.8,33," 103, Bharvi Tower, Near CTM Cross Road, Amraiwadi, Ahmedabad"
"cream n crunch Restaurant, Satellite",https://www.zomato.com/ahmedabad/cream-n-crunch-satellite,300,"Bakery, Desserts",3.5,32," G 10, Twinkle Complex, Opposite Dhananjay Tower, 100 Feet Road, Satellite, Ahmedabad"
"fruit zone wafflespot Restaurant, Airport Gandhinagar Highway",https://www.zomato.com/ahmedabad/fruit-zone-and-wafflespot-airport-gandhinagar-highway-gandhinagar,250,"Desserts, Juices",3.4,38," A-20, Pramukh Arcade-2, Near Reliance Chokdi, Kudasan, Airport Gandhinagar Highway, Gandhinagar"
"hello boho Restaurant, Airport Gandhinagar Highway",https://www.zomato.com/ahmedabad/hello-boho-airport-gandhinagar-highway-gandhinagar,400,Fast Food,3.4,22," 11, Silicone Hills, Opposite Business Park, PDPU Road, Airport Gandhinagar Highway, Gandhinagar"
"wawa fastorant Restaurant, Chandkheda",https://www.zomato.com/ahmedabad/wawa-fastorant-chandkheda,400,"Fast Food, Bakery",2.5,28," D 81, Bhakti Nagar, IOC Road, Chandkheda, Ahmedabad"
"shri ram dabeli vada pav Restaurant, Paldi",https://www.zomato.com/ahmedabad/shri-ram-dabeli-vada-pav-paldi,200,"Street Food, Fast Food",3.4,36," 4, Vardhman Complex, Bhatta, Paldi, Ahmedabad"
"rj restaurant Restaurant, Naroda",https://www.zomato.com/ahmedabad/rj-restaurant-naroda,400,"North Indian, Chinese, Mughlai",3.3,31," Kumbhaji Ni Chawl, Gali 1, Behind Pandit Ni Chawl, Hanumannagar, Meghaninagar, Naroda, Ahmedabad"
"kunal sweets Restaurant, Memnagar",https://www.zomato.com/ahmedabad/kunal-sweets-memnagar,350,"Mithai, Street Food",3.5,34," 217, Sunset Row House, Gurukul Road, Memnagar, Ahmedabad"
"keshar kathiyawadi Restaurant, Naroda",https://www.zomato.com/ahmedabad/keshar-kathiyawadi-naroda,400,"North Indian, Chinese, Rajasthani",2.9,7," SP Ring Road, Near Ranasan Toll Tax, Naroda, Ahemdabad"
"bhale padharya Restaurant, Shahibagh",https://www.zomato.com/ahmedabad/bhale-padharya-shahibagh,200,"Fast Food, Gujarati, North Indian",3.3,9," 1st Floor, M V House, Namaste Circle, Shahibagh, Ahmedabad"
"rewind latenight food Restaurant, Vastrapur",https://www.zomato.com/ahmedabad/rewind-latenight-food-vastrapur,200,"North Indian, Fast Food, Wraps",3.4,16," Basement, Vishnu Complex, Vastrapur Main Bazar, Vastrapur, Ahmedabad"
"moin samosa center Restaurant, Relief Road",https://www.zomato.com/ahmedabad/moin-samosa-center-relief-road,150,Street Food,3.2,13," 882, Opposite GPO, Salapas Road, Relief Road, Ahmedabad"
"city chinese mughlai Restaurant, Lal Darwaja",https://www.zomato.com/ahmedabad/city-chinese-mughlai-lal-darwaja,350,"Chinese, Mughlai",2.7,10," Opposite Electricity House, Lal Darwaja, Ahmedabad"
"kajal bakers Restaurant, Ashram Road",https://www.zomato.com/ahmedabad/kajal-bakers-ashram-road,200,"Bakery, Fast Food",-,," 22, Kameshwar Park, Opposite Swaminarayan Temple, Hirawadi Road"
"bahubali south indian food Restaurant, Satellite",https://www.zomato.com/ahmedabad/bahubali-the-south-indian-food-satellite,250,South Indian,3.2,11," Shop G 11, Karnavati Shopping Center, Near Pruthvi Tower, Satellite, Ahmedabad"
"shree ganesh bhajipav fastfood Restaurant, Ambavadi",https://www.zomato.com/ahmedabad/shree-ganesh-bhajipav-and-fastfood-ambavadi,500,"Street Food, Fast Food, South Indian, North Indian, Chinese",3.4,12," Janumang Co-Operative Society Limited, Janpath Apartments, Behind Sahjanand College, Azad Society Road, Ambavadi, Ahmedabad"
"yogesh khaman house Restaurant, Paldi",https://www.zomato.com/ahmedabad/yogesh-khaman-house-paldi,100,"Fast Food, Gujarati",3.3,14," 8, Neel Dhara Complex, Near V S Hospital, Paldi, Ahmedabad"
"shree dutt restaurant Restaurant, Sabarmati",https://www.zomato.com/ahmedabad/shree-dutt-restaurant-sabarmati,400,North Indian,3,11," Koteshwar Bhat Road, Ahmedabad"
"punjab paratha zone Restaurant, Bodakdev",https://www.zomato.com/ahmedabad/punjab-paratha-zone-1-bodakdev,200,North Indian,3.3,13," Shop 4, Balaji Plaza, Judges Bungalow Road, Bodakdev Ahmedabad"
"smoothie salad bar Restaurant, Prahlad Nagar",https://www.zomato.com/ahmedabad/smoothie-and-salad-bar-prahlad-nagar,300,"Salad, Healthy Food",2.8,11," Shop 5, 1st Floor, Dev Aurum Mall, Prahlad Nagar, Ahmedabad"
"s house Restaurant, Jamalpur",https://www.zomato.com/ahmedabad/a-s-house-jamalpur,400,North Indian,2.9,11," Lal Darwaza, Jamalpur, Ahmedabad"
"sadda tandoor Restaurant, Airport Gandhinagar Highway",https://www.zomato.com/ahmedabad/sadda-tandoor-airport-gandhinagar-highway-gandhinagar,500,"North Indian, Mughlai",3.2,8," B-56/57, Pramukh Arcade, Near Reliance Cross Road, Urjanagar 1, Kudasan, Airport Gandhinagar Highway, Gandhinagar"
"manek chowk ghanthiya corner Restaurant, Mani Nagar",https://www.zomato.com/ahmedabad/manek-chowk-ghanthiya-corner-mani-nagar,250,Street Food,3.1,8," Shop 5, K.B. Complex, Opposite Ramkrishna Party Plot, L.G Hospital Road, Mani Nagar, Ahmedabad"
"saheli inn restaurant Restaurant, Ambavadi",https://www.zomato.com/ahmedabad/saheli-inn-restaurant-ambavadi,500,"North Indian, Chinese, Fast Food",3.8,326," Janpath Shopping Centre, Behind Sahjanad College, Ambavadi, Ahmedabad"
"4 food Restaurant, Thaltej",https://www.zomato.com/ahmedabad/4-food-thaltej,800,"Chinese, North Indian, Mughlai, Kerala",3.8,283," New York Tower B, Near Thaltej Cross Road, S G Highway, Thaltej, Ahmedabad"
"new lucky restaurant Restaurant, Lal Darwaja",https://www.zomato.com/ahmedabad/new-lucky-restaurant-lal-darwaja,300,"South Indian, North Indian, Fast Food",4.2,228," Opposite City College, Lal Darwaja, Ahmedabad"
"brewgarten Restaurant, Navrangpura",https://www.zomato.com/ahmedabad/brewgarten-navrangpura,500,Cafe,4.6,224," Shop 8 & 9, Kashi Bhuvan, Narayan Park Society, Navrangpura, Ahmedabad"
"cafe tilla Restaurant, Paldi",https://www.zomato.com/ahmedabad/cafe-tilla-paldi,400,Cafe,4,189," Bramhashatriya Nagar Society, Opposite Union Bank, Paldi, Ahmedabad"
"pizza dome Restaurant, Vastrapur",https://www.zomato.com/ahmedabad/the-pizza-dome-vastrapur,600,Pizza,3.9,233," Ground Floor, Galaxy Bazaar Complex, Opposite Himalaya Mall, Sunrise Park Road, Vastrapur, Ahmedabad"
"protin egg eatery Restaurant, Navrangpura",https://www.zomato.com/ahmedabad/protin-egg-eatery-1-navrangpura,400,"Fast Food, North Indian",3.9,241," 1, Shri Krishna Complex, Above Crossword, Mithakali, Navrangpura, Ahmedabad"
"iscon thal Restaurant, Satellite",https://www.zomato.com/ahmedabad/iscon-thal-satellite,500,Gujarati,3.6,288," SF-1, Rudra Applis, Iscon Circle, S.G. Road, Near Aishwarya Showroom, Satellite, Ahmedabad"
"mrs mage Restaurant, Vastrapur",https://www.zomato.com/ahmedabad/mrs-mage-1-vastrapur,"1,600",Continental,4.6,161," Plot 216, Hyatt, Town Plan Scheme 1, Near Vastrapur Lake, Vastrapur, Ahmedabad"
"cravingz Restaurant, Thaltej",https://www.zomato.com/ahmedabad/cravingz-thaltej,450,"Desserts, Frozen Yogurt",4.1,224," Ground Floor, Acropolis Mall, S G Highway, Thaltej, Ahmedabad"
"taste eat Restaurant, Relief Road",https://www.zomato.com/ahmedabad/taste-eat-1-relief-road,400,"North Indian, Chinese, Fast Food, Beverages",3.7,357," GPO Road, Near Relief Cinema, Lal Darwaja, Relief Road, Ahmedabad"
"jamanvaar Restaurant, Sola",https://www.zomato.com/ahmedabad/jamanvaar-1-sola,300,Gujarati,3.6,331," 201, Sundaram Arcade, Science City Road, Sola, Ahmedabad"
"punjabi point Restaurant, Vasna",https://www.zomato.com/ahmedabad/punjabi-point-vasna,400,"North Indian, Chinese",4,255," H-11, Ground Floor, Riverside Park, Opposite APMC, Vasna, Ahmedabad"
"sizzling brownie Restaurant, Vastrapur",https://www.zomato.com/ahmedabad/sizzling-brownie-vastrapur,250,Desserts,4.4,252," Panchdeep, Opposite Falguni Gruh Udyog, Vastrapur, Ahmedabad"
"zodiac fortune landmark Restaurant, Ashram Road",https://www.zomato.com/ahmedabad/zodiac-fortune-landmark-ashram-road,"2,000","North Indian, Italian, Continental",4.4,166," Fortune Landmark, Usmanpura, Ashram Road, Ahmedabad"
"shreenath fast food Restaurant, Satellite",https://www.zomato.com/ahmedabad/shreenath-fast-food-1-satellite,350,"Fast Food, Street Food, Beverages",3.8,61," 2, Janmangal Complex, Near Sachin Tower, Anand Nagar, 100 Feet Road, Setellite, Ahmedabad"
"laxmi vijay hotel Restaurant, Nava Vadaj",https://www.zomato.com/ahmedabad/laxmi-vijay-hotel-nava-vadaj,450,"North Indian, Chinese, South Indian",3.6,70," Opposite Ronak Park Society, Chandlodia Road, Nava Vadaj, Ahmedabad"
"gayatri restaurant Restaurant, Amraiwadi",https://www.zomato.com/ahmedabad/gayatri-restaurant-amraiwadi,300,North Indian,3.4,80," 3, Shiv Shambu Society, Opposite Jivan Jyot School, Rabari Colony, Amraiwadi, Ahmedabad"
"wtc pasta Restaurant, Shahibagh",https://www.zomato.com/ahmedabad/wtc-pasta-shahibagh,300,"Fast Food, Italian",3.8,51," 18, Celler Monalisa, Near Sujata Flats, Shahibagh, Ahmedabad"
"krishna hotdog pizzeria Restaurant, Ambavadi",https://www.zomato.com/ahmedabad/krishna-hotdog-pizzeria-ambavadi,400,"Pizza, Sandwich, Chinese, Fast Food, Beverages",3.7,27," 34, Janpath Shopping Center, Behind Sahjanand College, Ambavadi, Ahmedabad"
"hungers king Restaurant, Gota",https://www.zomato.com/ahmedabad/hungers-king-gota,500,"Pizza, Fast Food",3.6,42," Shop 3, Swaraj, Akanksha Savvy, Godrej Garden City Road, Gota, Ahmedabad"
"capricorn restaurant Restaurant, Naroda",https://www.zomato.com/ahmedabad/capricorn-restaurant-1-naroda,600,"North Indian, Chinese",2.5,58," Shayona Complex A, Near Memco Circle, Bapunagar Road, Naroda, Ahmedabad"
"fun feast restaurant Restaurant, Airport Gandhinagar Highway",https://www.zomato.com/ahmedabad/fun-and-feast-restaurant-airport-gandhinagar-highway-gandhinagar,750,"North Indian, Mughlai, Continental",3.5,46," Fun and Feast Theme Park, Kudasan Road, Urjanagar, Airport Gandhinagar Highway, Gandhinagar"
"hunger yums Restaurant, Prahlad Nagar",https://www.zomato.com/ahmedabad/hunger-yums-prahlad-nagar,250,"Street Food, Fast Food",3.5,42," 124 A, Orchid Whitefield, Near Makarba Railway Station, Prahlad Nagar, Ahmedabad"
"day night cafe Restaurant, Paldi",https://www.zomato.com/ahmedabad/day-night-cafe-paldi,550,"Cafe, Fast Food, Street Food",NEW,," Shop 13, Ground Floor, Dharnidhar Tower, Vikas Gruh Road, Near Dharnidhar Char Rasta, Paldi, Ahmedabad"
"toast tree sandwich Restaurant, Satellite",https://www.zomato.com/ahmedabad/toast-tree-sandwich-satellite,200,Sandwich,3.5,47," Shop 10, Nandanvan 3, Near Hasubhai Park, Satellite, Ahmedabad"
"gourmet delicacy Restaurant, Thaltej",https://www.zomato.com/ahmedabad/gourmet-delicacy-thaltej,150,"Desserts, Bakery",3.4,18," 8, Rajnigandha Bungalows, Near St. Kabir School, Thaltej, Ahmedabad"
"bombay misalpav Restaurant, Vejalpur",https://www.zomato.com/ahmedabad/bombay-misalpav-vejalpur,250,Fast Food,3.5,57," G/305, Shree Nand Nagar 3, Sonal Cinema Road, Vejalpur, Ahmedabad"
"kings only biryani Restaurant, Vejalpur",https://www.zomato.com/ahmedabad/kings-only-biryani-vejalpur,500,"Biryani, North Indian",3.2,48," Shop B-21, Jaltarang State Bank Society, Near Jivan Kalani Society, Vejalpur, Ahmedabad"
"arose foods Restaurant, Bopal",https://www.zomato.com/ahmedabad/arose-foods-bopal,"1,000","North Indian, Chinese, Continental",3.5,43," Karnavati Club Road, YMCA To Bopal, Mohamadpura, Bopal, Ahmedabad"
"ydc yummy dosa corner Restaurant, Shahibagh",https://www.zomato.com/ahmedabad/ydc-yummy-dosa-corner-shahibagh,250,South Indian,-,," C/2, Monalisha Apartment, Near Sujata Flat, Rajasthan Hospital Road, Shahibagh, Ahmedabad"
"jalaram samosa house khaman Restaurant, Ghatlodia",https://www.zomato.com/ahmedabad/jalaram-samosa-house-and-khaman-ghatlodia,100,Street Food,-,," Shop L-2, Devalay Plaza, Sattadhar Cross Road, Municipal Karmachari Nagar, Ghatlodia, Ahmedabad"
"gummy bakers Restaurant, Sector 21, Gandhinagar",https://www.zomato.com/ahmedabad/gummy-bakers-sector-21-gandhinagar,400,Bakery,-,," B-24, District Shopping Center, Near Reliance Mart, Sector 21, Gandhinagar"
"vansh dosa bhajipav Restaurant, Vejalpur",https://www.zomato.com/ahmedabad/vansh-dosa-and-bhajipav-vejalpur,150,South Indian,-,," Corporate Road, Opposite Vodafone, S.G.Highway, Vejalpur, Ahmedabad"
"santosh sandwich centre Restaurant, Navrangpura",https://www.zomato.com/ahmedabad/santosh-sandwich-centre-navrangpura,150,"Sandwich, Street Food",NEW,," 7, SV Desai Marg, Shlok Bungalow, Vasant Vihar, Near St. Xavier's College Corner, Navrangpura, Ahmedabad"
"om shiv food center Restaurant, Bopal",https://www.zomato.com/ahmedabad/om-shiv-food-center-bopal,250,"North Indian, Gujarati",-,," B-24, Celebration City Center, South Bopal, Gala Gymkhana Road, Ahmedabad"
"punjabi virsa Restaurant, Thaltej",https://www.zomato.com/ahmedabad/punjabi-virsa-thaltej,400,North Indian,-,," B-3, Silver Square Complex, Opposite Bhagban Party Plot, Thaltej, Ahmedabad"
"shreeji tea fastfood Restaurant, Thaltej",https://www.zomato.com/ahmedabad/shreeji-tea-and-fastfood-thaltej,200,"Fast Food, Beverages",-,," B-12/A, Silver Square Complex, Opposite Bagban Party Plot, Thaltej, Ahmedabad"
"hungry zone Restaurant, Vatva",https://www.zomato.com/ahmedabad/hungry-zone-vatva,250,"North Indian, Fast Food, Street Food",NEW,," 736, Amirnur Nagar, Vatva Gam Road, Behind Golden-9, Vatva, Ahmedabad"
"woodfried pizza by big bite cafe Restaurant, Bodakdev",https://www.zomato.com/ahmedabad/woodfried-pizza-by-big-bite-cafe-bodakdev,500,Pizza,-,," Stall 19, 20 & 21, Opposite Gotila Auda Garden, Bodakdev, Ahmedabad"
"kucchhi karnavati Restaurant, Isanpur",https://www.zomato.com/ahmedabad/kucchhi-karnavati-isanpur,200,Fast Food,-,," Shop 17, Near Samjuba School, Govindvadi, Isanpur, Ahmedabad"
"tahuko chehar khana khajana Restaurant, Airport Gandhinagar Highway",https://www.zomato.com/ahmedabad/tahuko-chehar-khana-khajana-airport-gandhinagar-highway-gandhinagar,350,"North Indian, Gujarati",-,," Saptrishi Complex, Near Reliance Cross Road, Kudasan, Airport Gandhinagar Highway, Gandhinagar"
"balle balle Restaurant, Airport Gandhinagar Highway",https://www.zomato.com/ahmedabad/balle-balle-airport-gandhinagar-highway-gandhinagar,600,"North Indian, Chinese, Fast Food",-,," C/06, Business Park, PDPU Road, Raiysan, Airport Gandhinagar Highway, Gandhinagar"
"shiv sandwich pizza Restaurant, Adalaj",https://www.zomato.com/ahmedabad/shiv-sandwich-pizza-adalaj,200,Fast Food,Opening,Soon," Highway Food Court, Sarkhej - Gandhinagar Highway, Opposite Vaishnodevi Mandir, Adalaj, Ahmedabad"
"jay bhole fast food Restaurant, Ambavadi",https://www.zomato.com/ahmedabad/jay-bhole-fast-food-ambavadi,200,"Fast Food, Street Food",-,," 10, Sundar Gopal Complex, Opposite Central Mall, Ambavadi, Ahmedabad"
