name,link,cost for 2,cuisines,ratings,reviews,address
"mocha fursatt Restaurant, Bopal",https://www.zomato.com/ahmedabad/mocha-fursatt-bopal,350,"Fast Food, Desserts, Bakery, Beverages",-,," Club O7 Road, Club & Convention, Off S.P Ring Road, Shela, Bopal, Ahmedabad"
"kaniya ganthiya center Restaurant, Gota",https://www.zomato.com/ahmedabad/kaniya-ganthiya-center-gota,150,Gujarati,NEW,," Near Krishna Party Plot, New S.G Road, Vandemataram, Gota, Ahmedabad"
"cream crust icecream Restaurant, Vastral",https://www.zomato.com/ahmedabad/cream-crust-icecream-vastral,100,"Ice Cream, Desserts",-,," B-1/25, Omkar Residency, Near Abjibapa Lake, Vastral, Ahmedabad"
"bake me away Restaurant, Navrangpura",https://www.zomato.com/ahmedabad/bake-me-away-navrangpura,300,"Bakery, Desserts",-,," 4, CP Chambers, Opposite Karnavati Pagarakha Bazaar, Navrang Circle Cross Road, Navrangpura, Ahmedabad"
"kutchi dabeli Restaurant, Gota",https://www.zomato.com/ahmedabad/kutchi-dabeli-gota,200,Fast Food,-,," Shop No. 6, Sayona Shikhar, Near Vandematram Icon, New S.G Road, Vandematram, Gota, Ahmedabad"
"delicious khana Restaurant, Subhash Bridge",https://www.zomato.com/ahmedabad/delicious-khana-subhash-bridge,450,"North Indian, Gujarati, Biryani, Fast Food, Chinese",-,," Survey 943/2, Solid Ice Factory, Dariakhan, Subhash Bridge, Ahmedabad"
"vrundavan restaurant Restaurant, Adalaj",https://www.zomato.com/ahmedabad/vrundavan-restaurant-adalaj,350,"South Indian, Chinese, North Indian, Gujarati",-,," S.G Highway, Opposite SGVP Gurukul, Adalaj, Ahmedabad"
"punjab di haveli Restaurant, Sola",https://www.zomato.com/ahmedabad/punjab-di-haveli-sola,200,Fast Food,-,," Bite At Nite Food Court, Near Bhadaj Circle, SP Ring Road, Sola, Ahmedabad"
"surya sandwich fastfood Restaurant, Chandlodia",https://www.zomato.com/ahmedabad/surya-sandwich-and-fastfood-chandlodia,250,"Sandwich, Fast Food",-,," A/116, New NP Park, Behind Chankayapuri, Chandlodia, Ahmedabad"
"bellezoe sweets Restaurant, Bodakdev",https://www.zomato.com/ahmedabad/bellezoe-sweets-bodakdev,500,Mithai,-,," Shop 21, Haveli Bungalows, Opposite Tv Tower, Drive In Road, Bodakdev, Ahmedabad"
"dilli se hoon Restaurant, Gurukul",https://www.zomato.com/ahmedabad/dilli-se-hoon-gurukul,500,"North Indian, Chinese",-,," A1/201, Sunrise Shopping Centre, Opposite Indraprasth Tower, Gurukul, Ahmedabad"
"pepper pots Restaurant, Gota",https://www.zomato.com/ahmedabad/pepper-pots-gota,500,"North Indian, Fast Food, Beverages",3.8,462," Opposite Vishwas City-5, Anand Square Cross Roads, Vandemataram City Road, Off SG Highway, Gota, Ahmedabad"
"udipi cafe Restaurant, Paldi",https://www.zomato.com/ahmedabad/udipi-cafe-paldi,400,"North Indian, South Indian, Chinese, Fast Food",3.5,391," Paldi Cross Roads, Paldi, Ahmedabad"
"beans leaves platinum hotels Restaurant, Paldi",https://www.zomato.com/ahmedabad/beans-leaves-platinum-hotels-paldi,600,Cafe,4,260," Hotel Platinum Inn, Besides Paldi Police Station,Anjali Cross Roads, Paldi, Ahmedabad"
"ice cream works Restaurant, Thaltej",https://www.zomato.com/ahmedabad/ice-cream-works-thaltej,300,"Desserts, Ice Cream, Beverages",4.3,274," BG 5, Ground Floor, Acropolis Mall, Thaltej Cross Roads, Thaltej, Ahmedabad"
"purohit restaurant Restaurant, Mani Nagar",https://www.zomato.com/ahmedabad/purohit-restaurant-mani-nagar,550,"South Indian, North Indian, Fast Food, Chinese, Gujarati, Desserts",4.1,357," Near Apsara Aradhana Theater, Puspakunj, Mani Nagar, Ahmedabad"
"mleko Restaurant, Navrangpura",https://www.zomato.com/ahmedabad/mleko-navrangpura,500,"Cafe, Beverages",4.7,207," Besides Hero Honda Showroom, Vijay Char Rasta, Navrangpura, Ahmedabad"
"24/7 all day dining coffee shop metropole hotel Restaurant, Subhash Bridge",https://www.zomato.com/ahmedabad/24-7-all-day-dining-coffee-shop-the-metropole-hotel-subhash-bridge,"1,200","North Indian, Chinese, Continental",3.7,275," The Metropole Hotel, Near RTO Circle, Subhash Bridge, Ahmedabad"
"cafe amul Restaurant, Sola",https://www.zomato.com/ahmedabad/cafe-amul-sola,300,"Fast Food, Burger, Pizza, Beverages",3.7,345," Science City Road, Opposite Shukan Mall, Near CIMS Hospital, Sola, Ahmedabad"
"thambi bhavan Restaurant, Bodakdev",https://www.zomato.com/ahmedabad/thambi-bhavan-bodakdev,550,South Indian,NEW,," 1, 1st Floor, A Block, Times Square 2, Bodakdev, Ahmedabad"
"royal bengal tandoori hut Restaurant, Prahlad Nagar",https://www.zomato.com/ahmedabad/royal-bengal-tandoori-hut-prahlad-nagar,700,"Bengali, North Indian, Chinese, Seafood",3.3,384," 14, Rivera Arcade, Near Auda Garden, Prahlad Nagar, Ahmedabad"
"old school Restaurant, Satellite",https://www.zomato.com/ahmedabad/old-school-satellite,600,"North Indian, South Indian, Chinese, Fast Food",NEW,," 101, Santorini Square, Prernatirth Derasar Road, Near Abhishree Complex, Satellite, Ahmedabad"
"mahaveer food point Restaurant, Subhash Bridge",https://www.zomato.com/ahmedabad/mahaveer-food-point-subhash-bridge,200,Fast Food,4.5,278," 4/B, Tirthdevbhumi Complex, Keshavnagar Road, Subhash Bridge, Ahmedabad"
"topaz Restaurant, Ambavadi",https://www.zomato.com/ahmedabad/topaz-ambavadi,500,"North Indian, Chinese",3.7,410," Ronak Complex, Ambavadi, Ahmedabad"
"mr mrs idly Restaurant, Infocity",https://www.zomato.com/ahmedabad/mr-mrs-idly-infocity-gandhinagar,300,South Indian,3.7,347," Shop 29, Supermall 1, Infocity, Gandhinagar"
"cellad eatery Restaurant, Gulbai Tekra",https://www.zomato.com/ahmedabad/cellad-eatery-gulbai-tekra,900,"North Indian, Fast Food",3.9,354," Top Floor, City Square Building, University Area, Gulbai Tekra, Ahmedabad"
"ikat restaurant Restaurant, Mani Nagar",https://www.zomato.com/ahmedabad/ikat-restaurant-mani-nagar,700,"North Indian, South Indian",3,50," EKA Club, Near Kankaria Lake Gate 3, Mani Nagar, Ahmedabad"
"copper wok restaurant Restaurant, Airport Gandhinagar Highway",https://www.zomato.com/ahmedabad/copper-wok-restaurant-airport-gandhinagar-highway-gandhinagar,700,"North Indian, Continental",3.6,28," Hotel Blue Moon, Shreerang Mall And Nagar, Randesan, Airport Gandhinagar Highway, Gandhinagar"
"amul sandwich pizza Restaurant, Satellite",https://www.zomato.com/ahmedabad/amul-sandwich-pizza-satellite,200,Fast Food,3.7,58," 6, Siddhi Sarjan Complex, Near Seema Hall, Satellite, Ahmedabad"
"gandhi cold drink house Restaurant, Bhadra",https://www.zomato.com/ahmedabad/gandhi-cold-drink-house-bhadra,150,Beverages,3.8,45," Khasbazaar, Opposite Nishat Restaurant, Bhadra, Ahmedabad"
"wtf wheres food  Restaurant, Vastrapur",https://www.zomato.com/ahmedabad/wtf-wheres-the-food-vastrapur,500,"Pizza, Fast Food",3.8,42," Shop 38, Sardar Center, Opposite Vastrapur Lake, Vastrapur, Ahmedabad"
"das pendawala Restaurant, Satellite",https://www.zomato.com/ahmedabad/das-pendawala-satellite,300,Mithai,3.4,49," Sahjanand Palace, Opposite Rahul Tower, Anand Nagar Road, Satellite, Ahmedabad"
"food time Restaurant, Prahlad Nagar",https://www.zomato.com/ahmedabad/food-on-time-prahlad-nagar,400,"North Indian, Chinese",3.5,37," Sammet Platinum, Corporate Road, Opposite Makarba Crossing, Prahlad Nagar, Ahmedabad"
"spice n coal Restaurant, Prahlad Nagar",https://www.zomato.com/ahmedabad/spice-n-coal-prahlad-nagar,450,"North Indian, Mughlai",NEW,," Shop 22, Simandhar Tenaments, Near Railway Crossing, Makarba Road, Prahlad Nagar, Ahmedabad"
"shambhu cafe snacks Restaurant, Naroda",https://www.zomato.com/ahmedabad/shambhu-cafe-snacks-naroda,450,"Fast Food, Desserts",2.6,53," 16, Harivallabh Shopping Center, Beside Devi Cinema, Naroda, Ahmedabad."
"mjs kitchen Restaurant, Vejalpur",https://www.zomato.com/ahmedabad/mjs-kitchen-vejalpur,400,"North Indian, Chinese, Fast Food",3.5,37," Tulsivan Society, Vejalpur, Ahmedabad"
"desai ice cream Restaurant, Bodakdev",https://www.zomato.com/ahmedabad/desai-ice-cream-bodakdev,250,"Desserts, Ice Cream",3.6,45," Ground Floor, Goyal Terrace, Near Judges Bungalow, Bodakdev, Ahmedabad"
"familia cafe Restaurant, Bopal",https://www.zomato.com/ahmedabad/familia-cafe-bopal,650,"Fast Food, Wraps, Beverages",3.5,12," A/ 58, Celebration City Centre, Near Police Station, Bopal, Ahmedabad"
"westernised desi Restaurant, Gurukul",https://www.zomato.com/ahmedabad/westernised-desi-gurukul,300,Fast Food,3.5,40," 115, Ground Floor, Himalaya Mall, Drive-in Road, Gurukul, Ahmedabad"
"cafe de macaron Restaurant, C G Road",https://www.zomato.com/ahmedabad/cafe-de-macaron-c-g-road,350,"Bakery, Fast Food",3.5,46," 3, Urja House, Swastik Cross Roads, C G Road, Ahmedabad"
"petals candlelight experience Restaurant, Navrangpura",https://www.zomato.com/ahmedabad/petals-the-candlelight-experience-navrangpura,800,"North Indian, Chinese",NEW,," FF/7, Aaryan Workspace, H L College Road, Near St. Xaviers College, Navrangpura, Ahmedabad"
"shreeji parlour Restaurant, Ashram Road",https://www.zomato.com/ahmedabad/shreeji-parlour-ashram-road,150,Gujarati,-,," A/60, Ghanshyam Avenue, Opposite CU Shah College, Income Tax, Ashram Road, Ahmedabad"
"uncle chicken corner Restaurant, Chandkheda",https://www.zomato.com/ahmedabad/uncle-chicken-corner-chandkheda,400,North Indian,-,," SP Ring Road, Opposite Shri Balaji Agora Mall, Shughad, Chandkheda, Ahmedabad"
"shree krishna kulfi ice cream snacks Restaurant, Paldi",https://www.zomato.com/ahmedabad/shree-krishna-kulfi-ice-cream-snacks-paldi,200,"Desserts, Ice Cream",-,," Shop 11, Radha Raman Shopping Centre, Near Darnidhar Char Rasta, Paldi, Ahmedabad"
"shreenath vadapav Restaurant, Ghatlodia",https://www.zomato.com/ahmedabad/shreenath-vadapav-ghatlodia,250,"Street Food, Fast Food",-,," A/51/2, Shrikunj Shopping Center, Prabat Chowk, Ghatlodia, Ahmedabad"
"maharaja Restaurant, Kalupur",https://www.zomato.com/ahmedabad/maharaja-kalupur,200,"Chinese, Fast Food",-,," Revdibazar First Cross Road, Opposite Revdibazar Post Office, Near Maskati Market, Kalupur, Ahmedabad"
"khana khajana restaurant Restaurant, Airport Gandhinagar Highway",https://www.zomato.com/ahmedabad/khana-khajana-restaurant-airport-gandhinagar-highway-gandhinagar,500,"North Indian, Chinese",NEW,," Shop A/3, Ugti Hights, POR Road, Kudasan, Airport Gandhinagar Highway, Gandhinagar"
"jai bholenath bhojnalaya Restaurant, Sector 21, Gandhinagar",https://www.zomato.com/ahmedabad/jai-bholenath-bhojnalaya-sector-21-gandhinagar,150,Gujarati,-,," Shop 3, APMC Market, Alampur Cross Road, Opposite BSF Camp, Sector 21, Gandhinagar"
"m d frankie centre Restaurant, Navrangpura",https://www.zomato.com/ahmedabad/m-d-frankie-centre-navrangpura,150,Fast Food,-,," Opposite HL College, Navrangpura, Ahmedabad"
"nk special chicken biryani dibba Restaurant, Sarkhej",https://www.zomato.com/ahmedabad/nk-special-chicken-biryani-dibba-sarkhej,250,"Biryani, Mughlai",-,," A/101, Mashira Avenue, Ghanchi Hall Road, Near Old Bhatha School, Sarkhej, Ahmedabad"
"jalaram restaurant Restaurant, Adalaj",https://www.zomato.com/ahmedabad/jalaram-restaurant-adalaj,250,"North Indian, Gujarati, Chinese",-,," Adalaj Coba Highway, Near Ambapur, Adalaj, Ahmedabad"
"santosh Restaurant, Sector 16, Gandhinagar",https://www.zomato.com/ahmedabad/santosh-sector-16-gandhinagar,250,"Fast Food, Chinese, Street Food",-,," Chopati, GH -5, Sector 16, Gandhinagar"
"tast eride food zone Restaurant, Odhav",https://www.zomato.com/ahmedabad/tast-eride-food-zone-odhav,200,"North Indian, Gujarati, Chinese, Fast Food",-,," Shop 10, Mangalya Business Point, S P Ring Road, Odhav, Ahmedabad"
"indian dhaba Restaurant, Infocity",https://www.zomato.com/ahmedabad/indian-dhaba-infocity-gandhinagar,350,"North Indian, Chinese, Fast Food",NEW,," Shop 10, Permukh Corporate, PDPU Road, Raysan, Infocity, Gandhinagar"
"shri krishna kulfi ice cream Restaurant, Manek Chowk",https://www.zomato.com/ahmedabad/shri-krishna-kulfi-ice-cream-manek-chowk,200,"Desserts, Ice Cream",-,," Above SG Jewellers, Ratri Kani Pini Bazar, Manek Chowk, Ahmedabad"
"madina flight centre Restaurant, Naroda",https://www.zomato.com/ahmedabad/madina-flight-centre-naroda,500,"Hyderabadi, Mughlai",-,," Naroda Patiya, Near Naroda Patiya BRTS Bus Stop, Naroda, Ahmedabad"
"dayavan resort Restaurant, Odhav",https://www.zomato.com/ahmedabad/the-dayavan-resort-odhav,650,"Chinese, Mexican, Thai, Italian, North Indian",3.1,25," Behind Torrent Power, S P Ring Road, Kathwada, Odhav, Ahmedabad"
"sasas kitchen Restaurant, Satellite",https://www.zomato.com/ahmedabad/sasas-kitchen-satellite,300,"North Indian, Gujarati, Fast Food, South Indian",3.5,17," 25, Manas Complex, Opposite Star Bazar, Jodhpur Cross Road, Satellite, Ahmedabad"
"rks nasta house Restaurant, Satellite",https://www.zomato.com/ahmedabad/r-ks-nasta-house-satellite,200,"North Indian, Street Food",3.6,23," Shop 10, Ground Floor, Aditya Plaza, Opposite Karnavati Apartment, Jodhpur Gaam Road, Satellite, Ahmedabad"
"marshall Restaurant, Kalupur",https://www.zomato.com/ahmedabad/marshall-kalupur,700,"North Indian, South Indian",3.5,34," Station Road, Kapasia Bazaar, Kalupur, Ahmedabad"
"chintan ni karnavati dabeli Restaurant, Mani Nagar",https://www.zomato.com/ahmedabad/chintan-ni-karnavati-dabeli-mani-nagar,150,"Fast Food, Street Food",3.5,41," G 10, Radhey Shopping Mall, Khokhra Circle, Mani Nagar, Ahmedabad"
"najaranu amdavad nu Restaurant, Vatva",https://www.zomato.com/ahmedabad/najaranu-amdavad-nu-2-vatva,700,"North Indian, Gujarati, Fast Food, Chinese",3.1,18," Mahemdabad Road, Haathijan, Opposite India Colony, Vatva, Ahmedabad."
"jay ambe bhajipav pulav Restaurant, Chandkheda",https://www.zomato.com/ahmedabad/jay-ambe-bhajipav-and-pulav-chandkheda,200,Street Food,3.3,27," Shop 16, Devpreet Complex, Opposite Engineering College, Chandkheda, Ahmedabad"
"savvys goan casa Restaurant, Chandlodia",https://www.zomato.com/ahmedabad/savvys-goan-casa-chandlodia,400,"North Indian, Seafood, Mughlai",3.4,21," Opposite Kirti Bungalow, Chandlodia, Ahmedabad"
"bombay biryani Restaurant, Shahibagh",https://www.zomato.com/ahmedabad/bombay-biryani-1-shahibagh,250,Biryani,3.6,28," Dariyakhan Ghummat, Shahibagh, Ahmedabad"
"hari om restaurant Restaurant, Naroda",https://www.zomato.com/ahmedabad/hari-om-restaurant-2-naroda,750,"North Indian, Fast Food, Chinese",3.4,27," 2/3, Vedant Aeon, Opposite Lubi Pump, Ring Road, Nana Chiloda, Naroda, Ahmedabad"
"kook du ku curries Restaurant, Ranip",https://www.zomato.com/ahmedabad/kook-du-ku-curries-ranip,500,North Indian,3.7,21," S/16, Suvarna Appartment, Part 2, Near Nirnay Nagar, Arjun Ashram - GST Crossing Road, Ranip, Ahmedabad"
"fyafulla food Restaurant, Infocity",https://www.zomato.com/ahmedabad/fyafulla-food-infocity-gandhinagar,350,"Chinese, North Indian",3.5,30," Opposite NIFT, Near TCS Office, Reliance Chokdi, Infocity, Gandhinagar"
"shree ashapura Restaurant, Hansol",https://www.zomato.com/ahmedabad/shree-ashapura-hansol,100,Desserts,3.3,16," Jhulelal Mandir Circle, Sardar Nagar, Opposite 126 Bus Stand, Hansol, Ahmedabad"
"shangri la grand Restaurant, Sarkhej",https://www.zomato.com/ahmedabad/shangri-la-grand-sarkhej,600,"North Indian, Asian",3.4,24," Pearl Hotel, Opposite Divya Dham Ashram, Near Ramdev Masala Factory, Sarkhej Bavla Highway, Changodar, Sarkhej, Ahmedabad"
"astodia jalebi dalvada Restaurant, Astodia",https://www.zomato.com/ahmedabad/astodia-jalebi-dalvada-astodia,150,Street Food,3.4,34," Near Astodia Darwaza, Astodia, Ahmedabad"
"london bubble co Restaurant, Prahlad Nagar",https://www.zomato.com/ahmedabad/london-bubble-co-prahlad-nagar,400,"Desserts, Beverages",4.6,579," 24, Rivera Arcade, Opposite Venus Atlantis, Prahlad Nagar, Ahmedabad"
"little french house Restaurant, Navrangpura",https://www.zomato.com/ahmedabad/little-french-house-navrangpura,"1,000",Cafe,4.3,614," Ground Floor, Citizen Arena, Opposite Nidhi Hospital, Near Stadium Circle, Navrangpura, Ahmedabad"
"ninis kitchen Restaurant, Prahlad Nagar",https://www.zomato.com/niniskitchen,"1,000","North Indian, Italian, Fast Food",4.5,1969," 9C, Venus Atlantis, Near Shell Petrol Pump, Prahlad Nagar, Ahmedabad"
"soulmate make moments memorable Restaurant, Navrangpura",https://www.zomato.com/ahmedabad/soulmate-make-moments-memorable-navrangpura,"1,500","Italian, Continental",4.7,608," Shop 102, Addor Aspire, University Road, Navrangpura, Ahmedabad"
"mcdonalds Restaurant, Gurukul",https://www.zomato.com/ahmedabad/mcdonalds-gurukul,500,"Burger, Fast Food",4,795," Himalaya Mall, Near Indraprasth Towers, Drive-In Road, Gurukul, Ahmedabad"
"fozzies pizzaiolo cafe deli Restaurant, Bodakdev",https://www.zomato.com/ahmedabad/fozzies-pizzaiolo-cafe-deli-bodakdev,900,"Cafe, Italian",4.1,1855," 1st Floor, Maruti Crystal, Opposite Rajpath Club, Service Road, Bodakdev, Ahmedabad"
"honest Restaurant, Prahlad Nagar",https://www.zomato.com/ahmedabad/honest-prahlad-nagar,700,"North Indian, South Indian, Fast Food, Chinese",4,1161," 1-3, Ground Floor, Circle P Complex, Prahlad Nagar, Ahmedabad"
"cafe de italiano Restaurant, Bodakdev",https://www.zomato.com/ahmedabad/cafe-de-italiano-bodakdev,950,"Cafe, Italian, Desserts",4.3,993," Opposite Stellar, Sindhu Bhavan Road, Bodakdev, Ahmedabad"
"swati snacks Restaurant, Ellis Bridge",https://www.zomato.com/ahmedabad/swati-snacks-ellis-bridge,600,"Fast Food, Street Food, South Indian",4.8,1598," Near Law Garden, Ellis Bridge, Ahmedabad"
"varietea Restaurant, Bodakdev",https://www.zomato.com/ahmedabad/varietea-bodakdev,600,"Cafe, Fast Food, Tea",4.2,662," 4th Floor, Wing B, Shilp Aaron, Off S.G Highway, Sindhu Bhavan Road, Bodakdev, Ahmedabad"
"mondo kitchen Restaurant, Gota",https://www.zomato.com/ahmedabad/the-mondo-kitchen-gota,"1,000","Chinese, North Indian, Italian, Beverages",4.1,798," A-101, S G Business Hub, Near Gota Over Bridge, Gota, Ahmedabad"
"i love sandwich house Restaurant, Bodakdev",https://www.zomato.com/ahmedabad/i-love-sandwich-house-bodakdev,900,"Cafe, Sandwich",4.2,1386," Ground Floor, Shaival Complex, Opposite Rajpath Club, S G Highway, Bodakdev, Ahmedabad"
"urban khichdi Restaurant, Vastrapur",https://www.zomato.com/ahmedabad/urban-khichdi-vastrapur,600,North Indian,4.6,925," A -103, Shivalik Plaza, Opposite AMA, IIM Road, Panjrapole, Vastrapur, Ahmedabad"
"secret kitchen Restaurant, Bodakdev",https://www.zomato.com/ahmedabad/the-secret-kitchen-bodakdev,"2,000","North Indian, Beverages",4.2,762," 2nd Floor, Times Square 2, Near Avalon Hotel, Sindhu Bhavan Road, Bodakdev, Ahmedabad"
"eat punjab Restaurant, Chandkheda",https://www.zomato.com/ahmedabad/eat-punjab-chandkheda,750,"North Indian, Chinese, Fast Food",3.6,1510," Swagat Status 1, Near Engineering College, New CG Road, Chandkheda, Ahmedabad"
"radhe corner Restaurant, Naranpura",https://www.zomato.com/ahmedabad/radhe-corner-naranpura,300,Fast Food,3.8,57," Sardar Patel Colony, Sardar Patel Bavla, Stadium Road, Naranpura, Ahmedabad"
"dessert king Restaurant, Mani Nagar",https://www.zomato.com/ahmedabad/dessert-king-mani-nagar,300,"Desserts, Ice Cream",3.5,32," G-4, Empire Heights, Sahyadri Bungalows, Ghodasar, Mani Nagar, Ahmedabad"
"cafe urbanyan Restaurant, Bopal",https://www.zomato.com/ahmedabad/cafe-urbanyan-bopal,500,"Fast Food, Chinese",3.5,40," 301, A Wing, Celebration City Center, Zimkhana Road, South Bopal, Bopal, Ahmedabad"
"momos cart Restaurant, Mani Nagar",https://www.zomato.com/ahmedabad/momos-cart-mani-nagar,200,Momos,3.4,42," Opposite Swaminarayan Chatralay, Mani Nagar, Ahmedabad"
"laxmi bakery Restaurant, Sector 6, Gandhinagar",https://www.zomato.com/ahmedabad/laxmi-bakery-sector-6-gandhinagar,300,Bakery,3.8,60," 1GF, Apna Bazar, Sector 6, Gandhinagar"
"tulis royal bengal Restaurant, Infocity",https://www.zomato.com/ahmedabad/tulis-royal-bengal-infocity-gandhinagar,250,"Bengali, North Indian, Chinese",3.7,45," A-gff 37 nr. Reliance cross road,opp.rajdhani society,village kudasan,gandhinagar,gujarat,pin-382421"
"d big man sandwich Restaurant, Ambavadi",https://www.zomato.com/ahmedabad/d-big-man-sandwich-ambavadi,200,Sandwich,3.6,60," Ruxmani Nivas, Near C.N School, Ambawadi, Ahmedabad"
"status fancy dhosa Restaurant, Gota",https://www.zomato.com/ahmedabad/status-fancy-dhosa-gota,300,South Indian,3.5,65," Shop 5, Krishna Heights, Near Godrej Garden City Road, Jagatpur Railway Crossing, Jagatpur, Gota"
"surbhi dining hall Restaurant, Sarkhej",https://www.zomato.com/ahmedabad/surbhi-dining-hall-sarkhej,300,Gujarati,3.6,56," Satyam Arcade, Moraiya Patiya, Changodar, Sarkhej Bavla Highway, Sarkhej, Ahmedabad"
"bmg dosa den Restaurant, Airport Gandhinagar Highway",https://www.zomato.com/ahmedabad/bmg-dosa-den-airport-gandhinagar-highway-gandhinagar,600,South Indian,3.6,59," C 05, Business Park, PDPU Road, Raysan, Airport Gandhinagar Highway, Gandhinagar"
"kum kum restaurant Restaurant, Sector 16, Gandhinagar",https://www.zomato.com/ahmedabad/kum-kum-restaurant-sector-16-gandhinagar,50,"North Indian, Chinese, Continental",3.3,64," C - 9, Patnagar Yojna Bhavan, Sector 16, Gandhinagar"
"agarwal kachori centre Restaurant, Shahibagh",https://www.zomato.com/ahmedabad/agarwal-kachori-centre-shahibagh,600,Street Food,4,80," Opposite B G Towers, Near Delhi Gate, Shahibagh, Ahmedabad"
"atithi gokul Restaurant, Gota",https://www.zomato.com/ahmedabad/atithi-gokul-gota,500,Gujarati,2.6,63," Gota Cross Roads, S G Highway, Gota, Ahmedabad"
"yummy food corner Restaurant, Thaltej",https://www.zomato.com/ahmedabad/yummy-food-corner-thaltej,400,"North Indian, Chinese",3.6,55," Sarkhej, Gandhinagar Highway, Thaltej, Ahmedabad"
"1bite Restaurant, Chandkheda",https://www.zomato.com/ahmedabad/1bite-chandkheda,,"Italian, Continental",3.5,45," GF, Shop 5, Sahyog Plaza, Opposite Vishwakarma Engineering College, Sabarmati-Koba Highway, Chandkheda, Ahmedabad"
"ghar ka dabba Restaurant, Airport Gandhinagar Highway",https://www.zomato.com/ahmedabad/ghar-ka-dabba-1-airport-gandhinagar-highway-gandhinagar,350,"Gujarati, Fast Food, North Indian",2.9,21," 29, Pramukh Cypras, Near Reliance Cross, Airport Gandhinagar Highway, Gandhinagar"
"tasalli cafe bistro Restaurant, Nikol",https://www.zomato.com/ahmedabad/tasalli-cafe-and-bistro-1-nikol,350,Cafe,3.4,41," B13, Avnee Avenue, Near Bhawani Chowk, Naroda Road, New Naroda, Nikol, Ahmedabad"
"tropical sno Restaurant, Bodakdev",https://www.zomato.com/ahmedabad/tropical-sno-bodakdev,400,"Desserts, Beverages, Fast Food",3.7,24," Ground Floor, Armeida, Sindhubhavan Road, Bodakdev, Ahmedabad"
"tea post Restaurant, Navrangpura",https://www.zomato.com/ahmedabad/tea-post-2-navrangpura,200,"Beverages, Fast Food",3.6,32," HSG House, Vijay Char Rasta, Navrangpura, Ahmedabad"
"nandini south dosa corner Restaurant, Chandkheda",https://www.zomato.com/ahmedabad/nandini-south-dosa-corner-1-chandkheda,250,South Indian,3.4,36," Shop B 6, Vrundavan Pearl 1, Chandkheda, Ahmedabad"
"oo my grill Restaurant, Gota",https://www.zomato.com/ahmedabad/oo-my-grill-gota,"1,000","North Indian, Mughlai, Seafood, Biryani",3.4,26," B-06, S.G. Business Hub, S.G. Highway, Gota, Ahmedabad"
"punjab tadka Restaurant, Thaltej",https://www.zomato.com/ahmedabad/punjab-tadka-thaltej,600,"North Indian, Chinese, South Indian",2.6,37," Gurudwara Govenddham Lane, S G Highway, Thaltej, Ahmedabad"
"krishna fast food Restaurant, C G Road",https://www.zomato.com/ahmedabad/krishna-fast-food-c-g-road,200,"Fast Food, Street Food, South Indian",3.2,32," G 1, Sarthak Complex 1, Swastik Cross Road, Behind Urja House, C G Road, Ahmedabad"
"mysor cafe Restaurant, Ashram Road",https://www.zomato.com/ahmedabad/mysor-cafe-ashram-road,450,"South Indian, North Indian",3.6,39," 46, Ajanta Commercial Centre, Near Income Tax Office, Ashram Road, Ahmedabad"
"maruti coffee shop Restaurant, Shahibagh",https://www.zomato.com/ahmedabad/maruti-coffee-shop-shahibagh,150,"Fast Food, North Indian",3.7,41," Shop 1, Dhabar Nagar Society, Opposite U N Mehta Hospital, Civil Road, Shahibagh, Ahmedabad"
"tamarind Restaurant, Memnagar",https://www.zomato.com/ahmedabad/tamarind-memnagar,700,"North Indian, South Indian, Chinese",3.6,23," 1, Hotel Treatotel, LK Society, Near Sterling Hospital, Memnagar, Ahmedabad"
"food treasure Restaurant, Satellite",https://www.zomato.com/ahmedabad/food-treasure-satellite,300,"Fast Food, Beverages, Juices",3.6,34," B 17, Neha Park Society, Near Bhileshwar Mahadev Road, Jodhpur Gam, Satellite, Ahmedabad"
"punjabi chaap corner Restaurant, Chandkheda",https://www.zomato.com/ahmedabad/punjabi-chaap-corner-chandkheda,750,"North Indian, Rolls, Chinese",3.5,29," 2, Ground Floor, Vitthal The Mall, Near Swagat Status, Koba, Motera, Chandkheda, Ahmedabad"
"bheruji fast food Restaurant, Ghatlodia",https://www.zomato.com/ahmedabad/bheruji-fast-food-ghatlodia,300,"Street Food, South Indian, Chinese",3.5,50," 10, Ravi Kunj Shopping Center, Pancholi House, Ghatlodia, Ahmedabad"
"desi dhaba Restaurant, Adalaj",https://www.zomato.com/ahmedabad/desi-dhaba-adalaj,400,"North Indian, Chinese",3,19," Vaishno Devi Circle, Opposite KD Hospital, Adalaj, Ahmedabad"
"siddheshwar food center Restaurant, Nikol",https://www.zomato.com/ahmedabad/siddheshwar-food-center-nikol,250,Fast Food,3.3,12," B1, Karnavati Shoping Center, Nikol Gam Road, Near Saraswati School, Nikol, Ahmedabad"
"shree goras Restaurant, Subhash Bridge",https://www.zomato.com/ahmedabad/shree-goras-subhash-bridge,450,"Gujarati, North Indian",2.8,17," Ground Floor, Nandanvan Complex, RTO Circle, Subhash Bridge, Ahmedabad"
"decent take away Restaurant, Chandkheda",https://www.zomato.com/ahmedabad/decent-take-away-chandkheda,450,"North Indian, Mughlai, Chinese, Fast Food",3.2,17," 14, Shopping Center, Opposite Visat Petrol Pump, Motera, Chandkheda, Ahmedabad"
"rajasthan bhojanalaya Restaurant, Shahibagh",https://www.zomato.com/ahmedabad/rajasthan-bhojanalaya-shahibagh,150,"Rajasthani, Gujarati",3.4,15," Rajasthan Hospital Road, Kedar Tower, Shahibagh Camp Road, Shahibagh, Ahmedabad"
"rashis kitchen Restaurant, Thaltej",https://www.zomato.com/ahmedabad/rashis-kitchen-thaltej,300,"North Indian, Gujarati",3.3,14," New York Tower, Near Ford Showroom, Thaltej Cross Roads, Thaltej, Ahmedabad"
