name,link,cost for 2,cuisines,ratings,reviews,address
"live punjabi chinese Restaurant, Manek Chowk",https://www.zomato.com/ahmedabad/live-punjabi-chinese-manek-chowk,400,"North Indian, Chinese",3.2,17," Near Rani Ka Hajira, Manek Chowk, Ahmedabad"
"jay kalyan pauva corner Restaurant, Satellite",https://www.zomato.com/ahmedabad/jay-kalyan-pauva-corner-satellite,200,"Street Food, South Indian",3.4,16," Opposite ISRO, Near Nandi Hall, Satellite, Ahmedabad"
"mainlane 13 Restaurant, Chandkheda",https://www.zomato.com/ahmedabad/mainlane-13-chandkheda,450,"Chinese, North Indian",3.3,17," 13/H, Karnavati Society, Opposite Sharda Petrol Pump, Chandkheda, Ahmedabad"
"shivam restaurant Restaurant, Chandlodia",https://www.zomato.com/ahmedabad/shivam-restaurant-chandlodia,200,"North Indian, Chinese",3.1,16," Shop 7-8, Durga Shakti Comlpex, Chandlodia Lake, Chandlodia, Ahmedabad"
"karnavati Restaurant, Paldi",https://www.zomato.com/ahmedabad/karnavati-paldi,200,"Fast Food, Street Food",3.4,23," Opposite Paldi Bus Stand, Paldi, Ahmedabad"
"cravyng cafe snacks Restaurant, Vastrapur",https://www.zomato.com/ahmedabad/cravyng-cafe-snacks-vastrapur,100,"Sandwich, Street Food, Beverages",3.3,11," Shop 18, Sardar Center, Opposite Vastrapur Lake, Vastrapur, Ahmedabad"
"zen cafe Restaurant, Navrangpura",https://www.zomato.com/ahmedabad/zen-cafe-navrangpura,800,"Cafe, Fast Food",4.2,593," Kasturbhai Lalbhai Campus, University Area, Navrangpura, Ahmedabad"
"masty Restaurant, Satellite",https://www.zomato.com/ahmedabad/masty-1-satellite,600,"North Indian, Mughlai, Chinese",3.9,613," Near Apple Global School, SG Highway, Satellite, Ahmedabad"
"epitome Restaurant, Isanpur",https://www.zomato.com/ahmedabad/epitome-isanpur,"1,000","Chinese, Continental, North Indian",4.1,551," 102, Kansas Complex, Ghodasar Cross Road, Near Smruti Mandir, Ghodasar, Isanpur, Ahmedabad"
"timpani radisson blu Restaurant, Ambavadi",https://www.zomato.com/ahmedabad/timpani-radisson-blu-ambavadi,"1,800","North Indian, Italian, Chinese, Continental",4.1,543," Radisson Blu, Near Panchvati Cross Road, Off CG Road, Ambavadi, Ahmedabad"
"foodinn Restaurant, Ashram Road",https://www.zomato.com/ahmedabad/foodinn-ashram-road,900,"North Indian, Hyderabadi",3.9,576," Ground Floor, Mohini 2, Opposite Gandhigram Railway Station, Ashram Road, Ahmedabad"
"alinea restaurant banquet Restaurant, C G Road",https://www.zomato.com/ahmedabad/alinea-restaurant-banquet-c-g-road,650,"North Indian, Chinese",3.9,474," 3rd Eye 2, Opposite Parimal Garden,Panchvati Cross Road, C G Road, Ahmedabad"
"gormoh Restaurant, Bodakdev",https://www.zomato.com/ahmedabad/gormoh-bodakdev,900,"North Indian, Chinese, Fast Food",3.9,525," Ground Floor, Rudra Square, Judges Bungalow Cross Road, Bodakdev, Ahmedabad"
"das khaman Restaurant, Navrangpura",https://www.zomato.com/ahmedabad/das-khaman-navrangpura,200,Street Food,4.5,319," 2, Trade Centre, Stadium Road, Navrangpura, Ahmedabad"
"tandoorworkz Restaurant, C G Road",https://www.zomato.com/ahmedabad/tandoorworkz-c-g-road,650,"Fast Food, North Indian",4,469," 7, Dev Complex, Opposite Parimal Garden Main Gate, C G Road, Ahmedabad"
"kadak bhagat Restaurant, Bodakdev",https://www.zomato.com/ahmedabad/kadak-bhagat-bodakdev,900,"North Indian, Chinese, Fast Food",3.9,507," Shop 3, Ground Floor, Silver Radiance Building, Near Pakwan Cross Road, Bodakdev, Ahmedabad"
"jay ambe thali Restaurant, Thaltej",https://www.zomato.com/ahmedabad/jay-ambe-thali-thaltej,300,North Indian,3.9,611," G-12, JB Tower, Near TV Tower, Drive In Road, Thaltej, Ahmedabad"
"firangi zaayka Restaurant, Chandkheda",https://www.zomato.com/ahmedabad/firangi-zaayka-chandkheda,800,"Asian, Chinese, North Indian, Biryani",3.8,582," Shop 9, Sopan Complex, Near ICICI Bank, New CG Road, Chandkheda, Ahmedabad"
"burgerlicious Restaurant, Navrangpura",https://www.zomato.com/ahmedabad/burgerlicious-navrangpura,400,"Burger, Fast Food",4.4,403," 105, University plaza, Upper Level, Near Vijay Cross Roads, Navrangpura, Ahmedabad"
"foodsta Restaurant, Airport Gandhinagar Highway",https://www.zomato.com/ahmedabad/foodsta-airport-gandhinagar-highway-gandhinagar,400,"North Indian, Chinese, Fast Food",3.3,612," 51, Radhey Square Complex, Kudasan, Airport Gandhinagar Highway, Gandhinagar"
"hotel zk Restaurant, Relief Road",https://www.zomato.com/ahmedabad/hotel-zk-relief-road,700,"North Indian, Chinese, Mughlai",3.9,466," Opposite Relief Cinema, Relief Road, Ahmedabad"
"tryo kitchen Restaurant, Chandkheda",https://www.zomato.com/ahmedabad/tryo-kitchen-chandkheda,"1,400","North Indian, Chinese, Seafood",4.4,83," Shop F/4, 1st Floor, Sahyog Plaza, Opposite Engineering Collage, Gandhinagar Highway, Motera, Chandkheda, Ahmedabad"
"vaibhav restaurant Restaurant, Ambavadi",https://www.zomato.com/ahmedabad/vaibhav-restaurant-ambavadi,400,"North Indian, South Indian, Fast Food",4,216," Panjrapole Cross Roads, Ambavadi, Ahmedabad"
"aamantran fast food Restaurant, Vejalpur",https://www.zomato.com/ahmedabad/aamantran-fast-food-1-vejalpur,300,Street Food,3.8,263," 36, Jagganath Park, Jivraj Park, Vejalpur, Ahmedabad"
"diamond fry centre Restaurant, Rakhial",https://www.zomato.com/ahmedabad/diamond-fry-centre-rakhial,550,"North Indian, Chinese",3.8,221," Opposite Usha Cinema Gomtipur, Rakhial, Ahmedabad"
"oshwal restaurant Restaurant, Bodakdev",https://www.zomato.com/ahmedabad/oshwal-restaurant-bodakdev,600,"North Indian, South Indian, Chinese",4,162," 4, City Mall, S G Road, Near Rajpath Club, Bodakdev, Ahmedabad"
"cafe city monk Restaurant, Thaltej",https://www.zomato.com/ahmedabad/cafe-city-monk-thaltej,500,Cafe,3.8,132," Basement, New York Tower A, Char Rasta, SG Road, Thaltej, Ahmedabad"
"kuro renaissance hotel Restaurant, Sola",https://www.zomato.com/ahmedabad/kuro-renaissance-hotel-sola,"1,500","Japanese, Asian, Chinese",4.2,147," Renaissance Hotel, SG Highway, Behind Ganesh Meridian, Sola, Ahmedabad"
"?rotlo dining hall Restaurant, Ghatlodia",https://www.zomato.com/ahmedabad/rotlo-the-dining-hall-ghatlodia,250,North Indian,4.1,212," A/11, Shivam Arcade, Opposite Rajyog Complex, Chanakyapuri, Ghatlodia, Ahmedabad"
"khana khazana Restaurant, Satellite",https://www.zomato.com/ahmedabad/khana-khazana-1-satellite,400,"North Indian, Chinese",3.7,243," 4, Neelkanth Palace, Opposite Seema Hall, Satellite, Ahmedabad"
"kaushals food court Restaurant, Paldi",https://www.zomato.com/ahmedabad/kaushals-food-court-paldi,400,South Indian,3.9,222," 25, Dasha Porwad Society, Behind Paldi Bus Stop, Paldi, Ahmedabad"
"punjab paratha point Restaurant, Navrangpura",https://www.zomato.com/ahmedabad/punjab-paratha-point-navrangpura,200,North Indian,4,223," 1 B/A, Princess Lane, Near Jain Dairy, Swastik Char Rasta, Navrangpura, Ahmedabad"
"new bombay bhaji pav Restaurant, Gurukul",https://www.zomato.com/ahmedabad/new-bombay-bhaji-pav-gurukul,400,"Fast Food, Chinese",3.9,217," 3, Sunrise Shopping Center, Drive In Road, Gurukul, Ahmedabad"
"lalit palace Restaurant, Shahibagh",https://www.zomato.com/ahmedabad/lalit-palace-shahibagh,500,"North Indian, South Indian",3.7,133," 40, Dhanlaxmi Chambers, Near Police Commissioner Office, Shahibagh, Ahmedabad"
"modi express Restaurant, Mani Nagar",https://www.zomato.com/ahmedabad/modi-express-mani-nagar,200,"Fast Food, Sandwich",3.4,246," Sahil Complex, Opposite Jalaram Plaza, Jawahar Chowk, Mani Nagar, Ahmedabad"
"shree gokulesh farari centre Restaurant, Naroda",https://www.zomato.com/ahmedabad/shree-gokulesh-farari-centre-naroda,100,Street Food,3.9,228," 4, Ashvarath,  Near Galaxy Cinema, Naroda, Ahmedabad"
"shree umiya bhojanalay Restaurant, Naroda",https://www.zomato.com/ahmedabad/shree-umiya-bhojanalay-naroda,250,"Gujarati, Rajasthani, Fast Food",-,," Opposite Indian Oil Petrol Pump, Naroda - Chiloda Highway, Naroda, Ahmedabad"
"ddbhajipav Restaurant, Paldi",https://www.zomato.com/ahmedabad/d-d-bhajipav-paldi,250,Street Food,-,," 6, Omdeep Apartment, Narayannagar Road, Paldi, Ahmedabad"
"tulsi bakers Restaurant, Airport Gandhinagar Highway",https://www.zomato.com/ahmedabad/tulsi-bakers-airport-gandhinagar-highway-gandhinagar,300,"Bakery, Fast Food",-,," Shop 103, IIT Gandhinagar Campus, Village Palaj, Airport Gandhinagar Highway, Gandhinagar"
"shreenath fast food  Restaurant, Navrangpura",https://www.zomato.com/ahmedabad/shreenath-fast-food-1-navrangpura,150,Fast Food,-,," 1, Aarasur Complex, Opposite Tulsi Restaurant, University Road, Navrangpura, Ahmedabad"
"rc chinese fast food Restaurant, Nava Vadaj",https://www.zomato.com/ahmedabad/rc-chinese-fast-food-nava-vadaj,250,Chinese,NEW,," Shop 3, 2266/313, Uddhav Nagar, Sarobji Compound, Juna Vadaj, Ahmedabad"
"punjab grill Restaurant, Airport Gandhinagar Highway",https://www.zomato.com/ahmedabad/punjab-grill-2-airport-gandhinagar-highway-gandhinagar,350,North Indian,NEW,," Shop 9, Foodies Lane, Opposite Nagraj Party Plot, Kudasan, Airport Gandhinagar Highway, Gandhinagar"
"shreeji food mall Restaurant, Mani Nagar",https://www.zomato.com/ahmedabad/shreeji-the-food-mall-mani-nagar,250,"Street Food, Fast Food",-,," Shop 8, Virji Mansion, Bhairavnath Cross Road, Near UCO Bank, Mani Nagar, Ahmedabad"
"navkar corner Restaurant, Nava Vadaj",https://www.zomato.com/ahmedabad/navkar-corner-nava-vadaj,300,Street Food,-,," Opposite Famous Stationary, Bhimjipura, Nava Vadaj, Ahmedabad"
"russian bakery Restaurant, Bapunagar",https://www.zomato.com/ahmedabad/russian-bakery-bapunagar,200,Bakery,-,," Shop 38, Shri Shiv Shakti Market, Char Rasta, Bapunagar, Ahmedabad"
"krishna coffee snacks bar Restaurant, Mani Nagar",https://www.zomato.com/ahmedabad/krishna-coffee-snacks-bar-mani-nagar,150,Fast Food,-,," G 11, Radhey Shopping Mall, Khokhra Circle, Mani Nagar, Ahmedabad"
"desi tadka Restaurant, Gurukul",https://www.zomato.com/ahmedabad/desi-tadka-gurukul,300,North Indian,NEW,," 214, Gajendra society, Opp Katariya Moters, Silverstar Cross Road, Chandlodiya, Ahmedabad"
"babubhai na masala bun mirchi Restaurant, Navrangpura",https://www.zomato.com/ahmedabad/babubhai-na-masala-bun-mirchi-navrangpura,100,Street Food,NEW,," Umashankar Joshi Marg, Vasant Vihar, Navrangpura, Ahmedabad"
"sushmita fast food Restaurant, Navrangpura",https://www.zomato.com/ahmedabad/sushmita-fast-food-navrangpura,150,Fast Food,NEW,," Ground Floor, Rajkrupa Flats, Opposite Cross Word, Mithakhadi 6 Road, Navrangpura, Ahmedabad"
"shree khodal food corner Restaurant, Nava Vadaj",https://www.zomato.com/ahmedabad/shree-khodal-food-corner-nava-vadaj,350,"North Indian, Chinese, South Indian",NEW,," 172, Hanumanpura, Nava Vadaj, Ahmedabad"
"rajkamal dhaba Restaurant, Naroda",https://www.zomato.com/ahmedabad/rajkamal-dhaba-naroda,400,"Gujarati, North Indian, Chinese",-,," Nana Chiloda, Ring Road, Near Ranasar Circle, Naroda, Ahmedabad"
"karnawati dabeli centre Restaurant, Mani Nagar",https://www.zomato.com/ahmedabad/karnawati-dabeli-centre-mani-nagar,150,"Street Food, Fast Food",4.4,323," 1, Radhamandir Complex, Opposite Hirabhai Tower, Uttamnagar, Mani Nagar, Ahmedabad"
"cafe treat pride hotel Restaurant, Bodakdev",https://www.zomato.com/ahmedabad/cafe-treat-the-pride-hotel-bodakdev,"1,500","North Indian, Continental",3.6,261," The Pride Hotel, Judges Bungalow Road, Off S.G. Highway, Bodakdev, Ahmedabad"
"7 wonders hotel Restaurant, Airport Gandhinagar Highway",https://www.zomato.com/ahmedabad/7-wonders-hotel-airport-gandhinagar-highway-gandhinagar,900,"Fast Food, Chinese, North Indian",3.9,287," 7th Floor, Ugti Cooperate Park, Opposite HDFC Bank, Kudasan, Airport Gandhinagar Highway, Gandhinagar"
"william johns pizza Restaurant, Bopal",https://www.zomato.com/ahmedabad/william-johns-pizza-bopal,500,"Pizza, Fast Food",3.2,349," Orchid Centre, Opposite Safal Parisar 2, South Bopal, Bopal, Ahmedabad"
"green pearl restaurant Restaurant, Bodakdev",https://www.zomato.com/ahmedabad/the-green-pearl-restaurant-bodakdev,900,"North Indian, Italian, Mexican, Chinese",3.9,325," Opposite Satva Vikas School, Sindhu Bhavan Road, Bodakdev, Ahmedabad"
"karnavati dabeli Restaurant, Naranpura",https://www.zomato.com/ahmedabad/karnavati-dabeli-1-naranpura,150,"Street Food, Fast Food, Sandwich, Pizza",4,362," 2, Aalishan Complex, Near Sardar Patel Statue, Stadium Road, Naranpura, Ahmedabad"
"amdos kitchen Restaurant, Paldi",https://www.zomato.com/ahmedabad/amdos-kitchen-paldi,300,"Chinese, Momos",3.8,287," Near Bhagtacharya Road, Kocharab, Paldi, Ahmedabad"
"rasranjan Restaurant, Navrangpura",https://www.zomato.com/ahmedabad/rasranjan-navrangpura,350,"Mithai, Street Food",3.7,337," Rasranjan House, Vijay Cross Road, Navrangpura, Ahmedabad"
"moi dessert studio Restaurant, Bodakdev",https://www.zomato.com/ahmedabad/moi-the-dessert-studio-bodakdev,900,Bakery,4.3,213," Ground Floor, Satkar Appartment, Near Judges Bunglow Cross Road, Bodakdev, Ahmedabad"
"vipul dudhiya sweets Restaurant, Satellite",https://www.zomato.com/ahmedabad/vipul-dudhiya-sweets-1-satellite,300,"Mithai, Street Food, Gujarati",4.3,367," Dhanlaxmi Market, Opposite Nehrunagar, BRTS Bus Stand, Satellite, Ahmedabad"
"falafel express Restaurant, Navrangpura",https://www.zomato.com/ahmedabad/falafel-express-navrangpura,600,"Italian, Greek, Mediterranean",3.8,281," Shop 3, Ground Floor, Malti Apartments, Vijay Cross Road, Navrangpura, Ahmedabad"
"swaad sadan Restaurant, Bodakdev",https://www.zomato.com/ahmedabad/swaad-sadan-bodakdev,700,Gujarati,4.1,206," 103, Sumel Complex, Sarkhej - Gandhinagar Highway, Bodakdev, Ahmedabad"
"megh malhar fancy dosa Restaurant, Airport Gandhinagar Highway",https://www.zomato.com/ahmedabad/megh-malhar-fancy-dosa-airport-gandhinagar-highway-gandhinagar,300,South Indian,3.6,362," Radhe Square Complex, Opposite NID College, Reliance Crossroads. 
Kudasan, Airport Gandhinagar Highway, Gandhinagar"
"pizza zone Restaurant, Naranpura",https://www.zomato.com/ahmedabad/pizza-zone-1-naranpura,500,"Pizza, Fast Food",3.6,332," 1st Floor, Shivalik Yash, 132 Feet Ring Road, Naranpura, Ahmedabad"
"zenith Restaurant, Paldi",https://www.zomato.com/ahmedabad/zenith-paldi,700,"North Indian, Chinese",3.8,382," 1st Floor, Anil Kunj Centre, Opposite Mehandi Nawaz Ganj Hall, Paldi Cross Road, Paldi, Ahmedabad"
"suvidha dhosa center Restaurant, Bopal",https://www.zomato.com/ahmedabad/suvidha-dhosa-center-bopal,300,South Indian,-,," 8, Anveshan Bunglow, BRTS Bus Stop, Opposite Umiya Mata Temple, Bopal Ghuma Road, Bopal, Ahmedabad."
"aksha bombay seekh paratha fry center Restaurant, Shahpur",https://www.zomato.com/ahmedabad/aksha-bombay-seekh-paratha-fry-center-shahpur,250,North Indian,-,," 1753/1, Near Dinbhai Tower, Mirzapur, Shahpur, Ahmedabad"
"paul bakery Restaurant, Gota",https://www.zomato.com/ahmedabad/the-paul-bakery-gota,700,Bakery,NEW,," Shop 17, Savya, Near Vrundawan Height, New CG Road, Gota, Ahmedabad"
"indorie Restaurant, Navrangpura",https://www.zomato.com/ahmedabad/indorie-navrangpura,150,Street Food,-,," G2, Vishvamitra Complex, Opposite Kalupur Bank, Stadium Road, Navrangpura, Ahmedabad"
"hi foodie Restaurant, Bopal",https://www.zomato.com/ahmedabad/hi-foodie-bopal,200,"Fast Food, North Indian",NEW,," A 56, Amprapali Shopping Mall, D Mart, Sardar Patel Ring Road, Ambli, Bopal, Ahmedabad"
"mewad food zone Restaurant, Ghatlodia",https://www.zomato.com/ahmedabad/mewad-food-zone-ghatlodia,300,"Chinese, Fast Food",-,," 6, Ground Floor, Satyamev 2, Opposite Cargil Petrol Pump, SG Highway, Ghatlodiya, Ahmedabad"
"cs food Restaurant, Sabarmati",https://www.zomato.com/ahmedabad/cs-food-sabarmati,300,"Fast Food, Street Food, Chinese",-,," Near Sun Heights, Panchslok Cross Road, Chandkheda, Sabarmati, Ahmedabad"
"tasty trails Restaurant, Bopal",https://www.zomato.com/ahmedabad/tasty-trails-bopal,150,Fast Food,-,," G 7, Bhavya Complex, Bopal Road, Near Bopal, Ahmedabad"
"yash dosa Restaurant, Memnagar",https://www.zomato.com/ahmedabad/yash-dosa-memnagar,100,"South Indian, Street Food",-,," Surya Complex, Gurukul Road, Nilmani Society, Memnagar, Ahmedabad"
"kahanvi restaurant Restaurant, Naroda",https://www.zomato.com/ahmedabad/kahanvi-restaurant-naroda,200,"Street Food, Beverages",-,," Near Ranasan Toll Plaza, S.P. Ring Road, Muthiya, Naroda, Ahmedabad"
"akshar live steam dhokla Restaurant, Ellis Bridge",https://www.zomato.com/ahmedabad/akshar-live-steam-dhokla-ellis-bridge,200,Gujarati,-,," Galaxy Complex, Opposite Winny, National Handloom, Law garden, Ellis Bridge, Ahmedabad"
"gomti fast food Restaurant, Bodakdev",https://www.zomato.com/ahmedabad/gomti-fast-food-bodakdev,200,"Chinese, Street Food",-,," G11, Ratna Palace, Opposite Mother Palace, Bodakdev, Ahmedabad"
"bhatoorey Restaurant, Satellite",https://www.zomato.com/ahmedabad/bhatoorey-satellite,250,"Street Food, Fast Food, Beverages",NEW,," 234, Saman Complex, Mansi Circle, Suryapooja Block B, Satellite, Ahmedabad"
"kulche wala Restaurant, Gota",https://www.zomato.com/ahmedabad/kulche-wala-gota,250,Street Food,-,," Vamdematar Road, Gota, Ahmedabad"
"soft serve Restaurant, Vejalpur",https://www.zomato.com/ahmedabad/soft-serve-vejalpur,200,Beverages,-,," 10/1, Farha Duplex, Juhapura, Opposite AL Amin SOS, Vejalpur, Ahmedabad"
"baba egg zone Restaurant, Vastrapur",https://www.zomato.com/ahmedabad/baba-egg-zone-vastrapur,300,Fast Food,3.3,26," 1, Sagar Complex, Bodakdev Road, Vastrapur, Ahmedabad"
"zayka nonveg point Restaurant, Chandkheda",https://www.zomato.com/ahmedabad/zayka-nonveg-point-chandkheda,400,"North Indian, Chinese, Biryani",3.5,24," Shop 10, Ground Floor, Vithal Mall, Chandkheda, Ahmedabad"
"bakers make restaurant Restaurant, Sector 21, Gandhinagar",https://www.zomato.com/ahmedabad/bakers-make-restaurant-sector-21-gandhinagar,450,"Street Food, Fast Food",3,4," Near Navratri Chowk, Mahavir Nagar, Himatnagar, Sabarkantha, Sector 21, Gandhinagar"
"cake place radisson blu Restaurant, Ambavadi",https://www.zomato.com/ahmedabad/the-cake-place-radisson-blu-ambavadi,600,"Bakery, Desserts, Beverages",3.5,25," Radisson Blu, Near Panchvati Cross Road, Off CG Road, Ambavadi, Ahmedabad"
"aamin omlet centre Restaurant, Kankaria",https://www.zomato.com/ahmedabad/aamin-omlet-centre-kankaria,300,"Fast Food, Gujarati",3.5,20," Opposite National Cloth, Kodiyar Nagar Chokdi, Behrampura, Kankaria, Ahmedabad"
"yum flippers Restaurant, Gota",https://www.zomato.com/ahmedabad/yum-flippers-1-gota,350,"Pizza, Fast Food",3.4,23," FF 112, Vandematram Fabula, Behind Nirma University, Chharodi, Gota, Ahmedabad"
"govardhan thaal Restaurant, Ranip",https://www.zomato.com/ahmedabad/govardhan-thaal-ranip,350,Gujarati,2.8,22," 3rd Floor, Food Court, Arved Transcube Plaza, Ranip, Ahmedabad"
"shivshakti food center Restaurant, Bopal",https://www.zomato.com/ahmedabad/shivshakti-food-center-bopal,300,"North Indian, Gujarati",3.3,16," Shop 4 F, Satyam Complex, Opposite Toyota Service Center, Bopal, Ahmedabad"
"punjab sweets restaurant Restaurant, Ghatlodia",https://www.zomato.com/ahmedabad/punjab-sweets-the-restaurant-ghatlodia,500,"North Indian, Chinese",3.3,18," A 6, Shivam Arcade, RC Technical Road, Chanakyapuri, Ghatlodia, Ahmedabad"
"fg veg non veg cafe restaurant Restaurant, Gota",https://www.zomato.com/ahmedabad/fg-veg-non-veg-cafe-and-restaurant-gota,500,"Fast Food, North Indian, Mughlai",2.9,16," Near Charodi Bus Stand, S G Highway, Gota, Ahmedabad"
"red sun hotel tulip inn Restaurant, Sola",https://www.zomato.com/ahmedabad/the-red-sun-hotel-tulip-inn-sola,"1,230","North Indian, Fast Food",3,20," Hotel Tulip Inn, Sun Court, Near Sola Over Bridge, Sola, Ahmedabad"
"cane d Restaurant, Satellite",https://www.zomato.com/ahmedabad/cane-d-satellite,100,Beverages,3.4,25," 2, Saman Complex, Opposite Nalanda Complex, Satellite, Ahmedabad"
"ratlam cafe house Restaurant, Sarkhej",https://www.zomato.com/ahmedabad/ratlam-cafe-house-sarkhej,150,Coffee,3.4,25," 17, Al Asbab Park, Near Al-Burooj, 100Ft Road, Makarba, Sarkhej, Ahmedabad"
"budhalal dudhwala Restaurant, Manek Chowk",https://www.zomato.com/ahmedabad/budhalal-dudhwala-1-manek-chowk,300,Mithai,3.4,30," Mandvi Ni Pol, Opposite Harshukh Mehta Khancho, Manekchowk, Ahmedabad"
"jaydeep khana khazana Restaurant, Chandkheda",https://www.zomato.com/ahmedabad/jaydeep-khana-khazana-chandkheda,450,"North Indian, Chinese",3.5,27," 6, Swagat Status 1, Near Engineering Cross Road, New C G Road, Chandkheda, Ahmedabad"
"bake me away Restaurant, Ambavadi",https://www.zomato.com/ahmedabad/bake-me-away-ambavadi,350,"Bakery, Beverages",3.4,25," Shop 16, Janpath Shopping Centre, Opposite Azad Post Office, Behind Sahjand College, Ambavadi, Ahmedabad"
"indo china food junction Restaurant, Airport Gandhinagar Highway",https://www.zomato.com/ahmedabad/indo-china-food-junction-airport-gandhinagar-highway-gandhinagar,300,"South Indian, Chinese, Sandwich, Street Food",3.3,15," 10, Radhe Square, Reliance Cross Road, Kudasan, Airport Gandhinagar Highway, Gandhinagar"
"waffle co Restaurant, Shahibagh",https://www.zomato.com/ahmedabad/the-waffle-co-shahibagh,300,Desserts,3.3,23," Shahi Baug River Front, Behind Sardar Patel National Committee, Shahibagh, Ahmedabad"
"hotel grand neelam Restaurant, Shahibagh",https://www.zomato.com/ahmedabad/hotel-grand-neelam-shahibagh,400,"Mughlai, Chinese, North Indian",3.5,28," Near Baliya Limdi, Civil Hospital Road, Shahibagh, Ahmedabad"
"night kitchen Restaurant, Infocity",https://www.zomato.com/ahmedabad/the-night-kitchen-infocity-gandhinagar,400,"North Indian, Fast Food, Chinese",3.4,21," Shop C8, Business Park, PDPU Road, Raysan, Infocity, Gandhinagar"
"food zone Restaurant, Mani Nagar",https://www.zomato.com/ahmedabad/food-zone-mani-nagar,300,"Fast Food, Chinese",3.4,22," 389/FF, Padmavati Bhuvan, Chhawala Park Society, Near Saraswati Apartment, Mani Nagar, Ahmedabad"
"vinayak bhaji pav fast food Restaurant, Satellite",https://www.zomato.com/ahmedabad/vinayak-bhaji-pav-fast-food-satellite,300,"Street Food, Chinese",3.4,33," Anand Nagar Road, Opposite Rahul Tower, Satellite, Ahmedabad"
"shreeji nashta house Restaurant, Shahibagh",https://www.zomato.com/ahmedabad/shreeji-nashta-house-shahibagh,100,"Street Food, Fast Food",3.4,32," 3, Zara Complex,Opposite  Madhupura Market, Shahibagh, Ahmedabad"
"radhe snacks Restaurant, Airport Gandhinagar Highway",https://www.zomato.com/ahmedabad/radhe-snacks-airport-gandhinagar-highway-gandhinagar,200,"Fast Food, Street Food, Mithai",3.4,32," Shrirang Heights, PDPU Service Road, Airport Gandhinagar Highway, Gandhinagar"
"nescafe parlour Restaurant, Gulbai Tekra",https://www.zomato.com/ahmedabad/nescafe-parlour-gulbai-tekra,150,Fast Food,3.6,27," Near Shefali Apartments, University Area, Gulbai Tekra, Ahmedabad"
"new pizza point Restaurant, Sarkhej",https://www.zomato.com/ahmedabad/new-pizza-point-1-sarkhej,450,"Pizza, Fast Food",3.3,20," B9, Sagar Avenue, Juhapura Road, Near Ambar Tower, Sarkhej, Ahmedabad"
"chicken express Restaurant, Jamalpur",https://www.zomato.com/ahmedabad/chicken-express-jamalpur,400,"Burger, Wraps, Fast Food",NEW,," 531, Lilgar Jamat Building, Kotnirang, Purabiyawad, Behind Lilgar Madressa, Astodia Darwaja, Jamalpur, Ahmedabad"
"tawa ice cream Restaurant, Kankaria",https://www.zomato.com/ahmedabad/tawa-ice-cream-kankaria,250,"Desserts, Ice Cream",3,20," Shop No. L-02, Minaxi Avenue, Near Bright School, Lijjat Khaman, Pushpakunj, Kankaria, Ahmedabad"
"mom kitchen Restaurant, Jamalpur",https://www.zomato.com/ahmedabad/mom-kitchen-2-jamalpur,300,"North Indian, Chinese, Fast Food",3.5,21, Delivery Only
"indian zayka Restaurant, Sector 16, Gandhinagar",https://www.zomato.com/ahmedabad/indian-zayka-sector-16-gandhinagar,400,"Chinese, North Indian, Gujarati",3.3,28," 46, GH -5, Chopati, Sector 16, Gandhinagar"
"shantaben pani puri wala Restaurant, Ellis Bridge",https://www.zomato.com/ahmedabad/shantaben-pani-puri-wala-ellis-bridge,100,Street Food,3.5,46," Shree Harikrupa Building, Ellisbridge Corner, Ellis Bridge, Ahmedabad"
"amba refreshment Restaurant, Adalaj",https://www.zomato.com/ahmedabad/amba-refreshment-adalaj,300,"South Indian, Fast Food",3.8,47," Trimandir Sankul, Adalaj, Ahmedabad"
"shree siddhi vinayak mumbai vada pav Restaurant, Vejalpur",https://www.zomato.com/ahmedabad/shree-siddhi-vinayak-mumbai-vada-pav-vejalpur,150,Fast Food,3.3,47," J-302, Shree Nand Nagar, Part 4, Sonal Cinema Road, Vejalpur, Ahmedabad"
"quidos Restaurant, Satellite",https://www.zomato.com/ahmedabad/quidos-satellite,300,"South Indian, Beverages",3.6,26," Shop 13, 132 Feet Ring Road, Kameshwar Vihar, Satellite, Ahmedabad"
"pramukh kathiyavadi bhojanalay Restaurant, Sector 6, Gandhinagar",https://www.zomato.com/ahmedabad/pramukh-kathiyavadi-bhojanalay-1-sector-6-gandhinagar,250,"Gujarati, North Indian",3.3,33," Plot 1553, First Floor, Apna Bazar, Sector 6, Gandhinagar"
"kaka ni bhajipav Restaurant, Odhav",https://www.zomato.com/ahmedabad/kaka-ni-bhajipav-odhav,500,"North Indian, Fast Food",3.7,42," Shop Number 1-6, Shreeya Residency, SP Ring Road, Odhav, Ahmedabad"
"prince coffee bar Restaurant, Memnagar",https://www.zomato.com/ahmedabad/prince-coffee-bar-memnagar,250,"Fast Food, Street Food",3.6,36," Shop 5, Abhishek SOC, Opposite Jayant Park, Vishram Nagar, Gurukul Road, Memnagar, Ahmedabad"
"aavkar Restaurant, Sector 16, Gandhinagar",https://www.zomato.com/ahmedabad/aavkar-sector-16-gandhinagar,600,"North Indian, South Indian, Chinese",2.6,40," 318, Gh 4, Near Dena Bank, Sector 16, Gandhinagar"
"zamzam fry senter Restaurant, Sarkhej",https://www.zomato.com/ahmedabad/zamzam-fry-senter-sarkhej,300,"Fast Food, North Indian",3.7,35," Sarkhej Dhal Cross Road, Opposite Ali Fish And Chicken Center, Sarkhej Roza Road, Sarkhej, Ahmedabad"
"vrundavan sweets namkeen Restaurant, Sector 21, Gandhinagar",https://www.zomato.com/ahmedabad/vrundavan-sweets-and-namkeen-sector-21-gandhinagar,200,"Mithai, Street Food",3.3,30," A-12, District Shopping Centre, Sector 21, Gandhinagar"
