name,link,cost for 2,cuisines,ratings,reviews,address
"om niwas bakery line Restaurant, Bani Park",https://www.zomato.com/omniwasbakeryline,200,Bakery,3.6,36," Om Niwas Suite Hotel, E 23, Kaushalya Path, Durga Marg, Near Durga Apartments, Bani Park, Jaipur"
"cloud cake company Restaurant, Malviya Nagar",https://www.zomato.com/jaipur/cloud-cake-company-1-malviya-nagar,800,Bakery,3.6,16," Shop 8, Satkar Shopping Centre, Malviya Nagar, Jaipur"
"salsa hotel royal orchid Restaurant, Tonk Road",https://www.zomato.com/jaipur/salsa-hotel-royal-orchid-tonk-road,"2,000",Finger Food,3.6,37," Hotel Royal Orchid, Opposite BSNL Office, Near Durgapura Flyover, Durgapura, Tonk Road, Jaipur"
"hukum ae dost Restaurant, Tonk Road",https://www.zomato.com/jaipur/hukum-ae-dost-tonk-road,500,"Fast Food, Beverages",3.6,28," Gupta Bhawan, Opposite Jhulelal Mandir, Durgapura, Tonk Road, Jaipur"
"raju egg corner Restaurant, Vidhyadhar Nagar",https://www.zomato.com/jaipur/raju-egg-corner-vidhyadhar-nagar,100,Fast Food,3.6,40," Ambabari, Near Traffic Signal, Vidhyadhar Nagar, Jaipur"
"batras take away corner Restaurant, Raja Park",https://www.zomato.com/jaipur/batras-take-away-corner-1-raja-park,100,North Indian,3.6,42," 354, Lane 2, Opposite Hotel Doda's Palace, Raja Park, Jaipur"
"palapa Restaurant, Malviya Nagar",https://www.zomato.com/jaipur/palapa-1-malviya-nagar,600,"North Indian, Chinese, Fast Food",3.6,15," Shop 2b, B-41, Kardhani Shopping Centre, Hari Marg, Malviya Nagar, Jaipur"
"pizzarah Restaurant, Vaishali Nagar",https://www.zomato.com/jaipur/pizzarah-vaishali-nagar,450,Fast Food,3.6,35," Amar Jain Hospital, Opposite MTS Office, Vaishali Nagar, Jaipur"
"kanha bakeology Restaurant, C Scheme",https://www.zomato.com/jaipur/kanha-bakeology-c-scheme,450,Bakery,3.6,34," E 62, Basement Floor, Bhagatsingh Marg, C Scheme, Jaipur"
"amritsari junction Restaurant, Jawahar Nagar",https://www.zomato.com/jaipur/amritsari-junction-jawahar-nagar,600,North Indian,3.6,27," Shop G-1 A, Plot 7-KA-12, Jawahar Nagar, Jaipur"
"shankar walas namkeen Restaurant, Pink City",https://www.zomato.com/jaipur/shankar-walas-namkeen-pink-city,200,"Mithai, Bakery",3.6,44," 233, Southli Walo Ka Rasta, Chaura Rasta, Pink City, Jaipur"
"order hut by punjabi tadka Restaurant, Jawahar Nagar",https://www.zomato.com/jaipur/order-hut-by-punjabi-tadka-jawahar-nagar,350,North Indian,3.6,27," Shop G-1-A, Plot 7-KA-12, Jawahar Nagar, Jaipur"
"hotel bilal khana khazana Restaurant, Vidhyadhar Nagar",https://www.zomato.com/jaipur/hotel-bilal-khana-khazana-vidhyadhar-nagar,300,"North Indian, Mughlai",3.6,46," 23, Old Vidhyadhar Nagar, Vidhyadhar Nagar, Jaipur"
"stove stories Restaurant, Jawahar Nagar",https://www.zomato.com/jaipur/stove-stories-jawahar-nagar,400,North Indian,3.6,26," Shop G-1-A, Plot 7-KA-12, Jawahar Nagar, Jaipur"
"tiwari bhojanalaya Restaurant, Sindhi Camp",https://www.zomato.com/jaipur/tiwari-bhojanalaya-sindhi-camp,300,North Indian,3.6,41," 3, Station Road, Sindhi Camp, Jaipur"
"dads tea retreat Restaurant, Malviya Nagar",https://www.zomato.com/jaipur/dads-tea-retreat-malviya-nagar,300,"Fast Food, Tea, Beverages",3.4,27," Shop 5, Gold Souk Grande Mall, Malviya Nagar, Jaipur"
"egg farm Restaurant, Tonk Road",https://www.zomato.com/jaipur/egg-farm-tonk-road,400,"North Indian, Fast Food",3.4,28," Shop 2, Plot 67-68, Vikas Nagar, Airport Road, Budh Singh Pura, Sanganer, Tonk Road, Jaipur"
"mr kitchies Restaurant, Jagatpura",https://www.zomato.com/jaipur/mr-kitchies-jagatpura,500,North Indian,3.4,40," 90/31, Sector 9, Pratap Nagar, Ajay Marg, Jagatpura, Jaipur"
"jaies cafe golden tulip Restaurant, MI Road",https://www.zomato.com/jaipur/jaies-cafe-golden-tulip-mi-road,650,"Cafe, Bakery",3.4,22," Golden Tulip, Near GPO, MI Road, Jaipur"
"tawook Restaurant, Raja Park",https://www.zomato.com/jaipur/tawook-raja-park,550,"Lebanese, Mughlai",3.4,23," Plot 421/2, Gali 2, Raja Park, Jaipur"
"egg junction Restaurant, Tonk Road",https://www.zomato.com/jaipur/egg-junction-tonk-road,200,"Fast Food, Street Food",3.4,34," 10, Kidwai Nagar, Near Bansal Hospital, Imli Wala Phatak, Tonk Road, Jaipur"
"pizza house Restaurant, Tonk Road",https://www.zomato.com/jaipur/the-pizza-house-tonk-road,350,"Pizza, Fast Food, Chinese",3.4,26," 3 & 4, Tulsi Nagar, Maruti Nagar, Shoypur Road, Pratap Nagar, Tonk Road, Jaipur"
"pavilion Restaurant, Gopalbari",https://www.zomato.com/jaipur/the-pavilion-gopalbari,"1,100","North Indian, Continental, Rajasthani",3.4,18," Vesta International, S 3, Linking Road, Gopalbari, Jaipur"
"krishnas kitchen Restaurant, Brahmpuri",https://www.zomato.com/jaipur/krishnas-kitchen-brahmpuri,250,"Chinese, North Indian",3.4,35," 222, Mangodi Walo Ki Bagichi, Brahmpuri Road, Brahmpuri, Jaipur"
"marias cafe Restaurant, C Scheme",https://www.zomato.com/jaipur/marias-cafe-c-scheme,300,"Fast Food, North Indian",3.4,32," F-177B, Shubhash Marg, C Scheme, Jaipur"
"emerald dining Restaurant, Tonk Road",https://www.zomato.com/jaipur/emerald-dining-tonk-road,500,"North Indian, Chinese",3.4,21," 935, Phase 3rd TNT Motors, Sitapura Industrial Area, Sitapura, Tonk Road, Jaipur"
"karim baksh roti boti co Restaurant, Mansarovar",https://www.zomato.com/jaipur/karim-baksh-roti-boti-co-mansarovar,500,"North Indian, Fast Food, Chinese",3.4,25," Shop 5, Patel Marg Shopping Centre, Madhyam Marg, Mansarovar, Jaipur"
"shri jharkhand nath poha chat Restaurant, Adarsh Nagar",https://www.zomato.com/jaipur/shri-jharkhand-nath-poha-and-chat-adarsh-nagar,250,Street Food,3.4,29," 9, Masala Chowk, Ram Niwas Baag, Near Albert Hall, Adarsh Nagar, Jaipur"
"radiation bar Restaurant, Ajmer Highway",https://www.zomato.com/jaipur/radiation-bar-1-ajmer-highway,"1,500",Finger Food,3.4,16," Pink Pearl Hotel & Funcity, NH 8, Jaipur Ajmer Expressway, Near Mahapura Mod, Bhankrota, Ajmer Highway, Jaipur"
"julienne restaurant Restaurant, Shyam Nagar",https://www.zomato.com/jaipur/julienne-restaurant-shyam-nagar,500,"North Indian, Chinese",3.4,22," Hotel Park Regent, G 17, Janpath, Shyam Nagar, Jaipur"
"sk bakers fast food Restaurant, Mansarovar",https://www.zomato.com/jaipur/sk-bakers-fast-food-mansarovar,150,"Fast Food, Ice Cream",3.1,10," B 102, Dev Nagar, Behind Kohinoor Residency, Jaipur Rampura Road, Sanganer, Near Mansarovar, Jaipur"
"chuski taste tea Restaurant, Mansarovar",https://www.zomato.com/jaipur/chuski-the-taste-of-tea-mansarovar,150,"Tea, Rajasthani",3.1,12," A 34, Kishan Colony, Near Malpura Gate, Sanganer, Mansarovar, Jaipur"
"shree ram sabjiwala Restaurant, Malviya Nagar",https://www.zomato.com/jaipur/shree-ram-sabjiwala-malviya-nagar,450,"North Indian, Chinese, Fast Food",3.1,20," C-28, Ashok Vihar, Nandpuri, Malviya Nagar, Jaipur"
"pizza seven Restaurant, Jagatpura",https://www.zomato.com/jaipur/the-pizza-seven-jagatpura,400,"Pizza, Fast Food, Beverages",NEW,," Shop 143, Sector 11, Pratap Nagar, Jagatpura, Jaipur"
"kopper kadai Restaurant, Shyam Nagar",https://www.zomato.com/jaipur/kopper-kadai-shyam-nagar,250,"North Indian, Chinese, Fast Food",3.1,14," C-224, Nirman Nagar, Shyam Nagar, Jaipur"
"restro rj 02 Restaurant, Mansarovar",https://www.zomato.com/jaipur/restro-rj-02-mansarovar,300,North Indian,3.1,12," 130A, Ashok Vihar Vistar, Gopal Pura Bypass, Near Triveni Choraha, Mansarovar, Jaipur"
"lalli bakers Restaurant, Sodala",https://www.zomato.com/jaipur/lalli-bakers-sodala,400,"Bakery, Fast Food",3.1,12," Shop 1, Shivpuri, Opposite Lazeez Hotel, New Sanganer Road, Ramnagar Extension, Sodala, Jaipur"
"sondhi swad Restaurant, Vaishali Nagar",https://www.zomato.com/jaipur/sondhi-swad-vaishali-nagar,300,"North Indian, South Indian, Rajasthani",3.1,12," Devenda Vatika, Rangoli Garden, Below Hightention Wire, Maharana Pratap Marg, Vaishali Nagar, Jaipur"
"corner cafe lounge Restaurant, Jagatpura",https://www.zomato.com/jaipur/the-corner-cafe-and-lounge-jagatpura,800,"North Indian, Chinese",3.1,10," Plot 135, Raghunandan Vihar, Jagatpura, Jaipur"
"pentagon express Restaurant, Vaishali Nagar",https://www.zomato.com/jaipur/pentagon-express-vaishali-nagar,500,"North Indian, Continental, Chinese, Mexican",3.1,13," 3rd, 4th Floor, Plot 74, Shivraj Niketan, Gautam Marg, Vaishali Nagar, Jaipur"
"sanskar hotel restaurant Restaurant, Vaishali Nagar",https://www.zomato.com/jaipur/sanskar-hotel-restaurant-vaishali-nagar,650,"North Indian, Chinese, South Indian",3.1,9," 310, Nemi Nagar Vistar, Near Vaishali Nagar Thana, Bajri Mandi Crossing, Vaishali Nagar, Jaipur"
"hotel mohammedi Restaurant, Bais Godam",https://www.zomato.com/jaipur/the-hotel-mohammedi-bais-godam,350,"North Indian, Mughlai",3.1,11," Shop 5, Bais Godam, Industrial Area, Bais Godam, Jaipur"
"kakas veg Restaurant, Mansarovar",https://www.zomato.com/jaipur/kakas-veg-mansarovar,500,North Indian,3.1,15," 13, Basement, Near SCG Hospital, VT Road, Shipra Path, Sector 52, Mansarovar, Jaipur"
"eggitude Restaurant, C Scheme",https://www.zomato.com/jaipur/eggitude-c-scheme,200,Fast Food,3.1,11," F-82, Chaitanya Marg, Ashok Marg, C Scheme, Jaipur"
"pet puja Restaurant, Mansarovar",https://www.zomato.com/jaipur/pet-puja-1-mansarovar,300,North Indian,3.1,16," 73/16, Near Rose Garden, Paramhans Marg, Mansarovar, Jaipur"
"gulab ji chai Restaurant, MI Road",https://www.zomato.com/jaipur/gulab-ji-chai-mi-road,100,"Tea, Street Food",4.2,254," Opposite Ganpati Plaza, MI Road, Jaipur"
"arbab Restaurant, Tonk Road",https://www.zomato.com/jaipur/arbab-tonk-road,800,"Fast Food, Italian, Continental, Chinese",4.2,96," Plot 10, Airport Plaza, Mata Colony, Tonk Road, Jaipur"
"biryani by masaalchis Restaurant, Vaishali Nagar",https://www.zomato.com/jaipur/biryani-by-masaalchis-vaishali-nagar,900,"North Indian, Mughlai, Lucknowi",4.2,176," C-25, R & A Towers, Lower Ground Floor, Vaishali Nagar, Jaipur"
"house beans Restaurant, C Scheme",https://www.zomato.com/jaipur/house-of-beans-c-scheme,550,"Cafe, Fast Food, Beverages",4.2,108," C 72, Nandan Apartment, Sarojini Marg, C Scheme, Jaipur"
"ice spice Restaurant, C Scheme",https://www.zomato.com/jaipur/ice-spice-c-scheme,550,"North Indian, Chinese, South Indian",4.2,195," Near Ahinsa Circle, Ashok Marg, C Scheme, Jaipur"
"meraki Restaurant, Raja Park",https://www.zomato.com/jaipur/meraki-raja-park,500,"Asian, Thai, Chinese, Momos",4.2,113," Plot 213, Street 1, Near Panchvati Circle, Raja Park, Jaipur"
"mama fu Restaurant, C Scheme",https://www.zomato.com/jaipur/mama-fu-c-scheme,"1,000","Chinese, Asian, Sushi",4.2,73," A-5, Ground Floor, Suryavanshi Pearl, Chomu House, Sardar Patal Marg, C Scheme, Jaipur"
"thali palace Restaurant, Shyam Nagar",https://www.zomato.com/jaipur/thali-palace-shyam-nagar,450,"North Indian, Fast Food, Beverages",4.2,86," 4, Neelkant Colony, Main Ajmer Road, Purani Chungi, Shyam Nagar, Jaipur"
"feast Restaurant, C Scheme",https://www.zomato.com/jaipur/the-feast-2-c-scheme,550,"Cafe, Bakery, Italian",4.2,50," Survey 8, Ground Floor & First Floor, Mahaveer Marg, Opposite Mahaveer College Of Commerce, C Scheme, Jaipur"
"cake company jaipur Restaurant, Mansarovar",https://www.zomato.com/jaipur/cake-company-jaipur-mansarovar,400,Bakery,4.2,109," 111/195 Main Vijaypath, Madhya Marg, Mansarovar, Jaipur"
"ifc Restaurant, Mansarovar",https://www.zomato.com/jaipur/ifc-mansarovar,400,"Pizza, Fast Food",4.2,80," 
Jaipur Chowpati, Surya Nagar, Gopalpura Road, Mansarovar, Jaipur"
"masquerade by mystery rooms Restaurant, C Scheme",https://www.zomato.com/jaipur/masquerade-by-mystery-rooms-c-scheme,"1,000","Continental, Modern Indian",4.2,36," J 50-B, Sarojini Marg, C Scheme, Jaipur"
"cake point Restaurant, Vaishali Nagar",https://www.zomato.com/jaipur/cake-point-vaishali-nagar,200,Bakery,4.2,51," Plot-79, Welcome Colony, Khatipura Road, Vaishali Nagar, Jaipur"
"cake express Restaurant, Tonk Road",https://www.zomato.com/jaipur/cake-express-1-tonk-road,450,Bakery,4.2,55," Sector 9, Patap Nagar, Tonk Road, Jaipur"
"cake box Restaurant, Mansarovar",https://www.zomato.com/jaipur/cake-box-mansarovar,300,Bakery,4.2,59," Plot 47, Moti Nagar, Iskon Road, Kesar Choraha, Mansarovar, Jaipur"
"restro rj 05 Restaurant, Mansarovar",https://www.zomato.com/jaipur/restro-rj-05-mansarovar,250,North Indian,3.5,34," Steel Point, Shopping Center, Shipra Path, Paramhans Marg, Mansarovar, Jaipur"
"rao ji juice shakes dosa Restaurant, Chitrakoot",https://www.zomato.com/jaipur/rao-ji-juice-shakes-and-dosa-chitrakoot,250,"Beverages, South Indian",3.5,29," National Super Market, Ajmer Road, Near Asopa Hospital, Chitrakoot, Jaipur"
"khandela haveli restaurant Restaurant, Bani Park",https://www.zomato.com/jaipur/khandela-haveli-restaurant-bani-park,"1,500",North Indian,3.5,20," Khandela Haveli, D 219 A, Bhaskar Marg, Bani Park, Jaipur"
"rajasthan royal multi cuisine restaurant Restaurant, Vaishali Nagar",https://www.zomato.com/jaipur/rajasthan-royal-multi-cuisine-restaurant-vaishali-nagar,600,"North Indian, Fast Food, Beverages",3.5,27," B 101, MK Plaza, Amrapali Road, Vaishali Nagar, Jaipur"
"cafe k Restaurant, Pink City",https://www.zomato.com/jaipur/cafe-k-1-pink-city,300,"Cafe, Fast Food",3.5,40," 258, Johari Bazar Rd, Pink City, Jaipur"
"vatsalya Restaurant, Raja Park",https://www.zomato.com/jaipur/vatsalya-1-raja-park,200,"North Indian, Street Food",3.5,29," Plot 497, Street 5, Near AC Market, Raja Park, Jaipur"
"thali king Restaurant, MI Road",https://www.zomato.com/jaipur/thali-king-mi-road,300,"North Indian, Fast Food",3.5,44," Mehrishi Bhawan, Opposite Ganpati Plaza, MI Road, Jaipur"
"taste nawab Restaurant, Shyam Nagar",https://www.zomato.com/jaipur/taste-of-nawab-2-shyam-nagar,600,"North Indian, Mughlai",3.5,30," Plot 92, Vistaar, Pandit T.N Mishra Marg, Nirman Nagar, Near Shyam Nagar, Jaipur"
"little bites Restaurant, Tonk Road",https://www.zomato.com/jaipur/little-bites-tonk-road,400,Fast Food,3.5,36," Shop CG/S1, Nehru Place, Opposite Nehru Bal Udhyan, Tonk Road, Jaipur"
"radha palace Restaurant, Vaishali Nagar",https://www.zomato.com/jaipur/radha-palace-vaishali-nagar,200,North Indian,3.5,29," Panchsil Colony, Purani Chungi, Ajmer Road, Vaishali Nagar, Jaipur"
"cake away Restaurant, Vaishali Nagar",https://www.zomato.com/jaipur/cake-away-vaishali-nagar,300,Bakery,3.5,27," Plot 79, Welcome Colony, Khatipura Road, Vaishali Nagar, Jaipur"
"punjabi amritsari kulche wale Restaurant, Raja Park",https://www.zomato.com/jaipur/punjabi-amritsari-kulche-wale-raja-park,300,North Indian,3.5,42," 165, Ram Gali 3, Near Surya Maidan, Raja Park, Jaipur"
"burrps cafe bakery Restaurant, Mansarovar",https://www.zomato.com/jaipur/burrps-cafe-and-bakery-mansarovar,250,"Bakery, Fast Food",3.5,25," Shop 11, JDA Market, Ridhi Sidhi Chouraha, Gopalpura Bypass, Mansarovar, Jaipur"
"momoman Restaurant, Tonk Road",https://www.zomato.com/jaipur/momoman-tonk-road,250,"Momos, Chinese",3.5,27," Shop 1, 712, Mahaveer Nagar 1st, Gopalpura Mode, Pooja Tower, Tonk Road, Jaipur"
"funduz Restaurant, Jhotwara",https://www.zomato.com/jaipur/funduz-jhotwara,400,"Fast Food, Beverages",3.5,35," Triton Mall, 3rd Floor, Jhotwara, Jaipur"
"blitz krieg Restaurant, C Scheme",https://www.zomato.com/jaipur/blitz-krieg-c-scheme,"1,600","Continental, North Indian, Fast Food, American",3.6,108," 5th Floor, Axis Mall, Bhagwan Das Road, C Scheme, Jaipur"
"pan n grill cafe Restaurant, C Scheme",https://www.zomato.com/jaipur/pan-n-grill-cafe-c-scheme,200,"Fast Food, Street Food, Sandwich, Beverages",3.6,118," Trimurti Mall, Ahinsa Circle, C Scheme, Jaipur"
"melting moments Restaurant, Bani Park",https://www.zomato.com/jaipur/melting-moments-by-nita-jaipuria-bani-park,400,Desserts,3.6,75," B-9, Shiv Marg, Bani Park, Jaipur"
"laxmi sweet caterers Restaurant, Tonk Road",https://www.zomato.com/jaipur/laxmi-sweet-caterers-1-tonk-road,150,Mithai,3.6,113," Shop 56, Barkat Nagar Choraha, Barkat Nagar, Tonk Road, Jaipur"
"zaika Restaurant, Bani Park",https://www.zomato.com/jaipur/zaika-bani-park,900,"North Indian, Chinese, American, Continental, South Indian",3.6,77," Traditional Heritage Haveli, AC-4C, Gayatri Marg, Sawai Jai Singh Highway, Bani Park, Jaipur"
"ashoka parnami mishthan bhandar Restaurant, Raja Park",https://www.zomato.com/jaipur/ashoka-parnami-mishthan-bhandar-raja-park,150,Mithai,3.6,128," Near Parnami Mandir, Raja Park, Jaipur"
"shri shankar family restaurant Restaurant, Mansarovar",https://www.zomato.com/jaipur/shri-shankar-family-restaurant-mansarovar,500,North Indian,3.6,118," 61/20, Rajat Path, Mansarovar, Jaipur"
"amazing arena sports lounge Restaurant, Malviya Nagar",https://www.zomato.com/jaipur/amazing-arena-sports-lounge-malviya-nagar,500,"Cafe, Fast Food",3.6,79," 30, Sundar Nagar, Girdhar Marg, Malviya Nagar, Jaipur"
"mazica cafe Restaurant, Shastri Nagar",https://www.zomato.com/jaipur/mazica-cafe-shastri-nagar,400,"Cafe, Pizza, Fast Food, Chinese",3.6,63," R-1, Basement Arya Sqaure Mall, Subhash Nagar, Jhotwara Road, Shastri Nagar, Jaipur"
"shiv sagar cafe Restaurant, Raja Park",https://www.zomato.com/jaipur/shiv-sagar-cafe-raja-park,200,South Indian,3.6,98," Shop 467- 468, Gali 3, Raja Park, Jaipur"
"badi dhani pavitra bhojanalya Restaurant, Tonk Road",https://www.zomato.com/jaipur/badi-dhani-pavitra-bhojanalya-tonk-road,200,North Indian,3.6,121," Shop 7, Sector 3, Pratap Nagar, Tonk Road, Jaipur"
"yangse Restaurant, Bais Godam",https://www.zomato.com/jaipur/yangse-bais-godam,400,Chinese,3.6,72," Food Court, 3rd Floor, MGF Metropolitan Mall, Bais Godam, Jaipur"
"mahavir rabri bhandar Restaurant, Bani Park",https://www.zomato.com/jaipur/mahavir-rabri-bhandar-bani-park,250,Rajasthani,3.6,128," D-15, Doctor's Bungalow 2, Jhotwara Road, Near Space Cinema, Bani Park, Jaipur"
"annapurna sweets Restaurant, Vidhyadhar Nagar",https://www.zomato.com/jaipur/annapurna-sweets-vidhyadhar-nagar,100,"Mithai, Street Food, South Indian",3.6,138," G 1, Ganesham Plaza, Opposite Cine Star, Central Spine, Vidhyadhar Nagar, Jaipur"
"juice walas coffee juice bar Restaurant, Tonk Road",https://www.zomato.com/jaipur/juice-walas-coffee-juice-bar-tonk-road,400,"Juices, Fast Food",3.6,91," G-19, Jaipur Centre, B2 Bypass, Tonk Road, Jaipur"
"dhakad samosas sweet caters Restaurant, Sikar Road",https://www.zomato.com/jaipur/dhakad-samosas-sweet-caters-sikar-road,250,"Mithai, Street Food",3.3,18," D-25, Thimas Colony, Murlipura, Sikar Road, Jaipur"
"shree govindam pavitra bhojanalya Restaurant, Jagatpura",https://www.zomato.com/jaipur/shree-govindam-pavitra-bhojanalya-jagatpura,450,North Indian,3.3,19," Kundanpura, Indra Gandhi Nagar, Jagatpura, Jaipur"
"jodhpur dal bati churma walaz Restaurant, Shyam Nagar",https://www.zomato.com/jaipur/jodhpur-dal-bati-churma-walaz-shyam-nagar,250,Rajasthani,3.3,14," 903, Gautam Marg, Rani Sati Nagar, Shyam Nagar, Jaipur"
"veg planet Restaurant, Khatipura Road",https://www.zomato.com/jaipur/veg-planet-khatipura-road,250,"Chinese, North Indian, South Indian, Street Food",3.3,16," Poonam Market, Panchyawala, Sirsi Road, Jaipur, Khatipura Road, Jaipur"
"dark bite Restaurant, Raja Park",https://www.zomato.com/jaipur/dark-bite-raja-park,500,"Chinese, North Indian, Mughlai, Beverages",3.3,12," Shop 1, 198 Ram Gali, Panchwati Circle, Raja Park, Jaipur."
"ms bakers Restaurant, Sikar Road",https://www.zomato.com/jaipur/m-s-bakers-sikar-road,200,"Bakery, Fast Food",3.3,14," 63, Road 1, Shiv Nagar, Vivekanand Senior Secondary School, Murlipura, Sikar Road, Jaipur"
"fm 20 Restaurant, Mansarovar",https://www.zomato.com/jaipur/fm-20-mansarovar,600,"Chinese, Fast Food",3.3,16," Shop 12, Vijaypath Shopping Center, Behind Madhurika Medical, Mansarovar, Jaipur"
"coffee america Restaurant, Tonk Road",https://www.zomato.com/jaipur/coffee-america-1-tonk-road,250,"Fast Food, Rolls, South Indian, Beverages",3.3,18," Shop 38, Near Ayojan School Of Architecture, Riicco Industrial Area Sitapura, Jaipur"
"hotel royal celebration inn Restaurant, Ajmer Highway",https://www.zomato.com/jaipur/hotel-royal-celebration-inn-ajmer-highway,500,"North Indian, Chinese",3.3,13," Jaisinghpura Road, Near Siddhi Vinayak Marriage Garden, Bhankrota, Ajmer Highway, Jaipur"
"red dregon fast food Restaurant, Sodala",https://www.zomato.com/jaipur/red-dregon-fast-food-sodala,150,"Chinese, Fast Food",3.3,16," Near Shiv Mandir, Futlaya Bag, Gyatri Nagar, Sodala, Jaipur"
"mr meal Restaurant, Vidhyadhar Nagar",https://www.zomato.com/jaipur/mr-meal-vidhyadhar-nagar,200,"Fast Food, Chinese",3.3,12," 1/192, Near Khandelwal Tower, Sector 1, Vidhyadhar Nagar, Jaipur"
"jai shri balaji refreshment juice point Restaurant, Tonk Road",https://www.zomato.com/jaipur/jai-shri-balaji-refreshment-juice-point-tonk-road,100,Beverages,3.3,21," 111-CS-1, Shiv Tower, Near Community Hall, Kumbha Marg, Sector 11, Pratap Nagar, Tonk Road, Jaipur"
"murg mutton masala Restaurant, Vaishali Nagar",https://www.zomato.com/jaipur/murg-mutton-masala-1-vaishali-nagar,350,"North Indian, Mughlai",3.3,12," Plot 98, Jagdamba Colony, Near Nursery Circle, Vaishali Nagar, Jaipur"
"momos junction Restaurant, Malviya Nagar",https://www.zomato.com/jaipur/momos-junction-malviya-nagar,400,"Momos, Burger, Sandwich, Fast Food",NEW,," Shop 6, Plot 14, Vyas Colony, Jagatpura Road, Malviya Nagar, Jaipur"
"bannas Restaurant, C Scheme",https://www.zomato.com/jaipur/bannas-c-scheme,450,Cafe,3.3,16," E 141, Near Style And Scissors, Sardar Patel Marg, C Scheme, Jaipur"
"special dhaba Restaurant, Tonk Road",https://www.zomato.com/jaipur/special-dhaba-tonk-road,500,"North Indian, Fast Food",3.2,11," S37, 38, Dwarkapuri, Chak Getor, Pratap Nagar, Tonk Road, Jaipur"
"bilal hotel Restaurant, Pink City",https://www.zomato.com/jaipur/bilal-hotel-pink-city,150,North Indian,3.2,19," Shop 157, Ramganj Bazaar, Near Badi Rehmaniya Masjid, Pink City, Jaipur"
"7th heaven Restaurant, Mansarovar",https://www.zomato.com/jaipur/7th-heaven-mansarovar,350,"Bakery, Desserts, Fast Food, Beverages",NEW,," Shop A7, 8, 10, B Scheme, Gopalpura Bypass, Mansarovar, Jaipur"
"grand peacock restaurant Restaurant, Amer Road",https://www.zomato.com/jaipur/the-grand-peacock-restaurant-1-amer-road,"1,200","North Indian, Mughlai, Beverages",3.2,15," Hotel Mahar Haveli, Near Zorawar Singh Gate, Gangapole Road, Amer Road, Jaipur"
"ohveg by v impact Restaurant, Bais Godam",https://www.zomato.com/jaipur/ohveg-by-v-impact-1-bais-godam,250,"Fast Food, North Indian",3.2,12," B-91, Nandpuri Colony, Hawa Sarak, Bais Godam, Jaipur"
"bikaneri lal ji sweets namkeen Restaurant, Mansarovar",https://www.zomato.com/jaipur/bikaneri-lal-ji-sweets-and-namkeen-mansarovar,400,"Mithai, Fast Food, Street Food",3.2,20," 123/383, Agarwal Farm, New Sanganer Road, Mansarovar, Jaipur"
"saini dhaba Restaurant, Sodala",https://www.zomato.com/jaipur/saini-dhaba-2-sodala,400,North Indian,3.2,14," 10 B, Ram Nagar, Sodala, Jaipur"
"combo tadka restaurant Restaurant, Jagatpura",https://www.zomato.com/jaipur/combo-tadka-restaurant-jagatpura,250,"North Indian, Fast Food, Chinese",3.2,15," 376, Pink City Enclave, Jagatpura, Jaipur"
"boti bati Restaurant, Sodala",https://www.zomato.com/boti-bati-food-truck,300,North Indian,3.2,17," Swej Farm, Opposite Palika Bazaar, Sodala, Jaipur"
"rajwada rasoi Restaurant, Mansarovar",https://www.zomato.com/jaipur/rajwada-rasoi-mansarovar,300,North Indian,3.2,16," 74/31, Shipra Path, Mansarovar, Jaipur"
"hangout café Restaurant, Vaishali Nagar",https://www.zomato.com/jaipur/hangout-café-vaishali-nagar,200,"Burger, Fast Food, Beverages",3.2,13," G 40, Rangoli Plaza, Rangoli Gardens, Maharana Pratap Marg, Kanakpura, Vaishali Nagar, Jaipur"
"mithlesh sweets Restaurant, Tonk Road",https://www.zomato.com/jaipur/mithlesh-sweets-1-tonk-road,300,Mithai,3.2,20," Opposite Central Bank of India, Gopalpura, Tonk Road, Jaipur"
"food forever Restaurant, Jagatpura",https://www.zomato.com/jaipur/food-forever-jagatpura,350,North Indian,3.2,13," A-15, Mahal Yojna, Jagatpura, Jaipur"
"gokul chaat fast food Restaurant, Chitrakoot",https://www.zomato.com/jaipur/gokul-chaat-fast-food-chitrakoot,300,"Fast Food, South Indian, Chinese, Street Food, North Indian",3.2,12," Shop 3, Plot 206, Opposite Swaminarayan Temple, Govind Nagar, Chitrakoot, Jaipur"
"krishna live ice creams Restaurant, Shyam Nagar",https://www.zomato.com/jaipur/krishna-live-ice-creams-shyam-nagar,350,"Ice Cream, Beverages",3.2,12," 303, The Modern Chaupati, Nirman Nagar C, Kings Road, Shyam Nagar, Jaipur"
"ohh my grill Restaurant, Vaishali Nagar",https://www.zomato.com/jaipur/ohh-my-grill-vaishali-nagar,350,"BBQ, North Indian",3.3,14," Nursery Circle, Behind Tata Indicom Office, Block C, Vaishali Nagar, Jaipur"
"good bakers Restaurant, Malviya Nagar",https://www.zomato.com/jaipur/good-bakers-malviya-nagar,200,"Bakery, Fast Food, Beverages",3.3,24," 8/220, Behind UDB Corporate Tower, Amit Bhardwaj Marg, Malviya Nagar, Jaipur"
"sandwich fuel Restaurant, Tonk Road",https://www.zomato.com/jaipur/sandwich-fuel-tonk-road,300,"Fast Food, Bakery",3.3,20," LG-28, Balaji Tower-6, Airport Plaza, Tonk Road, Jaipur"
"snighdha food corner Restaurant, Jhotwara",https://www.zomato.com/jaipur/snighdha-food-corner-jhotwara,400,North Indian,3.3,26," D36, Kumawat Colony, Prem Nagar, Khatipura Road, Jhotwara, Jaipur"
"ali fresh chicken Restaurant, Tonk Road",https://www.zomato.com/jaipur/ali-fresh-chicken-tonk-road,500,Hyderabadi,3.3,35," 10, Kidwai Nagar, Near Bansal Hospital, Imli Wala Phatak, Tonk Road, Jaipur"
"beyond bread bakery Restaurant, Lal Kothi",https://www.zomato.com/jaipur/beyond-bread-bakery-lal-kothi,200,"Bakery, Fast Food",3.3,30," 204, Opposite Moti Sons Tower, Lal Kothi, Jaipur"
"bc co Restaurant, MI Road",https://www.zomato.com/jaipur/b-c-co-mi-road,250,"Bakery, Fast Food",3.3,21," 68, Nehru Bazaar, Near Ajmeri Gate, MI Road, Jaipur"
"sharma pavitra bhojanalya Restaurant, Mansarovar",https://www.zomato.com/jaipur/sharma-pavitra-bhojanalya-mansarovar,400,North Indian,3.3,34," Opposite St. Wilfred College, New Sanganer Road, Mansarovar, Jaipur"
