name,link,cost for 2,cuisines,ratings,reviews,address
"radha govind restaurant Restaurant, Jhotwara",https://www.zomato.com/jaipur/radha-govind-restaurant-jhotwara,300,North Indian,3.0,7," Shop 35, Benar Road, Suraj Nagar, Nirmal Vihar, Jhotwara, Jaipur"
"cake cinema Restaurant, Mansarovar",https://www.zomato.com/jaipur/cake-cinema-1-mansarovar,200,Bakery,3.0,4," B 75, Sumer Nagar Vistaar, Behind Of Kids Club School, Mansarovar, Jaipur"
"coffee club Restaurant, Mansarovar",https://www.zomato.com/jaipur/the-coffee-club-mansarovar,300,"Fast Food, Beverages",3.0,5," Shop 64, Meera Marg, Sector 10, Near Jain Mandir, Mansarovar, Jaipur"
"sandwich cafe juice corner Restaurant, MI Road",https://www.zomato.com/jaipur/sandwich-cafe-and-juice-corner-mi-road,150,"Fast Food, Beverages",3.0,7," D 16, Ganpati Plaza, MI Road, Jaipur"
"jai bhagwati sweets Restaurant, Tonk Road",https://www.zomato.com/jaipur/jai-bhagwati-sweets-tonk-road,250,Mithai,3.0,5," B1, Kisan Marg, Barkat Nagar, Tonk Road, Jaipur"
"exotiq cafe Restaurant, Sodala",https://www.zomato.com/jaipur/exotiq-cafe-sodala,300,"Fast Food, Beverages",3.0,5," 4, 5, 6, Ganesh Nagar, New Sanganer Road, Sodala, Jaipur"
"bhagwati tiffin centre Restaurant, Vaishali Nagar",https://www.zomato.com/jaipur/bhagwati-tiffin-centre-vaishali-nagar,100,North Indian,3.0,5," 71, Ganesh Vihar Road, Vaishali Nagar, Jaipur"
"khana khajana restaurant Restaurant, Tonk Road",https://www.zomato.com/jaipur/khana-khajana-restaurant-tonk-road,300,"North Indian, Chinese",3.0,11," S6/5, JDA Staff Colony, Haldighati Road, Pratap Nagar, Sanganer, Tonk Road, Jaipur"
"green lemon restaurant Restaurant, Khatipura Road",https://www.zomato.com/jaipur/green-lemon-restaurant-khatipura-road,500,"North Indian, Fast Food",3.0,11," Plot 29, Marudhar Vihar, Khatipura Road, Jaipur"
"ganesh tandoori dhaba Restaurant, Malviya Nagar",https://www.zomato.com/jaipur/ganesh-tandoori-dhaba-malviya-nagar,400,North Indian,3.0,12," 1st Floor, Benada Tower, Girdhar Marg, Sector 13, Malviya Nagar, Jaipur"
"shree shyam fast food dhaba Restaurant, Tonk Road",https://www.zomato.com/jaipur/shree-shyam-fast-food-dhaba-tonk-road,300,"North Indian, Street Food, South Indian",3.0,15," 80/15, Kumbha Marg, Sector 8, Pratap Nagar, Tonk Road, Jaipur"
"burans food paradise Restaurant, Mansarovar",https://www.zomato.com/jaipur/the-burans-food-paradise-mansarovar,500,"Chinese, North Indian, Fast Food",3.0,10," V 27, Palika Bazar, Sector 9, Malviya Nagar, Mansarovar, Jaipur"
"dragon chinese food corner Restaurant, Malviya Nagar",https://www.zomato.com/jaipur/dragon-chinese-food-corner-malviya-nagar,400,"Chinese, Fast Food, Beverages",3.0,10," 13, D Block, Shopping Center, Opposite Gyan Vihar School, Malviya Nagar, Jaipur"
"green restaurant Restaurant, MI Road",https://www.zomato.com/jaipur/the-green-restaurant-mi-road,500,"North Indian, Fast Food, Chinese, Beverages",3.0,12," Jaipur Hotel New, 7, Film Colony, Choura Rasta, Opposite Golcha Cinema, MI Road, Jaipur"
"shri shyam dhaba veg restaurant Restaurant, Tonk Road",https://www.zomato.com/jaipur/shri-shyam-dhaba-and-veg-restaurant-tonk-road,400,North Indian,3.0,17," Goner Mode, Near Goner Phatak, Sitapura, Tonk Road, Jaipur"
"shree thali Restaurant, Vaishali Nagar",https://www.zomato.com/jaipur/shree-thali-vaishali-nagar,300,"North Indian, South Indian",3.0,10," E58, Kanha Vihar, Ayodhha Nagar, 60 Feet Road, Bhurapatel Road, Gandhi Path West, Vaishali Nagar, Jaipur"
"hotel raj niwas Restaurant, Agra Road",https://www.zomato.com/jaipur/hotel-raj-niwas-agra-road,400,North Indian,3.0,13," 101, Kanji Nagar Agra, Near Transport Nagar, Jaipur, Agra Road, Jaipur"
"tadkeshwar misthan bhandar Restaurant, Pink City",https://www.zomato.com/jaipur/tadkeshwar-misthan-bhandar-pink-city,350,Mithai,3.0,7," Shop 173, Opposite Tadkeshwar Temple, Chora Rasta, Pink City, Jaipur"
"pizza junction Restaurant, Shyam Nagar",https://www.zomato.com/jaipur/the-pizza-junction-shyam-nagar,350,"Pizza, Beverages",3.0,12," Shop 1, Vinobha Marg, Near King Salon, Janpath, Nirman Nagar, Near Shyam Nagar, Jaipur"
"80n restaurant Restaurant, Vaishali Nagar",https://www.zomato.com/jaipur/80n-restaurant-vaishali-nagar,400,"North Indian, South Indian, Fast Food, Chinese, Street Food",3.0,8," Shop 48, A Block, Behind National Handloom, Vaishali Nagar, Jaipur"
"yummy chef kabab corner Restaurant, Tonk Road",https://www.zomato.com/jaipur/yummy-chef-kabab-corner-tonk-road,450,North Indian,3.0,10," NRI Circle, Sector 26, Pratap Nagar, Jaipur"
"laxmi pavitra bhojnalaya restaurant Restaurant, Amer",https://www.zomato.com/jaipur/laxmi-pavitra-bhojnalaya-restaurant-amer,100,North Indian,3.0,14," Rajavatan Ka Chowk, Near Government Girls School, Amer, Jaipur"
"golden festa bakery Restaurant, Tonk Road",https://www.zomato.com/jaipur/golden-festa-bakery-tonk-road,200,"Bakery, Fast Food",3.1,9," 172/272, Sector -17, Pratap Nagar, Tonk Road, Jaipur"
"tasty food restaurant Restaurant, Tonk Road",https://www.zomato.com/jaipur/tasty-food-restaurant-tonk-road,300,North Indian,3.1,12," A-28, JDA Shopping Centre, Bajaj Nagar, Tonk Road, Jaipur"
"cafe campus Restaurant, Sodala",https://www.zomato.com/jaipur/cafe-campus-1-sodala,400,"Cafe, Chinese",3.1,8," Shop 21 & 22, Ram Nagar Extension, Opposite Mahatma Jyoti Rao Fule College, Sodala, Jaipur"
"chinese junction Restaurant, Shyam Nagar",https://www.zomato.com/jaipur/chinese-junction-shyam-nagar,300,Chinese,3.1,4," Plot-145, Streets Food Truck Park, Ajmera Garden, Kings Road, Nirman Nagar, Shyam Nagar, Jaipur"
"ajmer ki prassidh kari kachori Restaurant, Tonk Road",https://www.zomato.com/jaipur/ajmer-ki-prassidh-kari-kachori-tonk-road,150,Street Food,3.1,10," Plot C44, Dalda Factory Road, Maharani Farm, Gayatri Nagar A, Durgapura, Tonk Road, Jaipur"
"unique cafe Restaurant, Jagatpura",https://www.zomato.com/jaipur/unique-cafe-jagatpura,250,Fast Food,3.1,9," Building 144, JDA Colony, Near SKIT College, Ramnagaria, Jagatpura, Jaipur"
"bnc coffee shop Restaurant, Vidhyadhar Nagar",https://www.zomato.com/jaipur/bnc-the-coffee-shop-vidhyadhar-nagar,400,"Cafe, Fast Food",3.1,6," G 6, Saraswati Tower, Vidhyadhar Nagar, Jaipur"
"lassi junction Restaurant, Pink City",https://www.zomato.com/jaipur/lassi-junction-pink-city,150,Beverages,3.1,8," Shop 301, Khawas Ji Ka Rasta, Hawa Mahal Bazar, Pink City, Jaipur"
"rj45 chicken company Restaurant, Gopalbari",https://www.zomato.com/jaipur/rj45-the-chicken-company-gopalbari,700,"North Indian, Fast Food, Chinese, Beverages",3.1,6," Hotel Kalyan, 59, Hathroi Fort, Ajmer Road, Gopalbari, Jaipur"
"100 feet above restro bar fern residency Restaurant, Adarsh Nagar",https://www.zomato.com/jaipur/100-feet-above-restro-bar-the-fern-residency-adarsh-nagar,"1,600","North Indian, European",3.1,9," A 13, Govind Marg, Janta Colony, Near Pink Square Mall, Adarsh Nagar, Jaipur"
"nobis cafe Restaurant, Mansarovar",https://www.zomato.com/jaipur/nobis-cafe-mansarovar,200,"Fast Food, Beverages",NEW,," Shop 53, Swarn Path, New Sanganer Road, Near Tagore Public School, Mansarovar, Jaipur"
"hot pizza country Restaurant, Tonk Road",https://www.zomato.com/jaipur/hot-pizza-country-tonk-road,300,"Pizza, Fast Food, Beverages",NEW,," SP 31, Sector 16, Shopping Complex, Near Knak Medical, Tonk Road, Jaipur"
"indian juice Restaurant, Raja Park",https://www.zomato.com/jaipur/indian-juice-raja-park,250,"Beverages, Juices",3.1,10," House 352, Shop 445, Gali 1, Raja Park, Jaipur"
"k2 fast food Restaurant, Malviya Nagar",https://www.zomato.com/jaipur/k2-fast-food-malviya-nagar,250,"Street Food, Chinese, North Indian, Fast Food",3.1,6," 9/657, Malviya Nagar, Jaipur"
"peddlers den restaurant Restaurant, Malviya Nagar",https://www.zomato.com/jaipur/the-peddlers-den-restaurant-malviya-nagar,"1,000","North Indian, Fast Food, Chinese",3.1,6," Aditi Tower, Central Spine, Jagatpura, Opposite Akshaya Patra, Malviya Nagar, Jaipur"
"cake wheels Restaurant, Raja Park",https://www.zomato.com/jaipur/cake-on-wheels-raja-park,250,Bakery,3.4,7, Delivery Only
"cake walas Restaurant, Raja Park",https://www.zomato.com/jaipur/cake-walas-raja-park,250,Bakery,3.4,6," F 1, Vyas Marg, Near State Bank of India, Raja Park, Jaipur"
"mafix cakes bakes Restaurant, Bais Godam",https://www.zomato.com/jaipur/mafix-cakes-bakes-bais-godam,400,"Bakery, Desserts, Fast Food, Pizza",3.3,372," Thukral House, Hawa Sadak, Bais Godam, Jaipur"
"karims Restaurant, C Scheme",https://www.zomato.com/jaipur/karims-1-c-scheme,800,"Mughlai, North Indian, Kebab",3.3,311," 15-A, Parivahan Marg, Near Civil Lines Fatak, C Scheme, Jaipur"
"bharias veg restaurant Restaurant, Tonk Road",https://www.zomato.com/jaipur/bharias-veg-restaurant-tonk-road,400,"North Indian, Fast Food, Beverages",3.3,279," 14, 15, Gopalpura Bypass, Muktanand Nagar, Durgapura, Tonk Road, Jaipur"
"veggies aahar Restaurant, Mansarovar",https://www.zomato.com/jaipur/veggies-aahar-mansarovar,250,"North Indian, Rajasthani",3.3,221, Delivery Only
"60 ml Restaurant, Adarsh Nagar",https://www.zomato.com/jaipur/60-ml-adarsh-nagar,"1,200","North Indian, Chinese, Finger Food, Bar Food",3.3,158," Hotel Rockland, 263, Frontier Colony, Adarsh Nagar, Jaipur"
"cafe cairo Restaurant, Tonk Road",https://www.zomato.com/jaipur/cafe-cairo-tonk-road,600,"Cafe, Continental, Chinese, North Indian",3.3,79," Hotel Eurasia, A-15, Mahaveer Nagar, Behind Jaipur Hospital, Durgapura, Jaipur"
"royal restaurant saras parlor Restaurant, Malviya Nagar",https://www.zomato.com/TheRoyalRestaurant,500,"North Indian, South Indian, Chinese, Fast Food, Beverages",3.3,167," Shop 23, Lajpatnagar, Behind BOB ATM, Jagatpura, Jaipur"
"cafe choco de licious Restaurant, Tonk Road",https://www.zomato.com/jaipur/cafe-choco-de-licious-tonk-road,400,Cafe,3.3,136," Shop 1 & 2, 2nd Floor, Jaipur Center Compelx, Sector B, Ashram Marg, Durgapur Bye Pass, PWD Chowki, Tonk Road, Jaipur"
"pizza hub unlimited Restaurant, Mansarovar",https://www.zomato.com/jaipur/the-pizza-hub-unlimited-mansarovar,300,"Pizza, Fast Food, Street Food",3.3,148," Near Triveni Nagar Puliya, Triveni Nagar, Mahesh Nagar, Mansarovar, Jaipur"
"chawla dillivala Restaurant, Mansarovar",https://www.zomato.com/jaipur/chawla-dillivala-mansarovar,650,"North Indian, Chinese, Fast Food",3.3,121," S 8, Shri Gopal Nagar, Gopalpura By-Pass, Mansarovar, Jaipur"
"full power Restaurant, Bani Park",https://www.zomato.com/jaipur/full-power-bani-park,600,"Fast Food, Italian, Chinese, North Indian, Mughlai, Beverages",3.3,79," AD -1B, Devi Marg, Bani Park, Jaipur"
"scooops n smile Restaurant, Shyam Nagar",https://www.zomato.com/jaipur/scooops-n-smile-1-shyam-nagar,200,"Ice Cream, Fast Food",3.3,74," D-88 Basement,Unit B-2, Opposite PSJ Jeweller, Shyam Nagar, Jaipur"
"paparazi Restaurant, Malviya Nagar",https://www.zomato.com/jaipur/paparazi-malviya-nagar,200,"Chinese, South Indian, Fast Food",3.3,99," Ground Floor, Crystal Court Mall, Malviya Nagar, Jaipur"
"mr pizza Restaurant, Sikar Road",https://www.zomato.com/jaipur/mr-pizza-sikar-road,300,"Pizza, Fast Food",3.4,47," 185, Kedia Palacr Road, Murlipura, Shiv Nagar, Sikar Road, Jaipur"
"tandoori tadka Restaurant, Raja Park",https://www.zomato.com/jaipur/tandoori-tadka-raja-park,500,"Fast Food, Chinese, North Indian, Beverages",3.4,47," Plot 3, Barf Khana Chauraha, Jawahar Nagar Road, Raja Park, Jaipur"
"jain pavitra bhojanalya Restaurant, Mansarovar",https://www.zomato.com/jaipur/jain-pavitra-bhojanalya-1-mansarovar,200,North Indian,3.4,81," 3/12, Local Shopping Centre, Near Government Dispensary, Kiran Path, Mansarovar, Jaipur"
"over halt Restaurant, Malviya Nagar",https://www.zomato.com/jaipur/the-over-halt-in-malviya-nagar,400,Cafe,3.4,40," 3/596 B, Shivanand Marg, Opposite Railway Underpass, Malviya Nagar, Jaipur"
"vijs barbeque Restaurant, Bais Godam",https://www.zomato.com/jaipur/vijs-barbeque-bais-godam,600,"North Indian, Fast Food, BBQ",3.4,39," Food Court, 3rd Floor, MGF Metropolitan Mall, Bais Godam, Jaipur"
"treats Restaurant, Shastri Nagar",https://www.zomato.com/jaipur/the-treats-shastri-nagar,500,"Fast Food, North Indian, Chinese",3.4,45," C-2, Ram Marg, Behind TPS School, Shastri Nagar, Jaipur"
"garib nawaz hotel Restaurant, Pink City",https://www.zomato.com/jaipur/garib-nawaz-hotel-pink-city,500,North Indian,3.4,70," Shop 113/114, Ramganj market, Pink City, Jaipur"
"zesto real arabian taste Restaurant, Amer Road",https://www.zomato.com/jaipur/zesto-real-arabian-taste-amer-road,500,"Arabian, Turkish, North Indian",3.4,56," 62, Golimar Garden, Ramgarh Mod,  Amer Road, Jaipur"
"chhabras golden moments Restaurant, Malviya Nagar",https://www.zomato.com/jaipur/chhabras-golden-moments-1-malviya-nagar,750,"North Indian, Chinese, Fast Food",3.4,38," Calgary Road, Malviya Nagar, Jaipur"
"swami south indian masala dosa Restaurant, Mansarovar",https://www.zomato.com/jaipur/swami-south-indian-masala-dosa-mansarovar,200,South Indian,3.4,40," Just Eat Food Court, Shop 17, Riddhi Siddhi Nagar, Gopalpura Bypass, Mansarovar, Jaipur"
"pandit pavbhaji Restaurant, C Scheme",https://www.zomato.com/jaipur/pandit-pavbhaji-c-scheme,200,"South Indian, Chinese, Fast Food, Street Food",3.4,62," C 20, Bhagwant Das Road, C Scheme, Jaipur"
"har har mahadev jai shankar pavitra bhojnalya Restaurant, Sindhi Camp",https://www.zomato.com/jaipur/har-har-mahadev-jai-shankar-pavitra-bhojnalya-sindhi-camp,250,"North Indian, South Indian",3.4,74," Shop 10, Station Road, Near Bus Stand, Kanti Nagar, Sindhi Camp, Jaipur"
"pratap chicken Restaurant, Tonk Road",https://www.zomato.com/jaipur/pratap-chicken-tonk-road,300,North Indian,3.4,63," SP 6, Sector 16, Pratap Nagar, Oppsite Saraswati Apartment, Tonk Road, Jaipur"
"dminions cafe Restaurant, Tonk Road",https://www.zomato.com/jaipur/dminions-cafe-tonk-road,400,"Fast Food, Pizza, Beverages",3.4,44," Plot 1/1, Bhagwati Nagar 2, 80 Feet Road, Near Metrocity Hospital, Tonk Road, Jaipur"
"spicy affair Restaurant, Vaishali Nagar",https://www.zomato.com/jaipur/the-spicy-affair-vaishali-nagar,300,"Fast Food, Beverages",3.4,54," Ground Floor, Evershine Tower, Amrapali Circle, Vaishali Nagar, Jaipur"
"hungry fox Restaurant, Jagatpura",https://www.zomato.com/jaipur/hungry-fox-jagatpura,200,"North Indian, Chinese, Fast Food",3.8,94," House 267/145, Near Water Tank, Jagatpura, Jaipur"
"rasoda Restaurant, C Scheme",https://www.zomato.com/jaipur/rasoda-c-scheme,300,North Indian,3.8,60," 21, Sangram Colony, C Scheme, Jaipur"
"dexter ka cafe Restaurant, Khatipura Road",https://www.zomato.com/jaipur/dexter-ka-cafe-khatipura-road,200,"Fast Food, Pizza",3.8,62," Plot 5, Krishna Colony, Khatipura Road, Jaipur"
"roll express Restaurant, Jhotwara",https://www.zomato.com/jaipur/roll-express-jhotwara,350,Rolls,3.8,86," Plot 6, Kalyan Kunj, Main Kanta Chouraha, Kalwar Road, Jhotwara, Jaipur"
"gulnar Restaurant, Mansarovar",https://www.zomato.com/jaipur/gulnar-1-mansarovar,150,"Juices, Beverages",3.8,86," Near Riddhi Siddhi Circle, Gopalpura Bypass, Link Road, Mansarovar, Jaipur"
"u me soya chaap Restaurant, Raja Park",https://www.zomato.com/jaipur/u-me-soya-chaap-raja-park,350,North Indian,3.8,70," Shop 1, Plot 147, Ram Gali 2, Raja Park, Jaipur"
"pride amber vatika pride amber vilas Restaurant, Tonk Road",https://www.zomato.com/jaipur/pride-amber-vatika-pride-amber-vilas-tonk-road,"1,000",Rajasthani,3.8,44," Pride Amber Vilas, 12 Mile, Vatika Mod, Tonk Road, Jaipur"
"ronak restaurant Restaurant, Ajmer Highway",https://www.zomato.com/jaipur/ronak-restaurant-ajmer-highway,300,North Indian,3.8,66," Shop 29, Gehlot Ka Banglow, Near Heera Petrol Pump, DCM, Ajmer Highway, Jaipur"
"cake bake Restaurant, Bani Park",https://www.zomato.com/jaipur/cake-bake-bani-park,500,Bakery,3.8,36," F 14, Riico Kanta Choraha, Bani Park, Jaipur"
"rama kishana kalkatti chat Restaurant, Adarsh Nagar",https://www.zomato.com/jaipur/rama-kishana-kalkatti-chat-adarsh-nagar,200,Street Food,3.8,39," 2, Masala Chowk, Ram Niwas Baag, Near Albert Hall, Adarsh Nagar, Jaipur"
"t2 dhaba takeaway Restaurant, Malviya Nagar",https://www.zomato.com/jaipur/t2-dhaba-takeaway-malviya-nagar,400,"North Indian, Fast Food, Beverages",3.8,47," 13/1068, Malviya Nagar, Jaipur"
"nand chat bhandar Restaurant, Raja Park",https://www.zomato.com/jaipur/nand-chat-bhandar-raja-park,100,Street Food,3.8,58," Shop 281, Link Road, Raja Park, Jaipur"
"shri ganesh namkeen bhandar Restaurant, Pink City",https://www.zomato.com/jaipur/shri-ganesh-namkeen-bhandar-pink-city,150,Street Food,3.8,78," Shop 4, Sonthliwalo Ka Rasta, Chaura Rasta, Pink City, Jaipur"
"rajmahal oberoi rajvilas Restaurant, Agra Road",https://www.zomato.com/jaipur/rajmahal-the-oberoi-rajvilas-agra-road,"5,000","North Indian, Continental, Chinese",3.8,55," The Oberoi Rajvilas, Goner Road, Near, Agra Road, Jaipur"
"burpys Restaurant, Ajmer Highway",https://www.zomato.com/jaipur/burpys-ajmer-highway,150,"North Indian, Fast Food",3.8,52," Plot 89, Tagore Nagar, Ajmer Road, Ajmer Highway, Jaipur"
"woodz cafe Restaurant, Tonk Road",https://www.zomato.com/jaipur/woodz-cafe-tonk-road,350,"Fast Food, Chinese, Beverages",3.2,25," 377, Mahaveer Nagar 1, Near Ram Mandir, Durgapura, Jaipur"
"h5 lounge bar Restaurant, Tonk Road",https://www.zomato.com/jaipur/h5-lounge-bar-tonk-road,"1,200","North Indian, Chinese, Mexican, Italian",3.2,35," SB 54 C, Level 2, Tonk Road, Jaipur"
"masala zone Restaurant, Tonk Road",https://www.zomato.com/jaipur/masala-zone-tonk-road,600,"North Indian, Fast Food",3.2,15," Hotel Gaura's Inn, Main Tonk Phatak, Tonk Road, Jaipur"
"raavus bite Restaurant, Sodala",https://www.zomato.com/jaipur/raavus-bite-1-sodala,400,"Fast Food, Chinese, North Indian",3.2,28," Trinity Mall, Swej Farm, New Sanganer Road, Sodala, Jaipur"
"#underground restro bar Restaurant, Vidhyadhar Nagar",https://www.zomato.com/jaipur/underground-restro-bar-vidhyadhar-nagar,700,"North Indian, Mughlai",3.2,13," B-5-6, Balaji Tower 2nd, Sikar Road, Vidhyadhar Nagar, Jaipur"
"delhi 1st restaurant Restaurant, Kukas",https://www.zomato.com/jaipur/delhi-1st-restaurant-kukas,350,"North Indian, Chinese, South Indian",3.2,27," RIICO Industrial Area, Near Aarya College, Kukas, Jaipur"
"english vinglish Restaurant, Tonk Road",https://www.zomato.com/jaipur/english-vinglish-tonk-road,350,"Desserts, Bakery",3.2,17," Opposite Glass Factory,Tonk Road, Jaipur"
"shri krishna bakery Restaurant, Shyam Nagar",https://www.zomato.com/jaipur/shri-krishna-bakery-shyam-nagar,350,"Bakery, Desserts",3.2,7," Lane 6, Rani Sati Nagar, Janpath Lane, Nirman Nagar, Shyam Nagar, Jaipur"
"ganesham bakers Restaurant, Jagatpura",https://www.zomato.com/jaipur/ganesham-bakers-jagatpura,250,"Bakery, Fast Food",3.2,24," Shop 1, OBC Colony, Gyan Vihar University, Mahal Road, Jagatpura, Jaipur"
"punjabi tadka Restaurant, Adarsh Nagar",https://www.zomato.com/jaipur/punjabi-tadka-1-adarsh-nagar,550,North Indian,3.2,31," 4th Floor, Pink Square Mall, Adarsh Nagar, Jaipur"
"food 4 u Restaurant, Khatipura Road",https://www.zomato.com/jaipur/the-food-4-u-khatipura-road,600,"Rajasthani, North Indian, Chinese",3.2,28," G-1, Plot 131, Krishan Path, Rajendra Nagar, Sirsi Road, Near Khatipura Road, Jaipur"
"sinful desserts Restaurant, Civil Lines",https://www.zomato.com/jaipur/sinful-desserts-civil-lines,750,Bakery,3.2,18," Jacob Road, Civil Lines, Jaipur"
"bella italia Restaurant, Sansar Chandra Road",https://www.zomato.com/jaipur/the-bella-italia-sansar-chandra-road,"1,000","Italian, Fast Food, North Indian",3.2,15," Roof Top, 4th Floor, Amber Tower, Sansar Chandra Road, Jaipur"
"alis chicken Restaurant, Mansarovar",https://www.zomato.com/jaipur/alis-chicken-mansarovar,400,North Indian,3.2,33," 4/222, Behind Bada Bazaar, Varun Path, Mansarovar, Jaipur"
"handi meat Restaurant, Jhotwara",https://www.zomato.com/jaipur/handi-meat-jhotwara,300,North Indian,3.2,32," Amar Nagar C, 200 Ft Bypass, Near Elegant Height, Khirni Phatak Road, Jhotwara, Jaipur"
"kitchen king restaurant Restaurant, Sindhi Camp",https://www.zomato.com/jaipur/kitchen-king-restaurant-1-sindhi-camp,300,"Fast Food, North Indian, South Indian, Beverages",3.2,10," Shop 37, Mahipal Tower, Bus Stand Road, Near Polovictory, Sindhi Camp, Jaipur"
"hariom falooda shake Restaurant, Pink City",https://www.zomato.com/jaipur/hariom-falooda-and-shake-pink-city,250,"Ice Cream, Beverages, Desserts",3.2,7," Shop 16, Talkatora Shopping Center, Janta Market, Pink City, Jaipur"
"oliya hotel Restaurant, Hasanpura",https://www.zomato.com/jaipur/oliya-hotel-hasanpura,250,North Indian,3.2,11," Khatipura Road, Hasanpura, Jaipur"
"new tadka dhaba Restaurant, Malviya Nagar",https://www.zomato.com/jaipur/new-tadka-dhaba-malviya-nagar,400,North Indian,3.2,12," Benada Tower, Girdhar Marg, Sector 13, Malviya Nagar, Jaipur"
"jaipur wala Restaurant, Jawahar Nagar",https://www.zomato.com/jaipur/jaipur-wala-jawahar-nagar,200,"Beverages, Fast Food",3.2,11," 227/1, Near Puliya 1, Jawahar Nagar, Jaipur"
"asali purana pandit ji famous pav bhaji Restaurant, Mansarovar",https://www.zomato.com/jaipur/asali-purana-pandit-ji-famous-pav-bhaji-mansarovar,200,Street Food,3.2,10," Shop 20, Riddhi Siddhi Nagar, Gopalpura Bypass, Near Mansarovar, Jaipur"
"burger express Restaurant, Raja Park",https://www.zomato.com/jaipur/burger-express-raja-park,550,"Fast Food, Beverages",3.2,7," 19, Opposite AC Market, Raja Park, Jaipur"
"khursheed hotel Restaurant, Tonk Road",https://www.zomato.com/jaipur/khursheed-hotel-1-tonk-road,150,"Roast Chicken, North Indian",3.2,11," Opposite Jama Masjid, Kagzi Colony, Sanganer, Jaipur"
"jaipur heritage dhaba Restaurant, Sikar Road",https://www.zomato.com/jaipur/jaipur-heritage-dhaba-1-sikar-road,600,North Indian,3.2,5," CPE-1, Road 14, Vishwakarma Industrial Area, Near Sikar Raod, Jaipur"
"ehsaas pride amber vilas Restaurant, Tonk Road",https://www.zomato.com/jaipur/ehsaas-pride-amber-vilas-tonk-road,"2,400",Finger Food,3.2,8," Pride Amber Vilas, 12 Mile, Vatika Mod, Tonk Road, Jaipur"
"aanandam multi cuisine restaurant Restaurant, Amer Road",https://www.zomato.com/jaipur/aanandam-multi-cuisine-restaurant-amer-road,"1,600","North Indian, Mughlai, Continental",3.2,8," Dussehra Kothi, Amer Road, Jaipur"
"kanji pavitra bhojnalaya Restaurant, Amer Road",https://www.zomato.com/jaipur/kanji-pavitra-bhojnalaya-amer-road,300,North Indian,3.2,7," 18 & 20, Govindpuri, New Ramgarh Road, Amer Road, Jaipur"
"munch lab Restaurant, Mansarovar",https://www.zomato.com/jaipur/the-munch-lab-mansarovar,250,"North Indian, Chinese",3.2,8," S74, Shopping Centre, Madhayam Marg, Sector 9, Near SBI Bank, Mansarovar, Jaipur"
"hotel raj Restaurant, Sindhi Camp",https://www.zomato.com/jaipur/hotel-raj-sindhi-camp,700,"North Indian, Chinese",3.2,6," Opposite Central Bus Stand, Sindhi Camp, Jaipur"
"sai bakers Restaurant, Malviya Nagar",https://www.zomato.com/jaipur/sai-bakers-malviya-nagar,150,"Bakery, Fast Food",3.2,5," A 417, Satkar Shopping Center, Malviya Nagar, Jaipur"
"cake world Restaurant, Tonk Road",https://www.zomato.com/jaipur/cake-world-1-tonk-road,250,"Bakery, Fast Food",3.7,101," B-31, Daswani House, Basant Bahar Colony, Gopalpura Flyover, Tonk Road, Jaipur"
"olympia Restaurant, Lal Kothi",https://www.zomato.com/jaipur/olympia-lal-kothi,300,North Indian,3.7,117," Behind Laxmi Mandir Cinema, Lal Kothi, Jaipur"
"kesar kanha Restaurant, Chitrakoot",https://www.zomato.com/jaipur/kesar-kanha-chitrakoot,800,"North Indian, Chinese",3.7,98," 10/145A, Step By Step School Road, Chitrakoot Scheme, Chitrakoot, Jaipur"
"vintage rolls Restaurant, Malviya Nagar",https://www.zomato.com/jaipur/vintage-rolls-malviya-nagar,250,"Rolls, Chinese",3.7,104," Ground Floor, GT Central Mall, Malviya Nagar, Jaipur"
"wow mealz Restaurant, Sodala",https://www.zomato.com/jaipur/wow-mealz-sodala,400,"North Indian, Chinese, Fast Food",3.7,146," 2, Kateva Nagar Extension, Gurjar Ki Thadi, New Sanganer Road, Sodala, Jaipur"
"french bakers Restaurant, Malviya Nagar",https://www.zomato.com/jaipur/french-bakers-malviya-nagar,500,"Bakery, Cafe, Desserts",3.7,48," 3/20, Pradhan Marg, Sector 3, Malviya Nagar, Jaipur"
"aapno gaon Restaurant, Sikar Road",https://www.zomato.com/jaipur/aapno-gaon-sikar-road,600,Rajasthani,3.7,126," Road 14, Bypass New Loha Mandi Road, Vishwakarma Industrial Area, Sikar Road, Jaipur"
"narayanji gajak wale Restaurant, Pink City",https://www.zomato.com/jaipur/narayanji-gajak-wale-pink-city,200,Mithai,3.7,141," 344, Johari Bazar Road, Pink City, Jaipur"
"sharma amritsari kulcha bhojnalaya Restaurant, Raja Park",https://www.zomato.com/jaipur/sharma-amritsari-kulcha-bhojnalaya-raja-park,300,North Indian,3.7,112," Shop 9, Panchwati Complex, Panchwati Circle, Raja Park, Jaipur"
"tif kitchen Restaurant, Civil Lines",https://www.zomato.com/jaipur/tif-kitchen-civil-lines,900,"Italian, Mexican, Middle Eastern",3.7,80," House 2, 1st Floor, Mysore House, Jacob Road, Civil Lines, Jaipur"
"xtrema Restaurant, Raja Park",https://www.zomato.com/jaipur/xtrema-raja-park,300,"Fast Food, Beverages",3.7,96," 244, 2nd Floor, Pratap Tower, Near Nagpal Medical, Dhruv Marg, Raja Park, Jaipur"
"tanishas love Restaurant, Jagatpura",https://www.zomato.com/jaipur/tanishas-love-jagatpura,300,Fast Food,3.7,117," Shop 2, Ground Floor, Lotus Pink Building, Jagatpura, Jaipur"
"once upon time bagh Restaurant, Agra Road",https://www.zomato.com/jaipur/once-upon-a-time-at-the-bagh-agra-road,"1,400",North Indian,3.7,92," Vidyadhar Ji Ka Bagh, Ghat Ki Guni, Agra Road, Jaipur"
"terrazzo Restaurant, Tonk Road",https://www.zomato.com/jaipur/terrazzo-tonk-road,"1,200","Fast Food, North Indian, Chinese",3.7,32," Hotel Sarovar Premiere,Lal Kothi,  Sahkar Marg, Tonk Road, Jaipur"
"khan fried palace Restaurant, Pink City",https://www.zomato.com/jaipur/khan-fried-palace-pink-city,300,Fast Food,3.7,144," 122, Ramganj Bazar Road, Pink City, Jaipur"
"khana khazana Restaurant, Vaishali Nagar",https://www.zomato.com/jaipur/khana-khazana-vaishali-nagar,350,"North Indian, Chinese, Fast Food",2.9,6," Shop 18, Janak Vihar, Panchyawala Sirsi Road, Vaishali Nagar, Jaipur"
