name,link,cost for 2,cuisines,ratings,reviews,address
"bunty daa dhaba Restaurant, Tonk Road",https://www.zomato.com/jaipur/bunty-daa-dhaba-tonk-road,250,North Indian,3.1,11," 629 D, Lane 12, Barkat Nagar, Tonk Phatak, Tonk Road, Jaipur"
"jai ganesh cafe bakery Restaurant, Jagatpura",https://www.zomato.com/jaipur/jai-ganesh-cafe-bakery-jagatpura,350,"Bakery, Fast Food",3.1,7," 104/1, Kumbha Marg, Near Community Center, Pratap Nagar, Sector 10, Jagatpura, Jaipur"
"shree mahadev poha bhandaar Restaurant, Vidhyadhar Nagar",https://www.zomato.com/jaipur/shree-mahadev-poha-bhandaar-vidhyadhar-nagar,100,Street Food,3.1,11," Vidyadhar Nagar Thana, Sector 2, Central Spine, Vidyadhar Nagar, Jaipur"
"momos rolls Restaurant, Khatipura Road",https://www.zomato.com/jaipur/momos-and-rolls-khatipura-road,300,"Momos, Rolls, Chinese",3.1,6," 106, Ground Floor, Sankalp Tower, Near Jharkhand Mod, Khatipura Road, Jaipur"
"hotel taj Restaurant, Sindhi Camp",https://www.zomato.com/jaipur/hotel-taj-sindhi-camp,400,"North Indian, Mughlai",3.1,11," 72, Sanjay Circle, Chandpole Gate, Sindhi Camp, Jaipur"
"cup tales Restaurant, Shastri Nagar",https://www.zomato.com/jaipur/cup-tales-shastri-nagar,400,"Cafe, Sandwich, Fast Food",3.1,5," A-283, Padmavti Colony, Kings Road, Nirman Nagar, Brijlalpura, Shastri Nagar, Jaipur"
"ganpati restaurant Restaurant, Bani Park",https://www.zomato.com/jaipur/ganpati-restaurant-bani-park,150,"Mithai, Street Food",3.1,11," S 6A, Kabir Marg, Bani Park, Jaipur"
"punjabi chaap corner Restaurant, Mansarovar",https://www.zomato.com/jaipur/punjabi-chaap-corner-mansarovar,250,"North Indian, Momos, Rolls",3.7,85," Opposite Indian Oil Petrol Pump, Ridhi Sidhi Circle, Gopalpura, Near Mansarovar, Jaipur"
"shaan e darbaar Restaurant, Mansarovar",https://www.zomato.com/jaipur/shaan-e-darbaar-mansarovar,650,"Mughlai, Chinese",3.7,60," 111/398, Shipra Path Road, Near Vijaypath T Point, Mansarovar, Jaipur"
"party lovers restaurant Restaurant, Malviya Nagar",https://www.zomato.com/jaipur/party-lovers-restaurant-malviya-nagar,450,"Chinese, North Indian, Fast Food",3.7,49," 14/9, 1st Floor, Girdhar Marg, Malviya Nagar, Jaipur"
"sheesh mahal bar itc rajputana hotel Restaurant, Gopalbari",https://www.zomato.com/jaipur/sheesh-mahal-bar-itc-rajputana-hotel-gopalbari,"4,000",Finger Food,3.7,53," ITC Rajputana Hotel, Palace Road, Gopalbari, Jaipur"
"kuch khalo Restaurant, Malviya Nagar",https://www.zomato.com/jaipur/kuch-khalo-1-malviya-nagar,350,"North Indian, Fast Food, Chinese",3.7,60," B-3, Vivek Vihar, Opposite Dainik Bhaskar, J.L.N. Marg, Malviya Nagar, Jaipur"
"punjabi dhaba Restaurant, Vaishali Nagar",https://www.zomato.com/jaipur/punjabi-dhaba-vaishali-nagar,500,"North Indian, Fast Food, Chinese, Beverages",3.7,53, Delivery Only
"shree balaji pavitra bhojnalya Restaurant, Lal Kothi",https://www.zomato.com/jaipur/shree-balaji-pavitra-bhojnalya-lal-kothi,400,North Indian,3.7,79," Jyoti Nagar Tiraha, Opposite Harley Davidson, Lal Kothi, Jaipur"
"govindas Restaurant, Mansarovar",https://www.zomato.com/jaipur/govindas-mansarovar,300,"North Indian, Fast Food, South Indian",3.7,72," Iskcon Temple, Iskcon Road, Opposite Vijay Path, Mansarovar, Jaipur"
"frubon ice cream concepts Restaurant, Mansarovar",https://www.zomato.com/jaipur/frubon-ice-cream-concepts-mansarovar,300,"Desserts, Ice Cream",3.7,78," S-50, Sector 5, SFS Shopping Center, Opposite PNB Bank, Agarwal Farm, Mansarovar, Jaipur"
"gotu vada pav company Restaurant, Mansarovar",https://www.zomato.com/jaipur/gotu-vada-pav-company-mansarovar,200,Street Food,3.7,66," Plot 16, 10B Scheme, Riddhi Siddhi, Gopalpura, Mansarovar, Jaipur"
"mini punjabi Restaurant, Sodala",https://www.zomato.com/jaipur/mini-punjabi-sodala,300,North Indian,3.7,50," Shop 3, Shyam Nagar, Sodala, Jaipur"
"heritage buffet Restaurant, Pink City",https://www.zomato.com/jaipur/heritage-buffet-pink-city,850,"North Indian, Chinese, South Indian, Rajasthani, Fast Food",3.7,49," 334, Chandi ki Taksal, Near Ram Prakash Cinema Hall, Pink City, Jaipur"
"ilaaka Restaurant, Mansarovar",https://www.zomato.com/jaipur/ilaaka-mansarovar,500,"Cafe, North Indian",3.7,52," 54/210, Near VT Road Chauraha, Saryu Marg, Mansarovar, Jaipur"
"gulab ji chai Restaurant, Bani Park",https://www.zomato.com/jaipur/gulab-ji-chai-1-bani-park,300,"Tea, Beverages, Fast Food",3.7,51," AC 2, Sawai Jai Singh Highway, Sen Colony, Bani Park, Jaipur"
"pirates cafe Restaurant, Mansarovar",https://www.zomato.com/jaipur/pirates-cafe-mansarovar,300,Fast Food,3.7,55," 71/28, Behind Mansarovar Plaza, Madhyam Marg, Mansarovar, Jaipur"
"hyderabadi dum biryani Restaurant, Malviya Nagar",https://www.zomato.com/jaipur/hyderabadi-dum-biryani-malviya-nagar,500,"Biryani, Chinese, North Indian",3.9,612," 10/851, Near Brain Tower Tiraha, GT Road, Malviya Nagar, Jaipur"
"v2 fine dining restaurant Restaurant, C Scheme",https://www.zomato.com/jaipur/v2-fine-dining-restaurant-1-c-scheme,"1,000","North Indian, South Indian, Fast Food, Chinese",3.9,562," Central Park Gate 4, Vivekanand Marg, Near B5, Opposite Okay Diagnostic, C Scheme, Jaipur"
"warehouse cafe Restaurant, Bapu Nagar",https://www.zomato.com/jaipur/the-warehouse-cafe-bapu-nagar,900,"Cafe, Italian, Chinese, North Indian, Continental",3.9,472," Gandhi Nagar Mode, Near Milestone, Bapu Nagar, Jaipur"
"bismillah hotel Restaurant, Sindhi Camp",https://www.zomato.com/jaipur/bismillah-hotel-sindhi-camp,450,"North Indian, Mughlai",3.9,570," Near Chandpole Gate, Metro Station, Sindhi Camp, Jaipur"
"jayka Restaurant, Malviya Nagar",https://www.zomato.com/jaipur/jayka-malviya-nagar,400,"North Indian, Chinese",3.9,605," 41, Near Eye Hospital, Calgiri Marg, Malviya Nagar, Jaipur"
"punjabi grill Restaurant, Mansarovar",https://www.zomato.com/jaipur/punjabi-grill-mansarovar,700,"North Indian, Chinese",3.9,505," 90/13, Madhyam Marg, Mansarovar, Jaipur"
"tadka dhaba Restaurant, Malviya Nagar",https://www.zomato.com/jaipur/tadka-dhaba-malviya-nagar,300,North Indian,3.9,601," 9/801, Girdhar Marg, Malviya Nagar, Jaipur"
"hotel highway king restaurant Restaurant, Ajmer Highway",https://www.zomato.com/jaipur/hotel-highway-king-restaurant-ajmer-highway,650,"North Indian, South Indian, Chinese, Fast Food, Street Food",3.9,405," Hotel Highway King, 7-9, Patel Nagar, Opposite Heerapura Power, Ajmer Highway, Jaipur"
"bateshwar kachori samose wale Restaurant, Mansarovar",https://www.zomato.com/jaipur/bateshwar-kachori-samose-wale-mansarovar,200,"Mithai, Street Food",3.9,491," Shop 2, 112\95, Thadi Market, Agarwal Farm, Mansarovar, Jaipur"
"bharats bits n bites Restaurant, Raja Park",https://www.zomato.com/jaipur/bharats-bits-n-bites-raja-park,350,"Chinese, Street Food, Fast Food",3.9,372," 487, Vyas Marg, Gali 5, Raja Park, Jaipur"
"pizza square Restaurant, Pink City",https://www.zomato.com/jaipur/the-pizza-square-pink-city,300,"Pizza, Fast Food",3.9,452," 3969, Langer Ke Balaji Ka Mandir, Near Gangauri Hospital, Gangori Bazar, Pink City, Jaipur"
"rominus pizza burger Restaurant, Vidhyadhar Nagar",https://www.zomato.com/jaipur/rominus-pizza-and-burger-vidhyadhar-nagar,600,"Pizza, Burger, Fast Food",3.9,372," Shop G1, Galaxy Plaza, Opposite Balaji Tower 4th, Vidhyadhar Nagar, Jaipur"
"hungry gabbar cafe Restaurant, Vaishali Nagar",https://www.zomato.com/jaipur/hungry-gabbar-cafe-vaishali-nagar,400,"Cafe, Fast Food, Chinese, Street Food, Desserts, Beverages",3.9,323," Shop 3, Block A, Nursery Circle, Vaishali Nagar, Jaipur"
"booze lounge Restaurant, Malviya Nagar",https://www.zomato.com/jaipur/booze-on-lounge-malviya-nagar,"1,600","North Indian, Continental, Chinese, Italian",3.9,320," E 55, Girdhar Marg, Near Ghiya Hospital, Malviya Nagar, Jaipur"
"feast Restaurant, Malviya Nagar",https://www.zomato.com/jaipur/the-feast-malviya-nagar,500,"Fast Food, Bakery, Desserts",3.9,310," Shivam Business Centre, Calgary Road, Near Kotak Mahindra Bank, Opposite Power House, Malviya Nagar, Jaipur"
"yummy chefs kitchen Restaurant, Tonk Road",https://www.zomato.com/jaipur/yummy-chefs-kitchen-tonk-road,300,North Indian,3.6,194," 267/25/4, Near Water Works, Police Thana Road, Sector 26, Pratap Nagar, Tonk Road, Jaipur"
"pandit pav bhaji Restaurant, C Scheme",https://www.zomato.com/jaipur/pandit-pav-bhaji-c-scheme,250,"Street Food, Fast Food, North Indian",3.6,180," Shop 4, Sarojni Marg, Statue Circle, C Scheme, Jaipur"
"old take away veg non veg restaurant Restaurant, Jhotwara",https://www.zomato.com/jaipur/old-take-away-veg-non-veg-restaurant-jhotwara,400,"North Indian, Mughlai",3.6,224," Shop 28, Uday Nagar, 200 Feet Road, Jhotwara, Jaipur"
"prem punjabi rasoi Restaurant, Malviya Nagar",https://www.zomato.com/jaipur/prem-punjabi-rasoi-malviya-nagar,250,North Indian,3.6,197," D-6, JDA Shopping Centre, Behind World Trade Park, Malviya Nagar, Jaipur"
"house bunkins hobs Restaurant, C Scheme",https://www.zomato.com/jaipur/house-of-bunkins-hobs-c-scheme,550,"Cafe, Fast Food",3.6,124," A/4B, 2nd Floor, Chittora House, Opposite Udyog Bhawan, Tilak Marg, C Scheme, Jaipur"
"krishna bakers fast food Restaurant, Pink City",https://www.zomato.com/jaipur/krishna-bakers-fast-food-pink-city,200,"Bakery, Fast Food",3.6,155," Shop 34, Janta Market, Govind Dev Ji Road, Pink City, Jaipur"
"howzat Restaurant, Tonk Road",https://www.zomato.com/jaipur/howzat-tonk-road,"1,500","North Indian, Chinese, Continental, Italian",3.6,80," 112, Opposite Morani Volvo, 3rd Floor at Tata Motors, Tonk Road, Jaipur"
"minku restaurant Restaurant, Sikar Road",https://www.zomato.com/jaipur/minku-restaurant-sikar-road,450,"North Indian, Fast Food, Chinese",3.6,208," Murlipura Thana Road, Near Goras Bhandar, Sikar Road, Jaipur"
"firoz non veg takeaway Restaurant, Tonk Road",https://www.zomato.com/jaipur/firoz-non-veg-takeaway-tonk-road,400,North Indian,3.6,175," Kumbha Marg, Pratap Nagar, Sector 8, Tonk Road, Jaipur"
"sathi restaurant bar Restaurant, Vaishali Nagar",https://www.zomato.com/jaipur/sathi-restaurant-bar-vaishali-nagar,750,"North Indian, Italian, Chinese",3.6,128," Plot 10, Nemi Nagar, Gautam Marg, Gandhi Path, Vaishali Nagar, Jaipur"
"jai bhawani meat shop Restaurant, Malviya Nagar",https://www.zomato.com/jaipur/jai-bhawani-meat-shop-1-malviya-nagar,500,"Raw Meats, North Indian, Chinese",3.6,157," A-24, Indra Palace, Near Bank Of Maharasthra, Gaurav Tower, Malviya Nagar, Jaipur"
"kullad teafe Restaurant, MI Road",https://www.zomato.com/jaipur/kullad-the-teafe-mi-road,300,"Street Food, Fast Food, North Indian, Beverages",3.6,145," Mehrishi Bhawan, Opposite Ganpati Plaza, MI Road, Jaipur"
"one pavitra bhojnalaya Restaurant, MI Road",https://www.zomato.com/jaipur/a-one-pavitra-bhojnalaya-mi-road,300,North Indian,3.6,154," Opposite Jangid Bhawan, MI Road, Jaipur"
"tea saga Restaurant, Lal Kothi",https://www.zomato.com/jaipur/tea-saga-lal-kothi,250,"Cafe, Fast Food",3.6,115," NGS 42, Nehru Palace, Lal Kothi, Jaipur"
"eatosa Restaurant, Mansarovar",https://www.zomato.com/jaipur/eatosa-1-mansarovar,400,"Fast Food, North Indian",3.6,143, Delivery Only
"messy door Restaurant, Shastri Nagar",https://www.zomato.com/jaipur/the-messy-door-shastri-nagar,600,"Fast Food, Pizza, Desserts",4.2,617," A-28, TB Hospital Road, Sindhu Colony, Subhash Nagar, Near Shastri Nagar, Jaipur"
"chaisa Restaurant, Lal Kothi",https://www.zomato.com/jaipur/chaisa-lal-kothi,500,"Cafe, Fast Food, Italian, Beverages",4.2,690," 8 A, Satya Vihar, Behind Nagar Nagam Civil Lines Zones Ofice, Near Vidhan Sabha, Lal Kothi, Jaipur"
"dhaba kulture Restaurant, Vaishali Nagar",https://www.zomato.com/jaipur/dhaba-kulture-vaishali-nagar,600,"North Indian, Chinese, Fast Food, Beverages",4.2,635," A3, Lohia Colony, Vaishali Marg, Vaishali Nagar, Jaipur"
"ra ra momos express Restaurant, Vaishali Nagar",https://www.zomato.com/jaipur/ra-ra-momos-express-vaishali-nagar,300,"Momos, Chinese",4.2,412," Shop 33, A Block, Nursery Circle, Vaishali Nagar, Jaipur"
"pint house Restaurant, Sodala",https://www.zomato.com/jaipur/pint-house-sodala,900,"North Indian, Chinese, Lebanese, Continental, Italian",4.2,337," 7th Floor, Big Ben Tower, New Sanganer Road, Opposite Trinity Mall, Sodala, Jaipur"
"squisito Restaurant, Malviya Nagar",https://www.zomato.com/jaipur/squisito-malviya-nagar,"1,200","North Indian, Chinese, Finger Food, Italian",4.2,287," E 20, 2nd Floor, Vijaya Bank, Girdhar Marg, Malviya Nagar, Jaipur"
"coffee break Restaurant, Vaishali Nagar",https://www.zomato.com/jaipur/coffee-break-vaishali-nagar,"1,100","Cafe, Fast Food, Beverages",4.2,256," Shop 9, Plot 112, Jagdamba Colony, Nursery Circle, Vaishali Nagar, Jaipur"
"blue tokai coffee roasters Restaurant, C Scheme",https://www.zomato.com/jaipur/blue-tokai-coffee-roasters-c-scheme,900,"Cafe, Coffee",4.2,238," 101, 1st Floor, Suryavanshi Pearl, A-5 Chomu House, Sardar Patel Marg, C Scheme, Jaipur"
"suvarna mahal rambagh palace Restaurant, C Scheme",https://www.zomato.com/jaipur/suvarna-mahal-rambagh-palace-c-scheme,"5,000","North Indian, Awadhi, Hyderabadi",4.2,209," Rambagh Palace, Bhawani Singh Road, C Scheme, Jaipur"
"sri motu ram prasadam original Restaurant, C Scheme",https://www.zomato.com/jaipur/sri-motu-ram-prasadam-original-c-scheme,800,"North Indian, South Indian, Rajasthani",4.2,191," Shop 1, Yudhishtir Marg, Near Ashok Nagar Police Station, C Scheme, Jaipur"
"shyam darbaar Restaurant, Bais Godam",https://www.zomato.com/jaipur/shyam-darbaar-bais-godam,600,"North Indian, South Indian, Chinese, Street Food, Continental",4.2,359," C-17, Swej Farm Road, Near Mangal Mach Marriage Garden, Nandpuri Market 22, Bais Godam, Jaipur"
"anus kitchen Restaurant, Mansarovar",https://www.zomato.com/jaipur/anus-kitchen-mansarovar,500,"North Indian, Chinese, Rolls, Biryani",4.2,276," Shop 10, Sector 2, Shopping Center, SFS Agarwal Farm, Mansarovar, Jaipur"
"fresca Restaurant, Malviya Nagar",https://www.zomato.com/frescajaipur,"1,000","Continental, Italian, North Indian, Beverages",4.2,165," 10, Mahalaxmi Nagar Road, JLN Marg, Malviya Nagar, Jaipur"
"cnf cheese fries Restaurant, Vaishali Nagar",https://www.zomato.com/jaipur/cnf-cheese-fries-vaishali-nagar,400,"Fast Food, Beverages",4.2,197," Evershine Tower, Amrapali Circle, Vaishali Nagar, Jaipur"
"rajput room rambagh palace Restaurant, C Scheme",https://www.zomato.com/jaipur/the-rajput-room-rambagh-palace-c-scheme,"4,000","North Indian, Continental, Asian",4.2,159," Rambagh Palace, Bhawani Singh Road, C Scheme, Jaipur"
"prisa food junction Restaurant, Mansarovar",https://www.zomato.com/jaipur/prisa-food-junction-mansarovar,250,"Chinese, Fast Food, North Indian, Beverages",3.4,17," Shop 6, Near Dholai, Krishna Sarovar Iskon Temple Road, Mansarovar, Jaipur"
"lajawab sabjiwalaj Restaurant, Sikar Road",https://www.zomato.com/jaipur/lajawab-sabjiwalaj-sikar-road,300,"North Indian, Chinese, Rajasthani",3.4,20," Oppposite Manipal Hospital, Sikar Road, Jaipur"
"kgn fast food n roll Restaurant, Jhotwara",https://www.zomato.com/jaipur/kgn-fast-food-n-roll-jhotwara,250,"Rolls, Chinese, Momos, Fast Food",3.4,16," 22, Barkat Colony Chauraha, Jhotwara, Jaipur"
"mohan restaurant Restaurant, Pink City",https://www.zomato.com/jaipur/mohan-restaurant-pink-city,200,"South Indian, Street Food",3.4,28," 191, Chandpole Bazaar, Pink City, Jaipur"
"cuuve Restaurant, Shastri Nagar",https://www.zomato.com/jaipur/cuuve-2-shastri-nagar,400,"Beverages, Fast Food",3.4,17," G 1 & 2, Krishna Kripa 1, Subhash Nagar, Behind Science Park, Shastri Nagar, Jaipur"
"mountain madness Restaurant, Amer Road",https://www.zomato.com/jaipur/mountain-madness-amer-road,900,"North Indian, Pizza, Fast Food, Desserts, Beverages",3.4,9," Plot 16, Ganesh Colony, Near Jaipur Gramin Police Line, Amer Road, Jaipur"
"punjabi flavour Restaurant, Chitrakoot",https://www.zomato.com/jaipur/punjabi-flavour-chitrakoot,350,"North Indian, Chinese",3.4,24," Plot 24, Basement, Chandaram Apartment, Opposite Paradigm Library, Sector 5, Chitrakoot, Jaipur"
"khansama traditional kitchen Restaurant, C Scheme",https://www.zomato.com/jaipur/khansama-the-traditional-kitchen-c-scheme,400,"Rajasthani, North Indian",3.4,16," P 14, Sehdev Marg, C Scheme, Jaipur"
"batras tasty room Restaurant, Jagatpura",https://www.zomato.com/jaipur/batras-tasty-room-jagatpura,150,North Indian,3.4,25," D 3, Kusum Vihar, Near Lane 9, SKIT Road, Jagatpura, Jaipur"
"crunch Restaurant, C Scheme",https://www.zomato.com/jaipur/the-crunch-c-scheme,400,"Fast Food, Beverages",NEW,," Plot F-1-A, Ramesh Marg, Opposite Masjid, C Scheme, Jaipur"
"pandit ji ki famous pav bhaji bhelpuri Restaurant, C Scheme",https://www.zomato.com/jaipur/pandit-ji-ki-famous-pav-bhaji-and-bhelpuri-c-scheme,200,Fast Food,3.4,19," Shop 4, Sarojni Marg, Statue Circle, C Scheme, Jaipur"
"meat wala Restaurant, Vaishali Nagar",https://www.zomato.com/jaipur/meat-wala-vaishali-nagar,150,North Indian,3.4,19," E-58, Kanha Vihar, Ayodhya Nagar, Bhura Patel Marg, Opposite Shelbi Hospital, Vaishali Nagar, Jaipur"
"karodia kachori Restaurant, Pink City",https://www.zomato.com/jaipur/karodia-kachori-pink-city,100,Street Food,3.4,21," 150, Haldion Ka Rasta, Johri Bazar, Ramganj Bazar, Pink City, Jaipur"
"jaipur pizza Restaurant, Vidhyadhar Nagar",https://www.zomato.com/jaipur/jaipur-pizza-vidhyadhar-nagar,250,"Fast Food, Beverages, Pizza, Burger, Sandwich, Cafe",3.4,18," G14, Ganpati Paradise, Central Spine, Sector 2, Vidhyadhar Nagar, Jaipur"
"riwaz restaurant Restaurant, MI Road",https://www.zomato.com/jaipur/riwaz-restaurant-mi-road,150,North Indian,3.4,17," Plot 187, Main Road, Jalupura, MI Road, Jaipur"
"palak restaurant Restaurant, Jagatpura",https://www.zomato.com/jaipur/palak-restaurant-jagatpura,200,North Indian,3.0,6," Plot 37, Braj Vatika, Near 7 Chauraha, Jagatpura, Jaipur"
"bhayajee mittal sweets Restaurant, Mansarovar",https://www.zomato.com/jaipur/bhayajee-mittal-sweets-mansarovar,300,"Mithai, Street Food",3.0,5," C-3, Saras Kripa, Sitaram Vihar, Near ICICI Bank, Patrakar Colony, Mansarovar, Jaipur"
"hanuman sahu gajak udyog Restaurant, Shyam Nagar",https://www.zomato.com/jaipur/hanuman-sahu-gajak-udyog-shyam-nagar,150,Desserts,3.0,5," Shop 4, Sabji Mandi, Ajmer Road, Shyam Nagar, Jaipur"
"desi junction Restaurant, Shyam Nagar",https://www.zomato.com/jaipur/desi-junction-shyam-nagar,150,"Street Food, North Indian",3.0,4," 303, Nirman Nagar, Kings Road, Shyam Nagar, Jaipur"
"nothing before friends Restaurant, Raja Park",https://www.zomato.com/jaipur/nothing-before-friends-raja-park,350,"Cafe, Chinese, Fast Food",3.0,5," 402, Gali 3, Near Axis Bank, Raja Park, Jaipur"
"balaji tandoori tea snacks Restaurant, Shastri Nagar",https://www.zomato.com/jaipur/balaji-tandoori-tea-snacks-shastri-nagar,150,"Tea, Street Food",3.0,4," A-1, Subhash Nagar Mod, Near Cinema Hall, Near Shastri Nagar, Jaipur"
"cha cha gareeb nawaz hotel Restaurant, Tonk Road",https://www.zomato.com/jaipur/cha-cha-gareeb-nawaz-hotel-tonk-road,500,"Chinese, North Indian",3.0,5," Mal pura Gate, Diggi Road, Opposite Eidgaah Masjid, Sanganer, Jaipur"
"bbq takeaway kebab shop Restaurant, Jhotwara",https://www.zomato.com/jaipur/bbq-takeaway-the-kebab-shop-jhotwara,200,"North Indian, Mughlai",3.0,4," Plot 20, Uday Nagar, Golden Bakery Jhotwara, Jaipur"
"crazy fast food center Restaurant, Mansarovar",https://www.zomato.com/jaipur/crazy-fast-food-center-mansarovar,250,Fast Food,2.9,56," 112/151, Near Akashdeep School, Thadi Market, Jhalana Chhod, Mansarovar, Jaipur"
"rajputana garden restaurant Restaurant, Jagatpura",https://www.zomato.com/jaipur/rajputana-garden-restaurant-jagatpura,550,"North Indian, Chinese",2.9,38," 376, Pink City Enclave, Jagatpura, Jaipur"
"royals bakery Restaurant, Ajmer Highway",https://www.zomato.com/jaipur/the-royals-bakery-ajmer-highway,200,"Bakery, Fast Food",2.9,9," 30 B, Near Sagar Market, Bhakrota, Jaipur"
"krishna misthan bhandar Restaurant, Shastri Nagar",https://www.zomato.com/jaipur/krishna-misthan-bhandar-shastri-nagar,300,Mithai,2.9,42," Indra Verna Colony, Shastri Nagar, Jaipur"
"pizza fort Restaurant, Jagatpura",https://www.zomato.com/jaipur/pizza-fort-jagatpura,450,"Pizza, Fast Food",2.9,30," Shop 68/69, Vikas Nagar, Opposite Cheel Gadi, Sanganer, Near Jagatpura, Jaipur"
"rajus kitchen Restaurant, Jagatpura",https://www.zomato.com/rajuskitchen,400,"Fast Food, Chinese, North Indian",2.9,22," B-74, Hotel Basant Building, Opposite Jaipur Airport T-1, Jagatpura, Jaipur"
"juicy junction Restaurant, Vaishali Nagar",https://www.zomato.com/jaipur/juicy-junction-vaishali-nagar,150,"Juices, Beverages",2.9,21," C-15, Chitrakoot Stadium, Vaishali Nagar, Jaipur"
"jal mahal Restaurant, Amer Road",https://www.zomato.com/jaipur/jal-mahal-amer-road,500,"North Indian, Chinese",3.2,10," Hotel Lake Palace, Near Jal Mahal, Amer Road, Jaipur"
"club elaaka restro bar Restaurant, Jhotwara",https://www.zomato.com/jaipur/club-elaaka-restro-bar-jhotwara,"1,000",North Indian,3.2,9," Plot 1A/121, A -II, Sanjay Nagar 1, Kalwar Road, Jhotwara, Jaipur"
"khana khazana mom made food Restaurant, Ajmer Highway",https://www.zomato.com/jaipur/khana-khazana-mom-made-food-ajmer-highway,400,North Indian,3.2,13," SD-52, Shanti Nagar, Ajmer Road, Behind Civil Line Metro Station, Ajmer Highway, Jaipur"
"anaye bakers confectionery Restaurant, Tonk Road",https://www.zomato.com/jaipur/anaye-bakers-and-confectionery-tonk-road,100,"Bakery, Ice Cream, Fast Food",3.2,8," 55, Ojha Ji Ka Bagh, Gandhi Nagar Mod, Tonk Road, Jaipur"
"heart cafe Restaurant, Malviya Nagar",https://www.zomato.com/jaipur/heart-cafe-malviya-nagar,300,"Fast Food, Beverages",3.2,13," Shop 10, JDA Shopping Centre, Model Town, Malviya Nagar, Jaipur"
"new sher e punjab dhaba Restaurant, Sodala",https://www.zomato.com/jaipur/new-sher-e-punjab-dhaba-sodala,400,North Indian,3.2,11," Shop 10, Vekunth Colony, Hawa Sadak, Sodala, Jaipur"
"konkan dosa Restaurant, Jawahar Nagar",https://www.zomato.com/jaipur/konkan-dosa-jawahar-nagar,250,South Indian,3.2,9," 251/4, Shanti Path, Opposite Jawahar Nagar Police Station, Jawahar Nagar, Jaipur"
"swadesi fast food Restaurant, Adarsh Nagar",https://www.zomato.com/jaipur/swadesi-fast-food-adarsh-nagar,250,North Indian,3.2,10," S-2, Anandpuri, Adarsh Nagar, Jaipur"
"narulas Restaurant, Raja Park",https://www.zomato.com/jaipur/narulas-raja-park,500,"Chinese, North Indian, Fast Food",3.2,11," P 158C, Ram Gali 3, Raja Park, Jaipur"
"fitness dietary Restaurant, Shastri Nagar",https://www.zomato.com/jaipur/fitness-dietary-shastri-nagar,300,Healthy Food,3.2,9," H-71, Pani Pech, Dwarika Path, Sanjay Colony, Nehru Nagar, Shastri Nagar, Jaipur"
"balaji pavitra bhojnalaya Restaurant, Malviya Nagar",https://www.zomato.com/jaipur/balaji-pavitra-bhojnalaya-malviya-nagar,300,North Indian,3.2,8," Shop Uu-40 & 41, Near Calgiri Hospital, Calgiri Road, Malviya Nagar, Jaipur"
"food roid Restaurant, Amer Road",https://www.zomato.com/jaipur/food-roid-amer-road,350,North Indian,3.2,10," Hotel White Palace, Govindpura West, Behind Jaipur Haat, Amer Road, Jaipur"
"egg dee sanjay restaurant Restaurant, Tonk Road",https://www.zomato.com/jaipur/egg-dee-sanjay-restaurant-tonk-road,500,"North Indian, Fast Food",3.2,12," Plot 80/06-07, Gold Square Complex, Kumbha Marg, Pratap Nagar, Tonk Road, Jaipur"
"kanha kitchen journey Restaurant, Ajmer Highway",https://www.zomato.com/jaipur/kanha-kitchen-journey-ajmer-highway,300,North Indian,3.2,5," Plot 109/110, Modi Nagar, Nandan Apartment, Ajmer Highway, Jaipur"
"laxmi pavitra bhojnalaya Restaurant, Kukas",https://www.zomato.com/jaipur/laxmi-pavitra-bhojnalaya-kukas,150,North Indian,3.2,8," Delhi Road, Opposite Sai Baba Mandir, Kukas, Jaipur"
"cake factory Restaurant, Vaishali Nagar",https://www.zomato.com/jaipur/cake-factory-vaishali-nagar,200,"Bakery, Desserts",3.9,59," Plot 79, Welcome Colony, Khatipura Road, Vaishali Nagar, Jaipur"
"baba ganoush Restaurant, Malviya Nagar",https://www.zomato.com/jaipur/baba-ganoush-malviya-nagar,"1,000","Fast Food, Beverages",3.9,38," E-96, Lal Bahadur Nagar, Malviya Nagar, Jaipur"
"dadu dayal sweets Restaurant, Tonk Road",https://www.zomato.com/jaipur/dadu-dayal-sweets-tonk-road,200,Mithai,3.9,85," A 10, Mahesh Nagar, Tonk Road, Jaipur"
"durgadas chaat bhandar Restaurant, Adarsh Nagar",https://www.zomato.com/jaipur/durgadas-chaat-bhandar-adarsh-nagar,150,Street Food,3.9,78," 15/120, Dusra Chauraha, Baraf Khana Road, Adarsh Nagar, Jaipur"
"cake bake Restaurant, Vaishali Nagar",https://www.zomato.com/jaipur/cake-bake-vaishali-nagar,150,Bakery,3.9,57," Plot 79, Welcome Colony, Vaishali Nagar, Jaipur"
"shree govindam dhaba Restaurant, Sikar Road",https://www.zomato.com/jaipur/shree-govindam-dhaba-sikar-road,250,North Indian,3.9,86," Shop 10 & 11, Murlipura, Sikar Road, Jaipur"
"shree mahaveer matka kulfi faluda Restaurant, Shastri Nagar",https://www.zomato.com/jaipur/shree-mahaveer-matka-kulfi-faluda-shastri-nagar,100,Ice Cream,3.9,84," E64, Near Science Park, Shastri Nagar, Jaipur"
"boisson blend company Restaurant, Malviya Nagar",https://www.zomato.com/jaipur/boisson-the-blend-company-malviya-nagar,450,"Beverages, Fast Food",3.9,37," Outlet 3, Food Court Level, World Trade Park, Malviya Nagar, Jaipur"
"gooddo vegan kiosk Restaurant, Raja Park",https://www.zomato.com/jaipur/gooddo-the-vegan-kiosk-raja-park,200,"Fast Food, North Indian",3.9,27," Shop 2, Plot 378, Gali 1, Panchwati Circle, Raja Park, Jaipur"
"jal mahal ice cream cafe Restaurant, Vaishali Nagar",https://www.zomato.com/jaipur/jal-mahal-ice-cream-cafe-vaishali-nagar,300,"Desserts, Ice Cream",3.9,41," Plot 274, Opposite Crossland Hyundai, Vaishali Marg, Vaishali Nagar, Jaipur"
"laal badshah by white kitchens Restaurant, Lal Kothi",https://www.zomato.com/jaipur/laal-badshah-by-white-kitchens-lal-kothi,500,"Mughlai, North Indian",3.9,39," B-60, Sehkar Marg, Lal Kothi, Jaipur"
"fusion lassi Restaurant, Sodala",https://www.zomato.com/jaipur/fusion-lassi-1-sodala,200,Beverages,3.9,33," 28, & 29 Vishav Nagar, Opposite Devi Nagar, Metro Pillar 81, New Sanganer Road, Sodala, Jaipur"
