name,link,cost for 2,cuisines,ratings,reviews,address
"babulas taste Restaurant, Jagatpura",https://www.zomato.com/jaipur/babulas-taste-jagatpura,300,North Indian,3.2,25," E-7, D-7, Sunil Nagar, VIT Road, Jagatpura, Jaipur"
"samrat burger pizza cafe Restaurant, Tonk Road",https://www.zomato.com/jaipur/samrat-burger-and-pizza-cafe-tonk-road,350,"Pizza, Beverages, Desserts, Fast Food",3.2,23," 413, Satluj Apartment, Pratap Nagar, Sitapura, Near Tonk Road, Jaipur"
"eat punjab Restaurant, Sodala",https://www.zomato.com/jaipur/eat-punjab-sodala,800,North Indian,3.7,49," Hotel Shri Laxmi Palace, New Sanganer Road, Sodala, Jaipur"
"flavours cafe restaurant Restaurant, Bani Park",https://www.zomato.com/jaipur/flavours-cafe-restaurant-bani-park,"1,200","North Indian, Chinese, Italian",3.7,38," Nirwana Hometel, 4 D-Villa, Khasa Kothi Circle, Station Road, Bani Park, Jaipur"
"atithiya Restaurant, Bani Park",https://www.zomato.com/jaipur/atithiya-bani-park,700,"North Indian, Chinese, Italian, South Indian",3.7,74," AD-1A, Kabir Marg, Opposite Gate 4, Session Court, Bani Park, Jaipur"
"hy5 multicuisine veg restaurant Restaurant, Mansarovar",https://www.zomato.com/jaipur/hy5-a-multicuisine-veg-restaurant-mansarovar,500,"North Indian, Fast Food",3.7,30," S-8, New Atish Market, Gopalpura Bypass, Opposite Metro Piller 46, Mansarovar, Jaipur"
"mothers kitchen Restaurant, Malviya Nagar",https://www.zomato.com/jaipur/mothers-kitchen-malviya-nagar,300,"Fast Food, North Indian",3.7,78," 6/297, Malviya Nagar, Jaipur"
"chai haus Restaurant, Raja Park",https://www.zomato.com/jaipur/chai-haus-raja-park,250,"Beverages, Fast Food",3.7,80," G1, Panchwati Complex, Panchwati Circle, Raja Park, Jaipur"
"egnite Restaurant, Mansarovar",https://www.zomato.com/jaipur/egnite-1-mansarovar,500,"Cafe, Fast Food",3.7,65," 84/256, Madhyam Marg, Above Peter England, Mansarovar, Jaipur"
"saini dhaba Restaurant, Sikar Road",https://www.zomato.com/jaipur/saini-dhaba-sikar-road,350,North Indian,3.7,95," Road 1, VKI Area, Sikar Road, Jaipur"
"mamus cafe Restaurant, C Scheme",https://www.zomato.com/jaipur/mamus-cafe-2-c-scheme,350,"Chinese, Fast Food, Beverages",3.7,78," Shop 5, Mahaveer Marg, Opposite Mahaveer School, C Scheme, Jaipur"
"daily nutrition diet dnd Restaurant, C Scheme",https://www.zomato.com/jaipur/daily-nutrition-diet-dnd-c-scheme,400,"Healthy Food, Beverages",3.7,63," F 31, Azad Marg, C Scheme, Jaipur"
"sodhya halwai Restaurant, Pink City",https://www.zomato.com/jaipur/sodhya-halwai-pink-city,300,Mithai,3.7,115," Shop 30, Chaura Rasta, Lal Ji Sand Ka Rasta, Modikhana, Jaipur"
"hungry bites Restaurant, Lal Kothi",https://www.zomato.com/jaipur/hungry-bites-1-lal-kothi,300,Fast Food,3.7,74," P 4, Friends Colony, Janpath Road, Lal Kothi, Jaipur"
"sharma bhojnalya Restaurant, Tonk Road",https://www.zomato.com/jaipur/sharma-bhojnalya-tonk-road,300,North Indian,3.7,114," Near Bhagwan Shree Jhoolelal Temple, Durgapura, Tonk Road, Jaipur"
"sheesh mahal restaurant Restaurant, Adarsh Nagar",https://www.zomato.com/jaipur/sheesh-mahal-restaurant-adarsh-nagar,300,Mughlai,3.7,111," Moti Doongri Road, Near Muslim Musafir Khana, Adarsh Nagar, Jaipur"
"sundevich Restaurant, Jagatpura",https://www.zomato.com/jaipur/sundevich-jagatpura,150,Fast Food,3.7,70," Shop 122, SDC Count Yard, SKIT College Gate 1, Jagatpura, Jaipur, Jagatpura, Jaipur"
"khatta meetha teekha tadka Restaurant, Tonk Road",https://www.zomato.com/jaipur/khatta-meetha-teekha-tadka-tonk-road,300,North Indian,3.6,477," Near Roadways Bus Stand, Durgapura, Tonk Road, Jaipur"
"cafe 99 Restaurant, Lal Kothi",https://www.zomato.com/jaipur/cafe-99-lal-kothi,350,"North Indian, South Indian, Chinese, Beverages",3.6,584," A 19, Satya Vihar, Lal Kothi, Jaipur"
"sharma dhaba garden Restaurant, Sikar Road",https://www.zomato.com/jaipur/sharma-dhaba-garden-sikar-road,500,North Indian,3.6,550," G 445 (1), Road 12, Opposite Petrol Pump, VKI Area, Sikar Road, Jaipur"
"pizza mr beans Restaurant, Malviya Nagar",https://www.zomato.com/jaipur/pizza-mr-beans-malviya-nagar,450,"Pizza, Fast Food",3.6,608," Basement, Haldiya Tower, Opposite Gaurav Tower, Malviya Nagar, Jaipur"
"thali house Restaurant, Sindhi Camp",https://www.zomato.com/jaipur/thali-house-sindhi-camp,500,"North Indian, Rajasthani, South Indian",3.6,532," Station Road, Near Sindhi Camp Bus Stand, Sindhi Camp, Jaipur"
"lalis streat Restaurant, Mansarovar",https://www.zomato.com/jaipur/lalis-streat-mansarovar,300,"Chinese, North Indian, South Indian, Street Food, Fast Food, Beverages",3.6,485," 80/99, Madhyam Marg, Opposite Okay Plus Square, Mansarovar, Jaipur"
"sahni barbeque Restaurant, Malviya Nagar",https://www.zomato.com/jaipur/sahni-barbeque-malviya-nagar,600,North Indian,3.6,430," Shop 1, Plot 12/14, Girdhar Marg, Opposite Girdhar Hospital, Malviya Nagar, Jaipur"
"sankalp Restaurant, Vaishali Nagar",https://www.zomato.com/jaipur/sankalp-vaishali-nagar,650,South Indian,3.6,341," 32 & 33, 1st Floor, Vidhyut Nagar A, Near Subh Hospital, Prince Road, Vaishali Nagar, Jaipur"
"vandeys Restaurant, Malviya Nagar",https://www.zomato.com/jaipur/vandeys-malviya-nagar,300,"Fast Food, Chinese, Beverages",3.6,354," Shop 1, D Block Shopping Center, Near Gaurav Tower, Malviya Nagar, Jaipur"
"natraj Restaurant, MI Road",https://www.zomato.com/jaipur/natraj-mi-road,700,"Mithai, North Indian, Fast Food, Beverages",3.6,274," Panch Batti, MI Road, Jaipur"
"kings platter restaurant Restaurant, MI Road",https://www.zomato.com/jaipur/kings-platter-restaurant-mi-road,550,"North Indian, Mughlai",3.6,221," Ganesham Building, Opposite Standard Chartered Bank, MI Road, Jaipur"
"snack sadda desi Restaurant, Malviya Nagar",https://www.zomato.com/jaipur/snack-sadda-desi-malviya-nagar,550,"North Indian, Fast Food, Chinese, South Indian",3.6,229," A 1, Crystal Court Mall, D Block, Malviya Nagar, Jaipur"
"rawat restaurant Restaurant, Sindhi Camp",https://www.zomato.com/jaipur/padmini-restaurant-sindhi-camp,400,"North Indian, South Indian, Rajasthani, Fast Food, Desserts, Ice Cream",3.6,282," Hotel Rawat, Opposite Polovictory Cinema, Station Road, Sindhi Camp, Jaipur"
"chai mate Restaurant, Vidhyadhar Nagar",https://www.zomato.com/jaipur/chai-mate-vidhyadhar-nagar,350,"Fast Food, Beverages",3.6,296," G 52, Ganesham Plaza, Near Cine Star Cinema, Central Spine, Sector 2, Vidhyadhar Nagar, Jaipur"
"laziz chicken food restaurant Restaurant, Jhotwara",https://www.zomato.com/jaipur/laziz-chicken-food-restaurant-jhotwara,500,"Mughlai, North Indian",3.6,320," 79, Uday Nagar, Street 5, 200 Feet Bypass Road, Jhotwara, Jaipur"
"hawk view Restaurant, Pink City",https://www.zomato.com/jaipur/hawk-view-pink-city,800,"North Indian, Chinese, Fast Food, Italian",4.0,95," 76, Raja Mal Ka Talab, Chandi Ki Taksal, Behind Kale Hanuman Ji Temple, Pink City, Jaipur"
"central perk Restaurant, Mansarovar",https://www.zomato.com/jaipur/central-perk-mansarovar,250,Fast Food,4.0,99," Shop 18, SFS Market, Sector 2, Near SBI Bank, Agarwal Farm, Mansarovar, Jaipur"
"parsec Restaurant, Tonk Road",https://www.zomato.com/jaipur/the-parsec-tonk-road,600,"Cafe, Chinese",4.0,120," B 33, FCB Tower, Basant Bahar, Gopalpura Road, Tonk Road, Jaipur"
"celebration day Restaurant, Mansarovar",https://www.zomato.com/jaipur/the-celebration-day-mansarovar,300,"Beverages, Fast Food",4.0,62," Shop A11, Ground Floor, Scheme 10B, Gopalpura Bypass Road, Krishna Nagar, Mansarovar, Jaipur"
"eggfie Restaurant, C Scheme",https://www.zomato.com/jaipur/eggfie-c-scheme,200,"Italian, Fast Food, Beverages",4.0,52," P 14, Sehdev Marg, C Scheme, Jaipur"
"my french bistro Restaurant, Malviya Nagar",https://www.zomato.com/jaipur/my-french-bistro-1-malviya-nagar,550,"Cafe, Fast Food, Desserts",4.0,41," Plot 10, Shaheed Amit Bhardwaj Marg, Jai Shree Nagar, Malviya Nagar, Jaipur"
"cake club Restaurant, Shyam Nagar",https://www.zomato.com/jaipur/cake-club-shyam-nagar,400,Bakery,4.0,40," Shop 79, Sodala, Shyam Nagar, Jaipur"
"grab coffee Restaurant, Tonk Road",https://www.zomato.com/jaipur/grab-a-coffee-tonk-road,400,"Cafe, Beverages",4.0,27," Shop 19, Muktanand Nagar, Gopalpura By Pass, Tonk Road, Jaipur"
"cake more Restaurant, Mansarovar",https://www.zomato.com/jaipur/cake-more-mansarovar,200,Bakery,4.0,28," Shop 79, Gurjar Ki Thadi, Gopalpura Road, Mansarovar, Jaipur"
"vaishnav swami dosa wala Restaurant, Mansarovar",https://www.zomato.com/jaipur/vaishnav-swami-dosa-wala-mansarovar,200,South Indian,NEW,," Shop 19, Just Eat Market, Siddhi Crossing, Mansarovar, Jaipur"
"ovenstory pizza Restaurant, Bais Godam",https://www.zomato.com/jaipur/ovenstory-pizza-bais-godam,400,Pizza,4.0,21, Delivery Only
"faasos Restaurant, Bais Godam",https://www.zomato.com/jaipur/faasos-bais-godam,550,"North Indian, Fast Food, Biryani, Rolls, Wraps",4.0,20, Delivery Only
"rj 14 juice shakes Restaurant, Mansarovar",https://www.zomato.com/jaipur/rj-14-juice-shakes-mansarovar,250,Juices,4.0,19," 79, Sultan Nagar, Gurjjar Ki Thadi, Mansarovar, Jaipur"
"roll express Restaurant, Mansarovar",https://www.zomato.com/jaipur/roll-express-mansarovar,300,Rolls,3.9,968," Shop 18, Shopping Centre, Patel Marg, Madhyam Marg, Sector 7, Mansarovar, Jaipur"
"shri hari pavitra bhojanalaya Restaurant, Sindhi Camp",https://www.zomato.com/jaipur/shri-hari-pavitra-bhojanalaya-sindhi-camp,500,North Indian,3.9,840," Opposite Sindhi Camp Bus Stand, Sindhi Camp, Jaipur"
"pakwaan Restaurant, Shastri Nagar",https://www.zomato.com/jaipur/pakwaan-shastri-nagar,700,"North Indian, Mughlai, Desserts, Beverages",4.3,361," Hotel Sarang Palace, A-40, Near Peetal Factory, Subhash Nagar, Near Shastri Nagar, Jaipur"
"kishan lal govind naraian agarwal lassiwala Restaurant, MI Road",https://www.zomato.com/jaipur/kishan-lal-govind-naraian-agarwal-lassiwala-mi-road,100,Beverages,4.3,196," Shop 312, MI Road, Jaipur"
"kebab nation Restaurant, Mansarovar",https://www.zomato.com/jaipur/kebab-nation-mansarovar,"1,100","North Indian, Italian",4.3,133," Shop 62 & 63, Basement, Plot 16, Santosh Nagar, New Sanger Road, Mansarovar, Jaipur"
"yes 99 cafe Restaurant, Lal Kothi",https://www.zomato.com/jaipur/yes-99-cafe-lal-kothi,400,"North Indian, South Indian, Fast Food",4.3,128," 7/8, Jai Kishan Colony, JP Colony Chauraha, Tonk Phatak, Barkat Nagar, Near Lal Kothi, Jaipur"
"king sweets Restaurant, Pink City",https://www.zomato.com/jaipur/king-sweets-pink-city,350,Mithai,4.3,152," Shop 149, Ghat Gate Bazaar, Nawab Ka Chouraha, Pink City, Jaipur"
"dagla rooftop Restaurant, Pink City",https://www.zomato.com/jaipur/dagla-the-rooftop-pink-city,900,"North Indian, Rajasthani, Italian",4.3,54," Haveli Kalwara - Between Shop 94 & 95, Indra Bazar, Pink City, Jaipur"
"pasta cucina Restaurant, C Scheme",https://www.zomato.com/jaipur/pasta-cucina-c-scheme,500,"Italian, Fast Food, Beverages",4.3,97," D 29, Subhash Marg, Panch Batti, Ashok Nagar, C Scheme, Jaipur"
"cake mania Restaurant, Sodala",https://www.zomato.com/jaipur/cake-mania-sodala,400,Bakery,4.3,97," 79, behind welcome hotel,  jaipur"
"cake studio Restaurant, Malviya Nagar",https://www.zomato.com/jaipur/cake-studio-malviya-nagar,200,"Bakery, Desserts",4.3,81," Shop No 15, Sector 6, Behind Deep Hotel, near Goyal Fancy Store, Malviya Nagar, Jaipur"
"apsara ice creams Restaurant, Malviya Nagar",https://www.zomato.com/jaipur/apsara-ice-creams-malviya-nagar,200,"Ice Cream, Desserts",4.3,56," House 3 & 4, Lal Bahadur Nagar, S L Marg, Malviya Nagar, Jaipur"
"kgf king great food Restaurant, Bais Godam",https://www.zomato.com/jaipur/k-g-f-king-of-great-food-bais-godam,400,"Fast Food, Chinese, North Indian",4.3,62," Shop 6-7, Sharma Colony Extansion, Near Mangal Manch, Swej Farm Road, Bais Godam, Jaipur"
"rolls wraps company Restaurant, Raja Park",https://www.zomato.com/jaipur/rolls-wraps-company-raja-park,550,"Fast Food, Chinese, Seafood",4.3,61," Lane 4, Raja Park, Jaipur"
"perk street Restaurant, Tonk Road",https://www.zomato.com/jaipur/perk-street-tonk-road,200,"South Indian, Italian, Street Food",4.3,40," 447, Mahaveer Nagar, Durgapura, Tonk Road, Jaipur"
"cake box Restaurant, Sikar Road",https://www.zomato.com/jaipur/cake-box-sikar-road,300,Bakery,4.3,42," Plot 627, Extension Road 9, Pratap Nagar, Sikar Road, Jaipur"
"cake plaza Restaurant, Bani Park",https://www.zomato.com/jaipur/cake-plaza-bani-park,200,"Bakery, Fast Food, Beverages",4.3,50," 32, Panipech, Bani Park, Jaipur"
"mughal samraat Restaurant, MI Road",https://www.zomato.com/jaipur/mughal-samraat-mi-road,250,Mughlai,3.1,14," 194, Jalupura Main Road, MI Road, Jaipur"
"god taste Restaurant, Khatipura Road",https://www.zomato.com/jaipur/god-of-taste-1-khatipura-road,150,Chinese,3.1,7," Opposite Marudhar Hospital, Khatipura Road, Jaipur"
"hotel h r palace Restaurant, Bani Park",https://www.zomato.com/jaipur/hotel-h-r-palace-bani-park,400,"North Indian, Fast Food",3.1,9," D-157A, Kabir Nagar, Bani Park, Jaipur"
"rajasthani dhaba Restaurant, Jhotwara",https://www.zomato.com/jaipur/rajasthani-dhaba-jhotwara,250,North Indian,3.1,10," 67, Laxmi Nagar, Jhotwara, Jaipur"
"shekhawati jaiyka Restaurant, Vidhyadhar Nagar",https://www.zomato.com/jaipur/shekhawati-jaiyka-vidhyadhar-nagar,200,Mithai,3.1,12," Shop G-10, Khetan Plaza, Central Spine, Vidhyadhar Nagar, Jaipur"
"nitin house restaurant Restaurant, Shastri Nagar",https://www.zomato.com/jaipur/nitin-house-restaurant-shastri-nagar,150,"South Indian, Chinese, Fast Food",3.1,11," Shop 206, Ram Nagar Shopping Centre, Shastri Nagar, Jaipur"
"ambiance Restaurant, Shastri Nagar",https://www.zomato.com/jaipur/ambiance-shastri-nagar,850,"North Indian, Italian, Fast Food",3.1,9," The Ashapurna Hotels, A 12, Near Pital Factory, Shastri Nagar, Jaipur"
"runway rooftop hotel airport view Restaurant, Tonk Road",https://www.zomato.com/jaipur/runway-rooftop-hotel-airport-view-tonk-road,700,"North Indian, Chinese",3.1,11," Hotel Airport View, Sanganer, Near Tonk Road, Jaipur"
"burger point Restaurant, Jagatpura",https://www.zomato.com/jaipur/burger-point-jagatpura,100,"Burger, Chinese",3.1,8," Bhairav Singh Circle, Sector 11, Pratap Nagar, Jagatpura, Jaipur"
"saini pavitre bhojnalya Restaurant, Sodala",https://www.zomato.com/jaipur/saini-pavitre-bhojnalya-sodala,400,North Indian,3.1,10," Near Shyam Nagar Metro Station, New Sanganer Road, Sodala, Jaipur"
"pizza fort Restaurant, Tonk Road",https://www.zomato.com/jaipur/pizza-fort-1-tonk-road,500,"Pizza, Fast Food",3.1,10," A-10, Shivpuri Colony, Near Subodh Girls College, Sanganer, Jaipur"
"nannas paratha veg restaurant Restaurant, Jagatpura",https://www.zomato.com/jaipur/nannas-paratha-veg-restaurant-jagatpura,300,North Indian,3.1,10," Shop 8 & 9, Gajanand Cloth Market, Shyopur Road, Sanganer, Jagatpura, Jaipur"
"thali nation take away Restaurant, Mansarovar",https://www.zomato.com/jaipur/thali-nation-take-away-mansarovar,500,"North Indian, Chinese, Fast Food",3.1,8," Under Ground, Shop Number 5, Patel Marg Shopping centre, Madhyam Marg, Mansarovar, Jaipur"
"veg food zone Restaurant, Sodala",https://www.zomato.com/jaipur/veg-food-zone-sodala,400,"North Indian, Fast Food",3.1,8," Shop 21, Vishva Nagar, New Sanganer Road, Sodala, Jaipur"
"radha govind bhojanalaya Restaurant, Gopalbari",https://www.zomato.com/jaipur/radha-govind-bhojanalaya-gopalbari,350,North Indian,3.1,12," Shop 6, Railway Station Road, Gopalbari, Jaipur"
"om sweet caterers Restaurant, Chitrakoot",https://www.zomato.com/jaipur/om-sweet-caterers-chitrakoot,200,"Mithai, Street Food",3.9,166," D.C.M, Ajmer Road, Chitrakoot, Jaipur"
"prasadam Restaurant, Shyam Nagar",https://www.zomato.com/jaipur/prasadam-shyam-nagar,300,"North Indian, Chinese, Fast Food",3.9,151," 1, Gokul Dham Apartment, Lane 6, Janpath, Ram Sati Nagar, Shyam Nagar, Jaipur"
"go satvik Restaurant, Raja Park",https://www.zomato.com/jaipur/go-satvik-2-raja-park,400,"Street Food, Salad, South Indian, North Indian",3.9,117," C 48, Adarsh Nagar, Raja Park, Jaipur"
"moustache headquarters Restaurant, MI Road",https://www.zomato.com/jaipur/the-moustache-headquarters-mi-road,900,"North Indian, Continental",3.9,104," 7, Park House, Near Ganpati Plaza, MI Road, Jaipur"
"dev hotel Restaurant, MI Road",https://www.zomato.com/jaipur/dev-hotel-mi-road,500,"North Indian, Chinese",3.9,132," 100-101, Nehru Bazaar, Near Ajmeri Gate, MI Road, Jaipur"
"get desserted Restaurant, C Scheme",https://www.zomato.com/jaipur/get-desserted-c-scheme,350,"Desserts, Ice Cream, Beverages",3.9,65," F 31, Azad Marg, Ashok Nagar, C Scheme, Jaipur"
"rolls station Restaurant, Malviya Nagar",https://www.zomato.com/jaipur/rolls-station-malviya-nagar,350,"Rolls, Fast Food",3.9,146," G/2-A, Plot 11/1, SVL Vaibhav Enclave, Girdhar Marg, Malviya Nagar, Jaipur"
"urban choolah Restaurant, C Scheme",https://www.zomato.com/jaipur/urban-choolah-c-scheme,450,"Chinese, North Indian",3.9,112," Shop 6, Mahaveer Marg, Opposite Mahaveer College, C Scheme, Jaipur"
"barista diner Restaurant, Vaishali Nagar",https://www.zomato.com/jaipur/barista-diner-vaishali-nagar,600,"Cafe, Beverages",3.9,57," Plot 1, Gautam Marg, Girnar Colony, Block E, Vaishali Nagar, Jaipur"
"baskin robbins Restaurant, Malviya Nagar",https://www.zomato.com/jaipur/baskin-robbins-1-malviya-nagar,300,"Ice Cream, Desserts, Beverages",3.9,118," 3rd Floor, World Trade Park, JLN Marg, Malviya Nagar, Jaipur"
"vada pav Restaurant, Jagatpura",https://www.zomato.com/jaipur/the-vada-pav-jagatpura,400,"Fast Food, Desserts, Beverages, Continental",3.9,174," House 145, Shop 26, Near water Tank PN, Jagatpura, Jaipur"
"bell pepper pizza Restaurant, Jhotwara",https://www.zomato.com/jaipur/bell-pepper-pizza-jhotwara,400,"Chinese, Italian",3.9,140," Shop 05-06, Basement, UB Building, Harnath Pura, Kalwar Road, Near N R Mart, Jhotwara, Jaipur"
"magic mile traditional food Restaurant, Vaishali Nagar",https://www.zomato.com/jaipur/magic-mile-traditional-food-vaishali-nagar,400,North Indian,3.9,147," 9, Queens Road, Besides Reliance Foot Print, Rathore Nagar, Vaishali Nagar, Jaipur"
"indian zaika Restaurant, Lal Kothi",https://www.zomato.com/jaipur/indian-zaika-lal-kothi,400,North Indian,3.9,118," NGV 2, Nehru Palace, Lal Kothi, Jaipur"
"chakhnachoor Restaurant, Civil Lines",https://www.zomato.com/jaipur/chakhnachoor-civil-lines,450,"Fast Food, Chinese",3.9,110," Opposite Metro Pillar 88, Civil Lines, Jaipur"
"burger buggy Restaurant, Chitrakoot",https://www.zomato.com/burger-buggy-1-food-truck,150,"Burger, Fast Food",3.4,33," Chitrakoot Stadium, Chitrakoot, Jaipur"
"cum n taste Restaurant, Tonk Road",https://www.zomato.com/jaipur/cum-n-taste-tonk-road,300,Chinese,3.4,29," 180/4, Sisodiya Tower, Sector 18, Pratap Nagar, Nri Circle Road, Tonk Road, Jaipur"
"chaman pavitra bhojnalaya Restaurant, Tonk Road",https://www.zomato.com/jaipur/chaman-pavitra-bhojnalaya-tonk-road,150,North Indian,3.4,27," Plot 7, Basant Bhaar Colony, Gopalpura Mod, Tonk Road, Jaipur"
"tigers cafe Restaurant, Vidhyadhar Nagar",https://www.zomato.com/jaipur/tigers-cafe-vidhyadhar-nagar,400,"Fast Food, Beverages",3.4,33," G-61, B-6, Ground Floor, City Star Tower, Central Spine, Vidhyadhar Nagar, Jaipur"
"tandoori taal Restaurant, Malviya Nagar",https://www.zomato.com/jaipur/tandoori-taal-malviya-nagar,400,North Indian,3.4,32," C 28, Ashok Vihar, Nandpuri, Malviya Nagar, Jaipur"
"al naimat Restaurant, Pink City",https://www.zomato.com/jaipur/al-naimat-pink-city,300,"North Indian, Biryani",3.4,18," 2902, 5th Crossing, Moti Singh Bhomio Ka Rasta, Ghat Gate, Pink City, Jaipur"
"wrapstick Restaurant, Raja Park",https://www.zomato.com/jaipur/wrapstick-raja-park,350,Fast Food,3.4,20," 514 A, Gali 5, Dhruv Marg, Raja Park, Jaipur"
"ankurit kachhori wala Restaurant, C Scheme",https://www.zomato.com/jaipur/ankurit-kachhori-wala-c-scheme,100,Street Food,3.4,29," D 38, Ashok Marg, Panch Batti, Ashok Nagar, C Scheme, Jaipur"
"shree shyam mishthan bhandar Restaurant, Tonk Road",https://www.zomato.com/jaipur/shree-shyam-mishthan-bhandar-tonk-road,300,"Mithai, Street Food",3.4,27," Near Bambala Bridge, Sanganer, Tonk Road, Jaipur"
"shri ganesh pavitra bhojanalaya Restaurant, Sindhi Camp",https://www.zomato.com/jaipur/shri-ganesh-pavitra-bhojanalaya-sindhi-camp,350,North Indian,3.4,26," 1306, Sanjay Circle, Chandpole Gate, Sindhi Camp, Jaipur"
"indian kulfi faluda Restaurant, MI Road",https://www.zomato.com/jaipur/indian-kulfi-faluda-mi-road,150,Ice Cream,3.4,23," 28, Link Road, Bapu Bazaar, MI Road, Jaipur"
"naya zaika Restaurant, Mansarovar",https://www.zomato.com/jaipur/naya-zaika-mansarovar,550,Rajasthani,3.4,30," Shop 1, Thadi Market Choraha, Madhyam Marg, Mansarovar, Jaipur"
"kitus snack bar Restaurant, Adarsh Nagar",https://www.zomato.com/jaipur/kitus-snack-bar-adarsh-nagar,450,"Fast Food, Beverages",3.4,17," 59 & 60, Bees Dukan, Adarsh Nagar, Jaipur"
"yummy bites cafe Restaurant, Amer Road",https://www.zomato.com/jaipur/yummy-bites-cafe-amer-road,500,"Fast Food, Beverages",3.4,21," 1288/1, Rajawat House, Near Jai Siya Ram, Gangaple, Jaipur"
"tea stories Restaurant, Bais Godam",https://www.zomato.com/jaipur/tea-stories-bais-godam,250,"Tea, Fast Food",3.4,21," Shop 2, Plot 2, Crystal Palm, Sardar Patel Marg, C-SCH, Bais Godam, Jaipur"
"dosa affair Restaurant, Vaishali Nagar",https://www.zomato.com/jaipur/dosa-affair-1-vaishali-nagar,300,"South Indian, Fast Food",3.8,118," F 153, Dayanand Marg, Near Community Hall, Amrapali Marg, Vaishali Nagar, Jaipur"
"papaya Restaurant, C Scheme",https://www.zomato.com/jaipur/papaya-c-scheme,200,"Fast Food, Beverages",3.8,227," F 74, Salasar Enclave, Bagadia Bhawan, Subhash Marg, C Scheme, Jaipur"
"doors Restaurant, MI Road",https://www.zomato.com/jaipur/the-doors-mi-road,400,"North Indian, South Indian, Chinese, Beverages",3.8,208," Khandaka Mansion, Near Raj Mandir Cinema, MI Road, Jaipur"
"abdul bari old take away Restaurant, MI Road",https://www.zomato.com/jaipur/abdul-bari-old-take-away-1-mi-road,600,North Indian,3.8,213," Shop 242, Opposite Golden Tulip, MI Road, Jaipur"
"belgiums waffle station Restaurant, Sodala",https://www.zomato.com/jaipur/belgiums-waffle-station-sodala,500,"Desserts, Fast Food, Beverages",3.8,162," LG-6, Ground Floor, Okay Plus Big Ben Tower, Swej Farm, New Sanganer Road, Near Sodala, Jaipur"
"laxmi sweet caterers Restaurant, Sodala",https://www.zomato.com/jaipur/laxmi-sweet-caterers-sodala,400,"Mithai, North Indian, South Indian, Fast Food",3.8,215," Ajmer Road, Sodala, Jaipur"
"swamy cafe Restaurant, Raja Park",https://www.zomato.com/jaipur/swamy-cafe-raja-park,300,South Indian,3.8,160," 465, Lane 4, Raja Park, Jaipur"
"small town cafe Restaurant, Raja Park",https://www.zomato.com/jaipur/small-town-cafe-1-raja-park,300,Cafe,3.8,142," Plot 197, Ram Gali 2, Raja Park, Jaipur"
"uncle mess restaurant Restaurant, Malviya Nagar",https://www.zomato.com/jaipur/uncle-mess-restaurant-malviya-nagar,300,"North Indian, Fast Food",3.8,204," 3/234, Near Community Hall, Malviya Nagar, Jaipur"
"11mg Restaurant, Mansarovar",https://www.zomato.com/jaipur/11mg-mansarovar,400,Cafe,3.8,135," 2/131, Shop 3, SFS Colony, Opposite HDFC Bank, Mansarovar, Jaipur"
"jmd bakery fast food Restaurant, Tonk Road",https://www.zomato.com/jaipur/jmd-bakery-fast-food-tonk-road,300,"Bakery, Fast Food",3.8,189," Shop 5, Meena Colony, Opposite BMW Showroom, Tonk Road, Jaipur"
"dhola maru hotel clarks amer Restaurant, Malviya Nagar",https://www.zomato.com/jaipur/dhola-maru-hotel-clarks-amer-malviya-nagar,"3,000","Mughlai, Rajasthani, North Indian, Kebab",3.8,143," Hotel Clarks Amer, Jawaharlal Nehru Marg, Near Malviya Nagar, Jaipur"
"khandelwal pavitra bhojnalaya Restaurant, Sindhi Camp",https://www.zomato.com/jaipur/khandelwal-pavitra-bhojnalaya-sindhi-camp,400,North Indian,3.8,179," 3/4, Near Sindhi Camp Bus Stand, Sindhi Camp, Jaipur"
"kulcha cafe Restaurant, Mansarovar",https://www.zomato.com/jaipur/the-kulcha-cafe-mansarovar,200,North Indian,3.8,196," 71/28B, Near Mansarovar Plaza, Madhyam Marg, Mansarovar, Jaipur"
"riddhi juice bar ice cream parlour Restaurant, Tonk Road",https://www.zomato.com/jaipur/riddhi-juice-bar-ice-cream-parlour-tonk-road,200,"Beverages, Juices, Desserts",3.8,194," 6A, Vinayak Vihar, Dalda Factory Road, Durgapura, Tonk Road Jaipur"
"good tasty Restaurant, Mansarovar",https://www.zomato.com/jaipur/good-tasty-mansarovar,300,North Indian,3.3,9," B-26, 10-B, Riddhi Siddhi Nagar, Gopalpura Bypass, Mansarovar, Jaipur"
"cafe a2a Restaurant, Amer",https://www.zomato.com/jaipur/cafe-a2a-2-amer,450,"Fast Food, Chinese, North Indian",3.3,11," Elephant Stand, Amer, Jaipur"
"village food Restaurant, Lal Kothi",https://www.zomato.com/jaipur/the-village-food-lal-kothi,300,"Rajasthani, North Indian",3.3,13," Plot 2, Satya Vihar, Opposite Jain ENT Hospital, Lal Kothi, Jaipur"
"mmpd thali house Restaurant, Shyam Nagar",https://www.zomato.com/jaipur/mmpd-thali-house-shyam-nagar,200,North Indian,3.3,13," 120 A, Paraswanath Colony, Nirman Nagar, Shyam Nagar, Jaipur"
"cafe lazymojo Restaurant, C Scheme",https://www.zomato.com/jaipur/cafe-lazymojo-c-scheme,800,"Cafe, Italian, Continental",NEW,," K 7, Malviya Marg, C Scheme, Jaipur"
"hotel aashish Restaurant, Gopalbari",https://www.zomato.com/jaipur/hotel-aashish-1-gopalbari,700,"North Indian, South Indian, Chinese, Fast Food, Finger Food",3.3,12," Opposite Hathroi School, Ajmer Road, Gopalbari, Jaipur"
"cafe pubg Restaurant, Malviya Nagar",https://www.zomato.com/jaipur/cafe-pubg-1-malviya-nagar,200,"Cafe, Chinese",3.3,14," Shop 12, D Block, Shopping Center, Malviya Nagar, Jaipur"
"yess boss juice cafe Restaurant, Jagatpura",https://www.zomato.com/jaipur/yess-boss-juice-and-cafe-jagatpura,300,"Juices, Fast Food, Beverages",3.3,12," Mahima Bellavista Apartment, Near JNU Silas Campus, Jagatpura, Jaipur"
"shyam bhojanalaya Restaurant, Sindhi Camp",https://www.zomato.com/jaipur/shyam-bhojanalaya-sindhi-camp,250,North Indian,3.3,11," Near Polo victory Cinema, Sindhi Camp, Jaipur"
